label	data
1	It might be that you decide the log4j async appender is not appropriate URL_http://glueclue.blogspot.com/2007/01/log4j-asyncappender-is-not- always_31.html [(here-are-some-complaints-about-it)] , you could always make your own appender.
1	How about: CODESNIPPET_JAVA1 .
1	However for smaller gui applications that doesnt require rich user interfaces.
1	AWT might however look somewhat ugly on some operating systems.
0	And as a personal comment, Looks very interesting!
1	Dont forget URL_http://jibx.sourceforge.net/ [JiBX] .
1	Youll need to dig around to really see it working since this project is not designed as a demo as such and is very much a work in progress.
1	Is there any good dynamic SQL builder library in Java?
0	Apache Tika is an excellent suggestion.
1	AWT components are platform-dependent.
1	At this moment I am using this: CODESNIPPET_JAVA1 .
1	@Guillaume Cot I guess the message here is that you never should be fine with the default encoding, since you cannot be sure of what it is, depending on the platform the java code is run on.
0	Thanks in advance.
0	I am omiting repetitions, but the 3 CODETERM1 s are part of the primary key, of the @Id.
0	Directly connecting to clients could be problematic for many reasons: they could be behind firewalls that disallow that, they could be behind proxies and so on.
1	Glassfish however, just seems to work.
0	I looked at Googles Gson as a potential JSON plugin.
1	This will take care of Spring, and any other framework that uses JCL.
1	@willcodejavaforfood: Sounds like a good decision.
1	But it is also a cogent response to Whats Up with Logging in Java?.
0	But some are slow, some are buggy, some are incomplete.
0	i know this is an old question but Id like to point future viewer of the question to URL_https://github.com/Netflix/astyanax [Astyanax] .
0	Can you define good?
0	I dont know.
0	In this case, generate the salt with a cryptographic random number generator each time the password is changed.
1	I ran some timing tests because time matters, always.
0	As of today, there are a lot of themes around.
1	Best regards,Jerome Louvel .
0	(shown below) I left out try/catch blocks for the sake readability.
1	I need to build the server side of a JSON-REST API, and Ive been playing with Jersey to do it (using its JSON-POJO mapping feature).
1	3.
0	Youll probably share the salt (for key derivation) one time, at the same time you set up the password itself.
0	What if the file is on a network share or SAN?
0	In short, we had to implement some sort of custom SSO between a couple of related webapps.
1	Otherwise, its been awesome.
1	I just thought Java would still treat it like one single line.
0	URL_https://github.com/AsyncHttpClient/async-http-client [Ning-Async-http-client] .
1	Not for a mobile app.
0	) interface.
1	JBoss Messaging replaces JBoss MQ.
1	Charsets.UTF_8) for the CODETERM1 isnt necessary, but it is generally a good idea to specify the encoding if you know it (which you should!
0	I know many developers would like to have this.
0	Commons Lang has an implementation of URL_http://commons.apache.org/lang/apido cs/org/apache/commons/lang3/StringUtils.html#getLevenshteinDistance%28java.lan g.CharSequence,%20java.lang.CharSequence%29 [Levenshtein-distance] .
1	Why not just use a reader?
1	Something simple is preferred.
1	Miglayout is so much simpler than Swings perceived 200 different layout managers and much more powerful.
1	The sun java security stuff was just too buggy to work in a compatible manner.
1	Please provide the xsd, without it its difficult to guess the issue, or recreate it.
1	These serializers are so slow, they would break the scale of our charts.
1	Heres for the step-by-step installation: URL_https://sites.google.com/site/teachmemrxymon/java/create-java-gui-as-easy- as-visual-basic [Create-Java-GUI-as-Easy-as-Visual-Basic] !
1	_Why doesnt java (which is the most widely used programming language in the world) have the same set of GUI components?_ Is it just that java has based their gui components at a much lower level, and it is possible to write all these advanced components that im looking for, but you have to do much if not all of the work yourself?
1	Its not a rewrite, really, it shares nothing in common with JBossMQ at all, other than being a JMS implementation with JBoss in the title.
1	First, we tried to look at how the business layer alone could be exposed to other web apps, and Spring offers JMX wrapping at the price of a tiny amount of XML.
1	Also, at least in my scenario, HUC is noticeably faster (mostly single-threaded, havent done any testing under heavy load).
1	) is to implement polling in the client.
0	Dean isnt the first one here to confuse those two.
1	I have done a similar research in JAAS for web application and has ran into a mind roadblock until I finally realize JAAS is a framework tackling security at a different layer then web applications in the Java World.
1	Heres a short update: The solution which appears to be the most viable is EJB.
0	Luckily I am already using this jar, so i could use this straight away.
1	I attempted to get the response into a String 3 different ways.
1	Good find.
0	The XStream library also supports JSON: URL_http://xstream.codehaus.org/json- tutorial.html [ URL_http://xstream.codehaus.org/json-tutorial.html ] .
1	Of course, you could choose other character encodings besides UTF-8.
0	: URL_http://mac.softpedia.com/get/Math-Scientific/JIRRM.shtml [ URL_http://mac.softpedia.com/get/Math-Scientific/JIRRM.shtml ] (Java based) URL_http://projectiris.co.uk/ [ URL_http://projectiris.co.uk/ ] (QT based -but there are more QT <-> Java bridges) but personally I havent used in production (just for testing) these 2 libraries since the documentation is not very good/detailed, and since this kind of problem is quite cutting edge so the documentation and an explanation paper is much more important than any source code.
0	I recommend the URL_http://jackson.codehaus.org/ [jackson-library] it makes things very easy.
0	We used COMET in conjunction with JMS using URL_http://www.ibm.com/developerwo rks/websphere/techjournal/0802%5Fhaverlock/0802%5Fhaverlock.html [WAS-Web-2.0 -Feature-Pack] ; in effect the server did the JMS subscribe and COMET-pushed the message to the browser.
0	 URL_http://en.wikipedia.org/wiki/Apache_Pivot [Apache-Pivot] It renders UI using Java2D, thus minimizing the impact of (IMO, bloated) legacies of Swing and AWT.
0	Only thing is that I dont understand why a character is added before the actual XML.
0	If I were in your shoes, Id go with this option just because I know that it would show great performance, there are mature tools for working with MySql, many people have experience with it and at any time you can easily use all its relational potential if you eventually decide to go back to RDBMS solutions.
1	Id appreciate some advice/help/opinions on the following points.
0	I remember lying in bed one night at about 2am wondering how hard could it be, after a bit I got up and started writing - URL_http://www.softwaremonkey.org/Code/JsonParser [this-tiny-parser-is-the- result] .
0	Problem is jaxb and xmlbeans require a mapping schema and arent auto ...
0	@ArchimedesTrajano Not with the Java Cryptography Architecture.
0	 Option 1 Disable CODETERM1 (your second jboss-web.xml), bundle your Hibernate JARs into your app and add the following properties to your CODETERM2 (to avoid the issue youre facing): CODESNIPPET_JAVA1 .
0	You cannot scope them by class/package but that should not be a problem in this case because the breakpoint needs to be activated only one execution reaches the chained getters.
1	The SPI (service provider interface) defines them, and you can extend the API to define your own.
1	It is really powerful and has some very nice feature, especially after implementing everything by hand as I did before !
0	I have always coded my UIs by hand.
0	Choose Take GUI Snapshot to make a screenshot of the application GUI that serves as a basis of the Visual Debugger functionality.!
1	There are some nice GUI builders available (e.g.
0	I tried the project iris tool.
0	Please help me if i am missing something in the code??..
1	How about: CODESNIPPET_JAVA1 .
1	How do you find it?
0	Active MQ vs JBoss Messaging.
0	 Where as in swing components its the responsibility of to generate the view for the components.
1	Getters should never contain side-effect logic, this muddles the code and causes even more confusion than the original problem.
1	If you are using Google-Collections/Guava you could do the following: CODESNIPPET_JAVA1 .
0	 This is a hack that will let us limit our risk, even on 1.4.2 JVMs: Command line params: CODESNIPPET_JAVA1 .
0	Implement this filter to just keep track of the number of bytes going through it (apache commons io may have such a utility in it already).
1	I would not start a large desktop application (or one that is going to be large) without a good platform that is build upon the underlying UI framework.
0	I like the URL_http://www.netbeans.org/features/java/swing.html [Swing-GUI- Builder] from the URL_http://www.netbeans.org/ [NetBeans-IDE] .
0	The J2ME version is not thread safe.
1	Usually I use URL_http://jaxb.java.net/ [jaxb] or URL_http://xmlbeans.apache.org/ [XMLBeans] if I need to create objects serializable to XML.
0	use of annotations) it is not convoluted to get to the values of parameters (e.g.
1	Very important for the various Apache projects, which will be linked into outside applications.
0	Also beware of initializing a CODETERM19 with a CODETERM20 as that will only allocated the size of the String + 16 characters, which in most cases will just start the degenerate re-allocation and copy cycle that you are trying to avoid.
0	A better Java JSON library?
0	Basically, if null is a valid response, you have to check for it.
0	Frederick, I think your link should be in an answer, or at least mentioned in bigger text in the question.
1	The former is for funneling to your desired logging framework (log4j, logback, etc), the latter is to replace the used logging framework.
1	You could easily build a little war file that achieved the same purpose via a socket connection.
0	Well, json.org default lib is rather rudimentary.
1	Any plans to support circular dependencies in the near future?
1	@Thimmayya: then this is a rhetorical question.
0	At the end of the day, I have worked with different similar UI tools, Flash Builder, Delphi etc., but unless you do some relatively trivial UI design, not including much business logic and communication with other layers, youll have to accept that what you are capable of creating in code once you learn to do it properly is much more powerful than what any editor is capable of providing you with.
1	Example: JSONObject#getNames(JSONObject) returns null instead of an empty List or array if no names are available.
1	Also no documentation visible...
1	isnt it better to close stream/streamreader ?
1	(There are better 3rd party native looking skins than Swings implementations BTW) Lots of people preferred using AWTs FileDialog over Swings FileChooser because it gave the platform file dialog most people were used to rather than the weird custom Swing one.
1	I have been developing Eclipse-based applications and plugins for almost 5 years now, so Im clearly biased.
1	URL_http://about.validator.nu/htmlparser/ [Validator.nus-HTML-parser] , definitely.
1	;) You could use XML or JSon with XStream.
0	Back then I had a desire for control of the deserialisation, but nowadays I would use Jackson and decently annotated model classes.
0	Say Im planning to build a web application and some of the functional requirements include (apart from the usual hard hitting security reqs),- Need to have users sign up for a new account profile- Authenticate user using the native app authentication / Facebook or Google or Yahoo or OpenId login- Allow lost password retrieval- Session handling needs Is there an out of the box frameworks (Drupal, Liferay, Tapestry with Tynamo, Wicket ??
1	Possible typo?
0	I was not always aware of this contract thingy.
1	Sure, they have done things to reduce complexity, like creating custom XML namespaces to reduce the quantity of XML configuration, but for me, these dont address _my_ personal fundamental issue with Spring Security: its names and concepts are often confusing in general to me.
1	 You use URL_http://java.sun.com/javase/6/docs/api/java/lang/StringBuilder.html [CODETERM3] when you need to create a mutable character sequence, usually to concatenate several character sequences together.
0	I think this should be public String convertStreamToString .
1	Problems with web.xml creating a HTTP Status 500 error - The server encountered an internal error () that prevented it from fulfilling this request , the tutorial says: Create a new Servlet Web application as usual, add a com.firstStepsServlet package and put the resource and application classes in.
1	I want to note one thing: old doesnt mean bad.
1	Well, usually its actually A + B + C because people are lazy ;) I tended to always use a StringBuilder, even if it was only two strings being concatenated, because in future, perhaps more strings would be appended.
1	However with Java 5 (or 6?
1	Heres how it describes itself: Gson is a Java library that can be used to convert Java Objects into its JSON representation.
0	 awt is not mvc based.
1	Uploading or downloading?
1	Ive been meaning to try URL_http://flexjson.sourceforge.net/ [Flexjson] .
1	Thanks Jay, this looks promising, Ill check it out.
1	Thx.
1	@Dean: The application framework was a JSR planned for Java 7, now deferred.
1	Only works for closes streams, I believe.
0	I dont see much similarities between the two (which I think is good thing for GSON).
1	 Suppose I have an CODETERM3 that contains text data, and I want to convert this to a CODETERM4 (for example, so I can write the contents of the stream to a log file).
0	As soon as either happens the client opens a new connection.
1	Make sure you read the Readme-file on how to install it.
0	The only drawback I noticed is that I cant create objects id on my own for cross referencing.
1	Try URL_http://hc.apache.org/httpcomponents - client-ga/index.html.
0	 Note that SwingX is components (AFAIU) that are extensions or compositions of existing Swing components A framework which i know nothing about... What is its strengths and weaknesses?
0	Oddly, the only decent JSON processor mentioned so far has been GSON.
1	URL_http://commons.apache.org/io/apidocs/org/apache/comm ons/io/IOUtils.html#copy(java.io.InputStream,%20java.io.Writer,%20java.lang.St ring).
1	Thanks in advance!
1	A comment on issue 232 includes the possible changes necessary to enable getter support.
1	To increase download speeds, the file is chunked and each chunk is downloaded concurrently (using the HTTP CODETERM1 header) to use as much bandwidth as possible.
0	The problems started when Sun actually added java.util.logging to Java 1.4.
1	Server sends messages up there - right?
1	They all have their strong and weak sides, for example how easy they integrate with Spring.
1	You want to set HTTP response codes, map incoming and outgoing bodies to objects, and other stuff.
1	It is not the fastest possible solution but it is simple enough to program to justify the lack of performance for the user until now.
0	I.e., we have to remove some dependencies from our WARs and move them to server/lib, else we get ClassCastException when the business layer returns objects from our own domain model.
0	Note that if you test your server from a different machine, you need to replace localhost by either the IP address of your server or its domain name if it has one defined.
1	I personally like Jetty HttpClient a lot.
0	Would result in the following file: CODESNIPPET_JAVA3 .
0	I wish to print a CODETERM1 object as nicely as the Eclipse debugger does, i.e., CODETERM2 etc, but printing it with CODETERM3 doesnt return this nice result.
0	The latest version includes URL_https://visualvm.dev.java.net/ [VisualVM] for profiling.
1	The problem is that it doesnt map to SQL as I understand, right?
1	Doesnt it allow to parse nasty HTML?
0	You have a URL_http://commons.apache.org/lang// api-2.4/org/apache/commons/lang/StringUtils.html#leftPad%28java.lang.String,%2 0int,%20char%29 [leftPad] method: CODESNIPPET_JAVA1 .
0	I was wondering about String.format().
0	Can we downvote all the people who voted this closed as not constructive?
0	I wrote a blog post about URL_http://guidogarcia.net/blog/2012/03/02/how-to-develop-java- rest-client/ [how-to-develop-a-Java-REST-client] if you want a getting started guide.
1	I am having a very strange behavior in JBoss, and Id like avail myself of the Collective Wisdom of the SO Crowd.
0	What Java implemenations exists?
1	Its strictly what youre used to.
0	For example, we have a lot of components without public no-arg constructor (e.g.
0	Call URL_http://java.sun.c om/javase/6/docs/api/java/lang/StringBuilder.html#ensureCapacity%28int%29 [CODETERM22] with the size you want to ensure your resulting CODETERM23 will fit into.
1	Is URL_http://bouncycastle.org/java.html [Bouncy-Castle-API] Thread Safe ?
0	java.nio is much more efficient, but can be hairy to code around.
0	So code could be simplified slightly.
0	From URL_http://weblogs.java.net/blog/pat/archive/2004/10/stupid_scanner.html [this-page] the one-line solution: CODESNIPPET_JAVA1 .
1	A look at the URL_http://grepcode.com/file/repo1.maven.org/maven2/org.springfr amework.security/spring-security-core/3.1.4.RELEASE/org/springframework/securi ty/crypto/encrypt/AesBytesEncryptor.java#53 [internals] reveals a structure similar to URL_http://stackoverflow.com/a/992413/277307 [ericksons-answer] .
0	@Troelsen yes correct!.
0	However, isnt there a security risk here of sending password in plain text?
0	crtmbrcbk.invoke(crtprm,psr,tgt,nam,psr.getMemberValue()); What are you, Polish?
1	To save memory, do not unnecessarily store/duplicate the data in memory (i.e.
0	promising to be the facto standard in developing rich desktop or web applications.
1	The configurations it ships with are just starting points.
0	Anyone else has a better sollution?
0	Is this the case ?
1	One Line Solution CODESNIPPET_JAVA1 .
0	CODESNIPPET_JAVA1 .
0	It will stream in the data so it doesnt need to preload the whole file first.
0	for example: _Lets meet next tuesday at 5 PM at the beach._ So the output will be something like : _Lets meet 15/09/2009 at 1700 hr at the beach_ So basically, what i want to know is that there any framework or library available for JAVA to do these kind of operations like parsing dates from a sentence and give a output with some specified format.
1	URL_http://java.sun.com/javase/6/docs/api/java/lang/StringBuilder.html [CODETERM2] is a mutable class that can be appended to, characters replaced or removed and ultimately converted to a CODETERM3 CODETERM4 is the original synchronized version of CODETERM5 You should prefer CODETERM6 in all cases where you have only a single thread accessing your object.
1	I cant _truly_ recommend this, because Ive never used it, but URL_http://jackson.codehaus.org/ [Jackson] sounds promising.
0	I would be more concerned about using a proprietary library that hasnt released so much as a patch in a couple of years.
1	Is it really more simple?
1	(2) JBoss is also modular, you pick which modules you want.
1	Trying to implement this with Dougs code below.
1	What is the difference between swing and awt?
1	YES!
1	Frankly, Ive never seen an editor which comes even close to what I can do manually in a text editor.
1	JAXB 2.0 also has support for JSON serialization using Jettison.
0	well its not worth a -1 vote ;P But something to ponder about.
0	] .
0	You might want to list some of the nice features, since there are so many alternatives -- project page lists many, although most exist in other libs as well.
0	I came out to this which is really simple and it works perfect.
0	@jmort253 Many libraries are large, slow but powerful.
0	:) .
1	Its a crime that code generation is the default way to layout code in Java because better ways of doing GUIs have been around for decades.
0	I agree this is something IDEs should improve upon.
1	Regarding available: This will cut off data if the stream is longer than the buffer size.
1	The other option is SWT together with the Eclipse RCP, but its harder (though not impossible) to integrate pure Swing components into such an application.
0	Ive added the encoding.
1	C# equivalent to Javas charAt()?
0	Actually Ive recently done some work in a system that was still running under jdk 1.3 :-(, and it was less than two years ago I was last maintaining a 1.2** system.
0	It provides a lot of great features, also a intuitive DSL for SQL and a extremly customable reverse- engineering approach.
1	but still had difficulties.
0	Many times, good enough is good enough.
1	Heres an option from my URL_http://northconcepts.com/data-pipeline/ [data- migration-library] that uses xpath plus the built-in, generic record class instead of creating a new bean class.
1	Its easier and faster to just read arbitrary buffers.
0	URL_http://code.google.com/javadevtools/wbpro/ [WindowBuilder-Pro] for Eclipse Free!
0	The new try-with-resources will auto-close the Scanner, which will auto-close the InputStream.
0	Yeap.
0	Or use repeat(), which doesnt require the empty string at the start and is arguably clearer in intent (see my answer).
1	2.
0	Thus Swing is 100% portable and is the same across platforms (although it is skinnable and has a pluggable look and feel that can make it look more or less like how the native windows and widgets would look).
1	Damn, people around here are getting used to newbie questions and dont expect any better.
0	After reading through ericksons suggestions, and gleaning what I could from a couple other postings and this example URL_http://cs.saddleback.edu/rwatkins/CS4B/Crypto/FileEncryptor.html [here] , Ive attempted to update Dougs code with the recommended changes.
1	So, it is recommendable to use CODETERM4 ( unless of course you have more than one thread accessing to it at the same time, which is rare ) CODETERM5 concatenation ( _using the + operator_ ) may be optimized by the compiler to use CODETERM6 underneath, so, it not longer something to worry about, in the elder days of Java, this was something that everyone says should be avoided at all cost, because every concatenation created a new String object.
1	For example, the JSONObject and the JSONArray classes.
1	If so, DarkSquids approach using SecretKeySpec should work.
1	+1 for the package com.stackoverflow.q1688099;.
0	 swing componets are light weight.
1	Here we will get the representation of an existing resource and output it in the JVM console: CODESNIPPET_JAVA1 .
1	Im a big fan of JetBrains, and when it comes to Java, URL_http://www.jetbrains.com/idea/index.html [IntelliJ] is the best IDE I have used.
0	I find the pull metaphor much more usable than the event metaphor, and creating a document tree using pull is trivial.
0	Timeouts are set like this CODETERM2 the input parameter is in milliseconds .
0	StringBuffer is the exact same thing as of StringBuilder except that all his method are synchronized.
1	If you want to influence the representation in XML/JSON to a larger degree than just naming tags and ignore properties, youll be better of using one of the other libraries mentioned above.
1	highly concurrent at any rate.
0	GFv3 is significantly smaller than JBoss 5 and will start much faster.
0	In fact, its not a matter of fine or not; its a matter of which is CORRECT.
1	?
1	 Bar** The CODETERM1 in Swing is easy enough to use.
0	Could you comment on 1.
1	Does this usage of SecureKey and PBEKeySpec produce a Password-based key that is RFC2898-compliant?
0	Yeah that is not true.
1	Is Bouncy Castle API Thread Safe?
0	First, note that I work for a NoSQL vendor, URL_http://gigaspaces.com/ [ URL_http://gigaspaces.com/ ] - Im not unbiased.
1	But this is also for transforming into well XMLs.
1	Check out URL_http://code.google.com/p/resting [Resting] .
1	You can use apache commons.In the IOUtils you can find the toString metod with 3 helpfull implementations.
0	How can I get a nice printable version of the stack?
1	jmonkeyengine is only for games.
0	WindowBuilderPro is really the viable (free) alternative for Eclipse.
0	@ArchimedesTrajano does IOUtils.copy(inputStream, writer, encoding) deal with CR/LF translations better?
1	If CSS is in a <style> tag, it will be interpreted as text.
0	Also, you can still use Spring for much of your work, as I understand, but Im not a Spring person so I can not speak to the details.
0	).
0	I especially like being able to switch back and forth between using a tree model (similar to XML DOM) and object mapping.
0	Samiksha, make that another question instead of trying to have a discussion thread in these comments.
1	@mKorbel SAF is deprecated, Swing is not.
1	There are 9 in the comment.
1	If your aim is professional desktop application, make sure it delivers what you need.
1	No no no... Dropwizard supports OAuth2 on the back end - so you would implement your own OAuth2 service, and then have the browser perform the auth handshake with it; completely independent from Google, et al.
1	If youre running inside your ide you can just set a breakpoint and use the evaluate expression functionality of your ide on each element successively.
0	See my comment on Michael Borgwardts post.
1	Run a proxy client on the debugging workstation that also encrypts/decrypts the input.
0	} And these are ivBytes and a random key; CODESNIPPET_JAVA2 .
1	I assume it has improved in the past year - they seem to add features in gobs and heaps, quite often.
1	Its not difficult, but you have to URL_http://java.sun.com/javase/6/docs/tech notes/guides/security/crypto/HowToImplAProvider.html [read-through-the- documentation-on-how-to-do-that] .
