label	data
0	I like XStream.
1	URL_http://www.querydsl.com/ [Querydsl] and URL_http://www.jooq.org [jOOQ] are two popular choices.
1	Most servers have built-in SPNEGO support, so you shouldnt have to code something like an applet to do your authentication.
0	If not, assert it (if you can).
1	Advantages: Single language skills?
0	In this case, the standalone mode is probably a better fit.
1	[enter image description here]( URL_http://i.stack.imgur.com/HRrVE.gif ) here is a picture URL_http://netbeans.org/ [netbeans] built in URL_http://netbeans.org/features/java/swing.html [Gui-Builder] :** !
1	But one thing that should help you specifically is that one of the later chapters of the book contains overviews of several RESTful frameworks, including Restlet.
1	URL_http://www.antlr3.org/grammar/list.html [ANTLR] has an ANSI SQL grammar available.
1	@Per Wiklander I disagree with you.
0	Funnily enough I have just ordered RESTful Web Services on Amazon before I read your post.
0	But who just wants to do that?
1	Its old but should help with the JAAS basics.
0	I provides a great introduction to REST: what it is and how to implement a (practical) RESTful web service.
1	The alternative is to poll for changes at regular intervals, but that may create a delay in the event reaching a client.
0	As with JavaFX, its missing some higher level components like a tree table component ( URL_https://issues.apache.org/jira/browse/PIVOT-306 [PIVOT-306] ).
0	Note that if you are using Java 5 or newer, you should use CODETERM1 instead of CODETERM2 .
0	URL_http://lucene.apache.org/java/docs/index.html [ URL_http://lucene.apache.org/java/docs/index.html ] .
1	Using the URL_http://commons.apache.org/io/api-1.4/org/apache/commons/io/FileU tils.html#deleteDirectory%28java.io.File%29 [FileUtils.deleteDirectory()] method can help to simplify the process of deleting directory and everything below it recursively.
0	Note.
0	The program asks for the next element when its ready just like a cursor/iterator.
0	If it was rubbish, I would not have been motivated to correct one minor misunderstanding.
1	But this just encourages programming that spots the bug in the wrong place.
1	Probably.
0	For some projects we put together, logging framework was more driven by the open source frameworks we were using.
1	Is Java Swing still in use?
1	Ive used URL_http://json-lib.sourceforge.net/ [JSONLib] , URL_http://flexjson.sourceforge.net/ [FlexJSON] and URL_http://code.google.com/p/google-gson/ [Gson] all with great success.
1	@jmort253 We noticed performance regression after updating some library in our product for several times.
1	4.
1	Id recommend taking a look at Apache Shiro: URL_http://shiro.apache.org/ [ URL_http://shiro.apache.org/ ] It handles the security portion of your application and gives you a great deal of flexibility in how to secure things.
0	but for the 98% case, I think its pretty solid.
0	You to know and specify the character encoding for the stream, or you have character encoding bugs, since you will be using a randomly chosen encoding depending on which machine/operating system/platform or version thereof your code is run on.
1	A nice way to do this is using URL_http://commons.apache.org/ [Apache-commons] URL_http://commons.apache.org/proper/commons- io/apidocs/org/apache/commons/io/IOUtils.html [IOUtils] to copy the CODETERM1 into a CODETERM2 ... something like CODESNIPPET_JAVA1 .
1	It has many problems and I imagine a lack of direction lead it into the mess it is today.
0	see update in my answer.
1	In order to make your code work, I had to use this.getClass().getClassLoader().getResourceAsStream() (using Eclipse with a maven project).
1	Anyway, what is the content of the objects in the SAX2EventRecorder?
1	The number of connections youre talking about tells me you should use java.net.
1	 more edit:** nixed try/catch, Patricks way is more laconic.
1	With Terracotta you can cluster a single Hibernate L2 cache.
0	 Option 2 Disable CODETERM3 (your second jboss-web.xml), bundle your Hibernate JARs into your app and override the hibernate-validator JARs CODETERM4 
0	); I am also in the company behind Querydsl.
0	Can you make some examples, please?
0	URL_http://java.sun.com/javase/6/docs/api/java/net/HttpURLConnection.html In particular, getHeaderField, getHeaderFieldKey, and getContent.
0	If youre looking for a simple stable implementation of a NoSQL DB system, look no further than Apache (they have over 10 years of development experience).
0	Note that the second parameter (i.e.
0	) See also the URL_http://c2.com/cgi/wiki?LawOfDemeter [Law-of-Demeter] , which says: Your method can call other methods in its class directly Your method can call methods on its own fields directly (but not on the fields fields) When your method takes parameters, your method can call methods on those parameters directly.
1	My impression is that if the underlying model uses lazy loading, then thats enough.
0	Because such a constructor does not exist, and you cannot extend from String, you have either to create a wrapper class or a method to do this for you.
0	I have tried both shiro and spring security, and I personally feel the shiro is quite easy to understand where as spring security feels complex.
0	In fact i failed to find it so ended up doing my own thing (based on the h2 parser - you can contact me if all else fails).
1	The WindowBuilder items are under General Purpose Tools (or use the filter) Older versions and zips are available at URL_http://www.eclipse.org/windowbuilder/download.php [ URL_http://www.eclipse.org/windowbuilder/download.php ] .
1	If you actually dont worry about txt lines, then I would rather use InputStream/OutputStream instead and count the transferred bytes.
1	 This means that your fully qualified name for your class is so we had to alter web.xml to refer to the correct class e.g: original: CODESNIPPET_JAVA1 .
1	It also has a very fast JSON lax mode and a PLIST parser mode.
0	The requests consist of the incoming rather small request (proper SOAP) and the returning result packet that is essentially one long SOAP string (and the contents of the string are XML).
0	If you want a serialization like DOT NET then you could use URL_http://java.sun.com/products/jfc/tsc/articles/persistence3/ [Long-Term- Persistence-of-JavaBeans-Components] The choice depends on use of serialization.
1	Since it is a web application, there are greater chances of multiple threads accessing this component at a time.
1	etc.
0	You can use apache commons.In the IOUtils you can find the toString metod with 3 helpfull implementations.
0	So best keep max one nullable item per line.
1	Best not to leave this kind of thing to chance :).
0	From previous questions I found great example of authenticating with openID on github: URL_https://github.com/gary-rowe/DropwizardOpenID [ URL_https://github.com/gary-rowe/DropwizardOpenID ] However, I dont want to deal with openID at the moment and simply want users to 1.
1	Thats exactly what ( a modern ) compiler does.
0	Specifically you have to add the parameters inside the constructor of the URL.
1	If you have a choice here, you should prefer Qt over SWT.
1	And I am glad I did, because after a day working on it I managed to learn enough about the APIs not only to set up a basic authentication and authorization system in my Spring webapp without trouble, but also to implement the custom SSO behaviour I was looking for.
1	I dont want to store passwords in plain text.
0	Please fix your question to remove the vague and poorly- defined NoSQL and be more specific about what you want opinions on.
1	@Adam: It really depends on what kind of Stream youre working with.
0	UPDATE: A year ago I started actually using Jackson and I can confirm that it is awesome :-).
1	CODESNIPPET_JAVA1 .
1	UTF-8,the JDK will take the default encoding that is taken from System.getProperty(file.encoding,UTF-8); CODESNIPPET_JAVA1 .
0	What is the level of query complexity that you achieved to reach with the JPA Criteria API, without making the query utterly unreadable?
1	AppScale is open source and lets you run your GAE app on EC2 or your own cluster.
0	Quick to do at first (and a good learning experience), but slow to maintain for production.
1	For example, to reduce the access to disk, you can use a large buffer.
0	I will look it up.
0	I didnt like it much so wrote a new one that we now use in my company.
1	I do have the unlimited jurisdiction patch installed, so thats not the problem :) Ie.
1	I would recommend this, if you really want to support a lot of HTTP servers/clients with minimum code.
1	Aggree that the docs are lacking somewhat, but, IDE support is pretty good, and, googling usually gets you some decent usage examples.
0	My choice is Glassfish: it is faster to start-up, to deploy web applications.the Admin console is very accurate, moreover it is both graphical and command-line.Now it is fully-supported by Oracle, its future is not uncertain any more.It is based upon OSGi: it is really modular.You can install Spring-osgi applications easly.You can freely choice between Eclipse Link , Apache Open JPA and Hibernate without pain.It is greatly integrated in NetBeans (and, of course, Eclipse).
1	Thanks for reply; but it gives error The method toJSONString() is undefined for the type JSONObject at jsonArray.push(jsonObj.
0	I agree that common metrics ought to be exposed via JMX.
1	@Igal I didnt measure it.
1	@Barak Schiller Thanks for posting link to XStream!
0	Serializing is simple.
0	Convert Java AWT code to Android.
1	You probably read something about the Swing Application Framework, which while _built using_ Swing, is not Swing.
1	below is the code i am using.. CODESNIPPET_JAVA1 .
0	no tree, no table, no HTML rendering support..
1	If you only wish to invoke a REST service and parse the response you can try out URL_http://code.google.com/p/rest-assured/ [REST-Assured] : CODESNIPPET_JAVA1 .
1	Like I said, its not free but given the time it would take to make these things yourself youre probably better off using something that is already made.
0	I had been working 5-6 years to get one running.
0	Could you confirm that this fixes your issue?
1	Jackson is also easy to use.
1	I have my own logging engine which writes the logs on a separate thread with a blocking queue.
1	You can try bitap.
1	How can I avoid a NPE when using chained getters, 2.
1	The Restlet framework is composed of four main parts.
0	How to send HTTP request in java?
0	For instance, System.console().readLine() (new in Java 6) is pretty easy.
0	You can write one by using Socket programming in Java.
1	Found a good related topic here: URL_http://stackoverflow.com/questions/921262 /how-to-download-and-save-a-file-from-internet-using-javaMight give that a try tonight when I get home :).
0	I second that, Jackson is a wonderful piece of work- much more efficient.
1	OAuth2 is going to be the most secure and RESTful approach; as for sending creds in plaintext, are you building a web front-end?
0	If its relatively few (say, < 100), Id go with java.net.
1	The only hard part is when you dont know how many characters you need to read.
1	With JSR 311 and its implementations we have a powerful standard for exposing Java objects via Rest.
1	The NetBeans IDE also comes with built-in support for GUI localization and accessibility.
1	Also, the documentation is messy and not properly updated with new versions.
0	Setting this up is easy -- one need only add this to his command line: -Xdebug -Xrunjdwp:transport=dt_socket,server=y,suspend=n,address=PORT There seems to be no available security mechanism, so turning on debugging in production would effectively allow arbitrary code execution (via hotswap).
1	slf4j is the _API_ and logback the implementation of the API.
0	As a consequence i do not know if it has a beautifier, but writing one on top should be straight forward enough.
1	What does the channel means.
1	Maybe it is a matter of definition, but RIA frameworks are basically designed to run in browsers.
1	(not very active though.
1	Maybe we can get some votes to reopen this question?
0	If you can, run the application under Java 6.
0	You also use local references and calling semantic to talk to the EJBs since theyre in the same server.
0	Theyre defined in org.xml.sax.ContentHandler and theres an empty helper class DefaultHandler.
1	ForGUI-intensive work, AWT feels very primitive to work with compared to Swing.Because Swing implements GUI functionality itself rather than relying on thehost OS, it can offer a richer environment on all platforms Java runs on.AWT is more limited in supplying the same functionality on all platformsbecause not all platforms implement the same-looking controls in the sameways.Swing components are called lightweight because they do not require anative OS object to implement their functionality.
1	In the situation where you want to take something that you know is encoded in the default encoding for the platform, then the default version is correct.
0	If you are in control of the method that returns null you could also consider the Null Object pattern if null is a valid value to return.
0	Unless you are looking to secure resources in the Java SE level (classes, System resources), I dont see any real use of JAAS other than the using the common class and interfaces.
1	It introduces CODETERM1 namespace that drastically shorten the configuration from 140 lines to ~30 lines.
1	Naturally, there is no correct answer here for me to accept.
1	Following this law has many more benefits apart from making NullPointerExceptions easier to debug.
0	Swing component is platform independent3 .
1	AppFuse tries to do this, but it aims more at allowing you many different choices when it comes to web frameworks.
1	We can hear you loud and clear.
0	Thats from their site: CODESNIPPET_JAVA1 .
0	Especially if you want to use it in WebServices you have to set timeouts, otherwise the above code will wait indefinitely or for a very long time at least and its something presumably you dont want.
1	I think this should be public String convertStreamToString .
1	Why not just use a reader?
1	Ive added the encoding.
1	You are right.
0	You application will thus have jcl104-over-slf4j.jar (to bridge jakarta commons logging to slf4j) slf4j.jar (for hibernate and others to use slf4j) slf4j-logj12.jar (for slf4j to use log4j as a backend) log4j.jar (for your application to use.
1	Glad it was able to get you started.
1	2) contains an error, it adds always null at the end of the string as you are always makeing one more step then necessary.
0	 if you need to be specific about the input streams encoding, you can provide the second argument to CODETERM1 constructor that indicates what charset to use (e.g.
0	Wrt speed, if its fast enough, its fast enough.
1	As for your business objects, you can use Terracottas URL_http://www.terracotta.org/web/display/orgsite/Spring+Integration [Spring- integration] to cluster your beans - each web app can share clustered bean instances, and Terracotta keeps the clustered state in synch transparently.
0	Prior to Spring Security 3.x, Spring Security (or Acegi) was very painful to set up.
0	You can view the old version via the edited link on this answer.
0	Executing this code: CODESNIPPET_JAVA2 .
1	If the article you have posted is better doesnt mean that my article is wrong.
1	I dont have experience using Shiro, and I partly agree with what you said about Spring Security.
0	sorry, too long for a comment... i cant understand: 1. why the hell are you using CODETERM1 ?
1	newlines are gone after this.
0	CODESNIPPET_JAVA1 .
1	Plus it wants me to do things like: CODESNIPPET_JAVA1 .
1	Im using Rhino 1.7R4 and env.js 1.2 to run Javascript code inside Java I want to print from my Javascript code a string to the Java console.
1	 Antiquated technology.
1	ConceptPk.java CODESNIPPET_JAVA2 .
0	In that case I would serialize as text.
1	CODETERM2 seems as easy and simpler as JAXB but I could not find any licensing information to evaluate it for enterprise use.
1	If you have CODETERM1 object, how should you process that object and produce a CODETERM2 ?
0	I would use Commons Logging if I was enhancing something that already used it.
0	Check URL_http://stackoverflow.com/questions/779519/delete-files-recursively- in-java [this] question .
1	JAXB is part of JDK standard edition version 1.6+.
1	If you intend to create rich applications, AWT is probably not the way to go.
0	I have yet to figureout how to setup permissions, that I can assign to roles/groups/users in spring security- (I think ACL may be the solution).
0	 
0	I agree with the above comments about overriding CODETERM1 on your own classes (and about automating that process as much as possible).
1	You may get better scalability once you are dealing with tens of thousands of connections, but at lower numbers youll probably get better throughput with blocking IO.
1	The general principles involved with Dropwizard authentication URL_http ://gary-rowe.com/agilestack/2012/10/23/multibit-merchant-implementing-hmac- authentication-in-dropwizard [are-discussed-in-this-blog-article] .
0	JAXB: The newest implementation to read XML documents: Is part of Java 6 in v2.
0	@erickson: Nope.
1	Thanks.
1	I dont get you.
0	If the getter should not return CODETERM2 , the getter should contain a check and throw an exception ( CODETERM3 ?
1	Have you considered: URL_http://www.sqlinform.com [ URL_http://www.sqlinform.com ] They provide both an API version and a command line version (as well as an online version).
1	Nowadays, this threshold might be many gigabytes of RAM.
0	I havent evaluated dom4j by myself but just wanted to know - Do java has other (Good) open source xml parsing library?
0	I didnt test this personally, but the URL_http://community.jboss.org/message/565026 [following-thread] mentions two approaches that you could try (yeah, I know, its about JBoss 5 but it looks like the problem is identical).
0	AES-128 is good.
1	Cipher IVs and key-derivation salts serve different purposes.
1	@Ronald: Erm... never mind that.
0	Using lineStr.getBytes().length ?
0	Continue down the chain to figure out where your NPE is occurring, without having to change your code.
0	I have had good success in the past with URL_http://www.bouncycastle.org/ [ URL_http://www.bouncycastle.org/ ] (they have a C# version as well).
0	Because Swing tries to do everything possible in Java other than the very raw graphics routines provided by a native GUI window, it used to incur quite a performance penalty compared to AWT.
1	Do you have an example of a nested select in an IN / EXISTS clause, or of a self-join using aliases for the Sale entity, etc?
0	JavaFX is bundled with Java 7 since u06.
1	Which one is that code?
1	The increased CPU usage was due to a CODETERM1 loop that was waiting for the threads to finish.
1	Use byte APIs (e.g.
0	Its certainly not easier to write youve got to do all the path extraction yourself and all the method handling and all the content type negotiation (in _both_ directions) and all the cookie handling and the object deserialization/serialization thunks and well, lots of low-level stuff that would all need testing and debugging or easier to maintain either, since the JAX-RS interface lets you operate at the level of resources (the natural characterization of RESTful webapps) instead of requests; with much experience, maintenance is easiest when the gap between conceptual model and implementation is smallest.
1	:).
0	The problem is that even testing the simplest possible use-case has required several questions here on SO, and quite a bit of hunting around.
1	At the very least, they could have included a parameter to enable strict parsing.
1	Regardless of everything else, slf4j is extremely useful.
0	Do you know the time- and memory-efficiencies of this idiom, or can at least estimate?
1	Java 256-bit AES Password-Based Encryption.
0	Its a URL_https://github.com/Netflix/astyanax/wikihttp:// [very-well-documented] Cassandra API with many examples and support very high level features such as locking and all versions of cql.
1	Also, there is a method that only take a inputStream argument, if you are find with the default encoding.
1	Yes, Tnilsson, your reasoning is right.
1	Only works for closes streams, I believe.
1	Works well on Android in comparison with other answers which work only in enterprise java.
1	Comments do not give much space to provide the examples, but youre welcome to review them at URL_http://docs.jboss.org/hibernate/core/3.5/reference/en/html/querycriteria.html .
0	We use Querydsl SQL in a few of our in house projects.
0	@fuzzy, I agree, specially when you know what the size of the final string would be ( aprox ) .
1	If thats all youre doing, why bother with servlets at all?
0	You could use URL_http://www.jboss.org/netty [Netty] or URL_http://mina.apache.org/ [Apache-Mina] albeit they are very low level and Im not sure you will end up with less verbose code.
0	For more on Shiros Spring integration: URL_http://shiro.apache.org/spring.html [ URL_http://shiro.apache.org/spring.html ] .
0	StAx Reader/Writer: This works with a datastream oriented interface.
0	I thought it was easy to follow and simple.
0	NLP Library in java.
1	Maybe too late, but it may help somebody that finds this thread looking for the problem described above about Caused by: java.lang.NoSuchMethodException: org.hibernate.validator.ClassValidator....: Im using Jboss 4.2, Hibernate Core 3.6.5, Hibernate Validator 4.1.0, using maven, and I have the same problem.
1	Gson can serialize private fields and automatically ignores transient fields.
0	@CC: you could simply keep adding up the String length of the lines you are copying.
0	Matisse did use to have an extra dependency on GroupLayout but now its included in jre so there is no dependency on SAF.
1	The eclipse error is annoying but just a wrong visualization, the AspectJ team is in the process of fixing that.
1	I would venture to say that there are far fewer SWT apps than Swing apps.
0	I would choose between 2 options: 1) URL_http://en.wikipedia.org/wiki/Berkeley_DB [Berkeley-DB] : its very mature and at the same time very simple key-value storage.
0	Spring does have an integration point that might be of interest to you: URL_http://static.springframework.org/spring/docs/2.5.x/reference/ejb.html [EJB-3-injection-nterceptor] .
0	After all, its become the standard way of doing this with JPA, even if its a bit verbose...
1	Ive been quite happy with Swing for the desktop applications Ive been involved in.
0	Decision tree: 1.
0	I could write a simple web service framework in a third of the time it takes me to understand the RESTlet architecture.
1	What Ive done in these cases is to go for JIDE.
0	I can recommend a few Java implementation of Lex/Yacc ( URL_http://byaccj.sourceforge.net/ [BYACC/J] , URL_http://www2.cs.tum.edu/projects/cup/ [Java-Cup] ) that you can use an existing SQL grammar with.
1	I have very good experience with 
0	Ive been using it in a project and found it integrates very easily into a project.
1	Try URL_http://www.rexsl.com/rexsl- test/apidocs-0.10/com/rexsl/test/request/JdkRequest.html [JdkRequest] from URL_http://www.rexsl.com/rexsl-test/ [rexsl-test] (Im a developer).
1	I can recommend URL_http://www.jooq.org [jOOQ] .
1	eg.
1	Were actually using a lightweight production profiler (Wily), but it isnt very good at capturing state information, and can only perform well when limited to coarse-grained traces.
0	CODESNIPPET_JAVA1 .
1	I am not connected in any way with RedHat/JBoss or SUN/GlassFish, my company (erudis.pl) is supporting and developing for both servers.
1	What strategy should I follow after I get the users password in the CODETERM3 as plain text?
1	And are you willing to use any libraries at all, such as machine learning?
1	Avoid NIO unless you have a good reason to use it.
0	From the javadocs: Note that while some implementations of InputStream will return the total number of bytes in the stream, many will not.
0	My main goal is extracting data from it.
1	A simple, stable implementation which can be accessed easily from Java (i.e has a Java client).
0	The data I really want is inside CODETERM1 .
1	But before further reading: Can you tell me if I can use this API to implement cryptogrphic algorithms which are not part of the JCA, yet.
1	My money would be on AES.
0	FWIW, almost all Java JSON libraries support this conversion mode, including GSON, Jackson and Genson.
1	@Andrew in addition to PLAF and layout, JGoodies offers more: beans binding (for presentation model pattern), validation and a JSR-296 like framework (that one is commercial).
0	Swing + SwingX + URL_http://www.miglayout.com/ [Miglayout] is my combination of choice.
1	or new String(Files.readAllBytes(Paths.get(filename))); :-).
0	If you need multi-threading or more control it is still possible to manipulate use the _Client_ connector class or the _Request_ objects directly.
0	Now send the CODETERM6 and the CODETERM7 to the recipient.
0	Users can signup with Oauth2 as well?
1	Check out the [User Guide]( URL_http://sites.google.com/site/gson/gson-user-guide ) to get started.
0	Getting Access to HttpServletRequest object in restful web service.
0	Now my question is in terms of what I should code against is SLF4J the right choice for the future given log4j 2.0.
1	Unfortunately Im not a networking expert, so I cant really provide more info.
0	Saying that after 2 days+night battles vs tomcat data races.
0	But when we have to spend time reinventing the wheel just because we have misplaced ideas about including a common, reusable, tried and tested utility, were giving up time we could be spending furthering our projects goals.
1	I need a simple tutorial or example on how to implement security (authentication + authorization) in java application based on Struts + Spring + Hibernate with custom user repository.
1	No need for bloatware.
1	CODESNIPPET_JAVA2 .
