label	data
0	Just using reflection is pretty fast and much simpler than generating code.
0	What Ive done in the past is hash the key via something like SHA256, then extract the bytes from the hash into the key byte[].
0	So, we can either block access to the debug port somewhere in the network or do some system-specific blocking in the OS itself (IPChains as Jared suggested, etc.)?
1	With respect to JavaFXs webview, its based on webkit URL_http://docs.oracle.com/javafx/2/webview/jfxpub-webview.htm and from a few short tests that i have done it seems to work fine with js in general (including jquery and jqueryui).
0	 Just for who is curious, this is what the compiler does for this class: CODESNIPPET_JAVA4 .
0	grrrr Any good links - much appreciated.
1	Is there a (preferably free) Java analogue of .NETs XML serialization?
1	Dude, I wrote that answer four years ago.
0	Also, if you are developing Eclipse plugins, you will typically use SWT.
0	Some parsers do not understand things like CSS.
1	I find it rather hard to find out wich call actually returend null, often finding myself refactoring the code to something like this: CODESNIPPET_JAVA3 .
0	java.net versus java.nio.
0	If you were feeling adventurous, you could mix Scala and Java and end up with this: CODESNIPPET_JAVA1 .
1	I recommend the URL_http://commons.apache.org/proper/commons-lang/javadocs /api-release/org/apache/commons/lang3/builder/ToStringBuilder.html [Apache- Commons-ToStringBuilder] to make this easier.
1	Both are nice but I thought Netbeans had a leg up because it doesnt use any proprietary way of saving the GUI structure and instead does something similar to what Visual Studio does - auto-generating the code that you can then add to.
0	Why copy the inputstream to a writer?
1	I didnt try lazy loading with the table view.
1	What other nosql databases are compatible (more or less) with the Google Appe Engine datastore.
1	:) (and has a super low memory, direct from bytes mode with UTF-8 encoding on the fly).
0	 You use URL_http://java.sun.com/javase/6/docs/api/java/lang/String.html [CODETERM1] when an immutable structure is appropriate; obtaining a new character sequence from a CODETERM2 may carry an unacceptable performance penalty, either in CPU time or memory (obtaining substrings is CPU efficient because the data is not copied, but this means a potentially much larger amount of data may remain allocated).
1	The downside of that approach is that you inevitably have a delay from the time of the message/event and until the client receives it.
1	If the files are actually also stored in the DB, then this may be memory hogging as wel.
1	@fooMonster Ive edited the answer.
0	Im not saying it is bad.. but there may be other libraries which are worth noticing :).
1	I only had to extend 2 or 3 classes, and the whole thing took only about 25 lines of XML config in my spring context.
1	 Suppose I have an CODETERM3 that contains text data, and I want to convert this to a CODETERM4 (for example, so I can write the contents of the stream to a log file).
0	Once again, these are my findings and your findings may not be exactly the same, but I wrote this to give some indication to others of the efficiency differences of these approaches.
1	concise, but incomplete, it misses the fundamental reason to use StringBuilder/Buffer and that is to reduce or eliminate the re-allocation and array copy of the regular String concatenation behavior.
0	Alternatively, you can use the _jconsole_ tool (which also comes with your JDK) to request a heap dump at any time using the memory management MBeans.
0	i could say, i agree.
1	For example, consider the Spring XML config example in another post in this thread.
0	My first impression was a nice one.
1	:) .. please check my edited question.
0	I question how often we put effort into optimizing something that no one notices.
0	It promises to invoke REST services and create list of objects from XML/JSON/YAML response in one step.
0	I was thinking more in the chunk of code like a template* and not really in every regular string literal.
1	@David: Good catch.
1	After you have your byte[] you can simply do: CODESNIPPET_JAVA1 .
1	@Andreas_D thats right, fixed it.^^.
0	First, that would be DES encryption, not AES.
0	Things to note: when dealing with authentication, you should always host over HTTPS to ensure transport encryption Dropwizard claims their OAuth2 implementation isnt yet finalized, and may change in the future.
1	While I havent tested, I imagine it perform faster than whatever Java IO implementation you could come up with.
1	For RIA frameworks, consider also GWT and Vaadin.
0	To answer the question asked: javax.crypto deals with low level crypto: encryption, decryption, and hashing.
1	At the end of the day, I think choosing either of these two is more about your mental model - which of the two make more sense and is more intuitive for you?
1	Did you check the screencasts?
1	You can consider using memory-mapped files, via URL_http://java.sun.com/javase/6/docs/api/java/nio/channels/FileChannel.html [FileChannel] s .
0	Hopefully one of the other suggestions would work better for the OP.
0	Taking into account file one should first get a CODETERM1 instance.
0	We use it for fairly high volumes, and it handles this without a complaint or a problem.
0	JSON Tools looks good too.
0	I have found JFace to be very rich and powerful; in some cases it might even be the main reason for choosing SWT.
0	Using HTTPConnection and manual parsing of the result?
0	Difference between Swing and AWTSeveral consequences result from this difference between AWT and Swing.
1	I am having a hard time understanding JAAS.
0	SAX Parser: Solely to read a XML document.
1	What to choose?
0	And the supported formats are: CODESNIPPET_JAVA1 .
0	The rest is fluff that I dont care about (maybe returned by some REST API).
0	Though its simple to create a HTTP client and make a reuest.
0	Still worth mentioning :).
1	It is now located at: org.hibernate.engine.jdbc.internal.BasicFormatterImpl.
1	I will have a try on it...
0	 awt require javax.awt package.
0	We used it in one of our project to replace the plain old java-serialization and it worked almost out of the box.
0	Also, using String for logic operations is rather slow, and is not advised at all, since the JVM converts the String to a StringBuffer in the bytecode.
0	;) With the built in Serialization you have no choice, but if you do it yourself, you can make it anything you want.
0	Is NIO worth exploring in this case?
1	Yes, everything is deployed to the same server.
1	A document database has a very simple storage model and basic query abilities.
1	You can also use some plugins for libraries from questions, pointed in comments, especially pay attention to URL_http://incubator.apache.org/opennlp/ [OpenNLP] and URL_http://gate.ac.uk/ [GATE] . 
1	The password used to generate the SecretKey should be kept in a secure place and not be shared.
0	2.
0	Something is fishy there, but I cant find any documentation on the Web.
0	Thanks BalusC, I used Gson and the concept is quite simple to grasp.
0	A connector in REST is a software element that enables the communication between components, typically by implementing one side of a network protocol.
1	you point to an error inside the web.xml, but Ive just checked in both Restlet 1.0 and 1.1 documentation, and I dont see this kind of error.I would like to mention that you can find at the end of the page a zip that contains a complete war file and the list of source files in case you want to run in standalone mode.Did you try the standalone mode?
1	In the project Im starting, do you recommend that I use SL4J for my own logging purposes?
1	And for the sake of completeness here are the other global functions defined by URL_https://github.com/mozilla/rhino/blob/master/toolsrc/org/mozilla/javasc ript/tools/shell/Global.java [Global] : CODESNIPPET_JAVA2 .
1	 Swing: Portability: Pure Java design provides for fewer platform specific limitations.
0	Inside the HTTP/1.1 the (TCP)connection typically stays open.
0	I had to fix some strange errors on GF and I could not find any information on the web so after a few days I gave up and went back to JBoss.
1	I should enhance the translator to deal with log4j.xml as well.
1	Yes, you did : ).
0	Its using half my CPU (50% of each of the 2 cores) to do this, which is exponentially more than comparable downloading tools which barely stress the CPU at all.
1	But every message you send after that should include the unique IV that was used to encrypt that message (and that message.
0	If the key generator cannot generate 256-bit keys for you, then the URL_http://java.sun.com/javase/6/docs/api/javax/crypto/Cipher.html [CODETERM1] class probably doesnt support AES 256-bit either.
0	Or in this case, IOUtils.toString(inputStream, encoding).
0	Ive also found CODETERM2 , which definitely looks like an improvement, but Im wondering if there is anything that is even better than that?
0	It is still not able to parse any Swing code (I doubt any Swing WISIWYG editor does), but if you start with it, it gives you relatively seamless experience.You need to pay for it though.
0	Instead of putting each server on different ports, is it possible to use channel selectors on the client side, or is it better to go multi-threaded io on the client side of things and configure the servers differently?
1	No.
0	A good alternative to RestSharp in the .NET world.
0	....... CODESNIPPET_JAVA2 .
1	I use Apache HTTPClient to handle all the HTTP side of things.
1	But it depends on the character encoding how that translates to file size (and doesnt work well at all with variable-length encodings such as UTF-8).
0	Your initial question should have stated the exact troubleshooting steps you took - if you ran jconsole, HeapDumpOnOutOfMemoryError, etc.
1	For others: this isnt a very secure method.
0	According to the [documentation](htt p://docs.oracle.com/javase/7/docs/api/java/io/InputStream.html#available%28%29 ) of the available() method, there is no guarantee that the end of file is reached in the event that the method returns 0.
1	WebServices are working better on GlassFish,I had a number of issues with more advanced configuration on JBoss 5.
0	A workaround for lack of AES-256 support is to take some freely available implementation of AES-256, and use it as a custom provider.
0	JTidy is more intented into formatting your html code into something XML- valid, but is still very useful as an XML parser, producing a DOM tree if needed.
1	I now know the answer to this question: No, the SQL parser for Derby isnt a separate project.
0	Then I use GSON upon the generated classes.
1	The question close nannies strike again!.
1	JAXP is then implemented by different providers such as: Oracle, Apache, etc.
1	It only works for a limited set of platforms and of course requires some third party shared libraries.
1	Have a look at Kundera.
0	As far as I can tell the idea behind commons logging is that it should be used in libraries.
1	@PavelRepin @Patrick in my case, an empty inputStream caused a NPE during Scanner construction.
1	To give context, this is the preceding code for all 3 approaches: CODETERM1 CODETERM2 CODETERM3 CODETERM4 1) CODETERM5 2) CODETERM6 CODETERM7 CODETERM8 CODETERM9 CODETERM10 CODETERM11 CODETERM12 CODETERM13 CODETERM14 3) CODETERM15 CODETERM16 CODETERM17 CODETERM18 So, after running 500 tests on each approach with the same request/response data, here are the numbers.
1	i have tried below code but that create Json just only for one line CODESNIPPET_JAVA2 .
1	the iv or the salt?
1	Jersey does seem to mach the requirements quite adequately, although I have not given other frameworks enough investigation yet.
1	Share the CODETERM1 (a CODETERM2 ) and CODETERM3 (a CODETERM4 8 bytes selected by a CODETERM5 makes a good saltwhich doesnt need to be kept secret) with the recipient out-of-band.
1	So I used Gson.
1	Plus, it encourages mistakes like yours where you are breaking up two literals that could otherwise be compiled as one.
1	:).
1	Although Spring didnt offer any method for this, using JNDITemplate to bind them was also trivial.
1	Many times, good enough is good enough.
0	Perhaps there is a more suitable java.io.File method (something like getLength()?
0	Youll have to write a lot of boiler plate code just to get a decent UI that feels modern.
1	 I am the founder of log4j, slf4j and logback projects but unaffiliated with log4j 2.0.
0	+1 for neo4j.
0	The underlying logging API tends to be different on application servers compared to Eclipse, for example.
0	Things that seem like they should be simple are taking hundreds of lines of code (and Im _still_ not sure resources get cleaned up correctly).
1	As for using SLF4J in your application, it is not strictly necessary.
0	Alternatively, base it on an existing protocol, like URL_http://sourceforge.net/projects/juggle/ [this] project.
1	Could you provide more details?
0	In fact, the relational requirements are fairly small.
1	Not as elegant solution as Id want it to be, but it works.
1	With Hibernate v3.3.2.GA, _org.hibernate.pretty.Formatter_ doesnt exist anymore.You can use its replacement : _org.hibernate.jdbc.util.BasicFormatterImpl_ CODESNIPPET_JAVA1 .
1	As soon as you touch the layout builder again it could destroy their work and then you have a broken GUI.
0	But this is fairly close to what we have in higher level languages: byte[] bytes Files.readAllBytes(someFile.toPath());.
0	Usually, there seems to be 1 of the 3 threads that is behind** significantly.
0	Seeing all the information and activity, it does look very constructive and _perhaps_ it shouldnt have been closed so eagerly!.
0	about SQL99: I could tell you one thousand reasons why that be true.
1	I like it.
1	Changed to use StringBuilder.
1	GFv3 starts in a couple of seconds; JBoss in tens (you should try the startup for your own platform).
1	In addition, if someone is using NetBeans,there is a number of smart wizards, that are very helpful.
1	I had more luck with which is also based on Eclipse, simply adding a few plugins to it as many other commercial products do.
0	Gson can work with arbitrary Java objects including pre-existing objects that you do not have source-code of.
1	Why use ANTLR when you can implement your own parser generator?
1	I just want to explore some of the new NoSQL DB systems and the programming model associated with them.
0	I dont know why we havent got web services in java tied down yet.
0	Thanks.
0	Go through it and you can always ask question and problems.
1	Apache Commons allows: CODESNIPPET_JAVA1 .
1	Will find out.
1	As Im using eclipse, I use the Visual Editor plugin.
0	But whatever you do, try and minimize the cases where null is a valid response for this amongst other reasons.
0	JMX without any code, but apparently not for EJB.
0	Gson will automatically convert collections to JSON arrays.
0	I bet more than 10 years ago.
0	] , especially: There are some potentialclassloading issues with CommonsLogging.
1	Why use a framework for RESTful services in Java instead of vanilla servlets.
1	Having to call InputStream#close() to release allocated resources is massively over-complex, isnt it?
1	Which is best for you depends on your project requirements and your personal taste.
0	Few that comes to mind: URL_http://couchdb.apache.org/ [CouchDB] URL_http://cassandra.apache.org/ [Cassandra] .
1	Could be a interesting project for creating REST servers and clients.
1	I.e., setters and getters.
0	I guess MSDN spoiled us.
1	I dont know why this was downvoted.
0	First ,you have to know the encoding of string that you want to convert.Because the java.io.InputStream operates an underlying array of bytes,however,a string is composed by a array of character that needs an encoding, e,g.
0	Lotus Notes Domino would meet all of your requirements.
1	Please comment, if there will be any issues with the code .
1	Please tell me a real time situation to compare CODETERM1 , CODETERM2 , and CODETERM3 ?
1	The sending piece of code will be ran on the computer that is sending the code when they want to send a file.
1	Ive had great success with URL_http://neo4j.org [Neo4J] .
0	This isnt a full-blown implementation, but just a starter.
1	I understand I can use flat files, blobs etc.
0	swing+javafx+wpf+qml [1-out-of-120-questions] on StackOverflow is about Swing!
0	The purpose is simlply to remove timezone data from the element when unmarshalling data.
1	This function is corrupting my input stream.
0	1) What error?
0	This may be the case in certain situations, but generally nio was written to be more _scalable_ than io, where scalable is not necessarily the same as faster.
0	That is, do use methods that depend on the platform default encoding.
0	I hope IOUtils takes an optional Charset (or at least the name of the encodding to use).
1	 If you need a parser there should be a parser in the code base of URL_http://db.apache.org/derby/ [Apache-Derby] .
1	Heres more-or-less sampaths answer, cleaned up a bit and represented as a function: CODESNIPPET_JAVA1 .
0	I agree too, and I wrote the original comment.
0	Has a Maven repository, preferably its already in the main repositories 4.
0	I would rather prefer a solution without adding additional libraries as mentioned in the post below: URL_http://stackoverflow.com/a/6938341/411951 .
1	No mysql, firebird etc.
0	excellent trick!
1	Check out if your version of Java already contains JSON API - see URL_http://www.oracle.com/technetwork/articles/java/json-1973242.html [Java- API-for-JSON-Processing,-July-2013] and URL_https://jcp.org/en/jsr/detail?id=353 [JSR-353] .
1	Im not feeling confident with a UI framework that tries so hard to hide the documentation from potential new fans.
1	So the replacement code needs to to adapted in order to fit in his solution.
1	Has a lot of GUI components and a easy to use API.
0	If you are using Maven and have trouble getting rid of commons-logging, see URL_http://day-to-day-stuff.blogspot.com/2007/07/no-more-commons-logging.html [this] .
1	Regarding available: This will cut off data if the stream is longer than the buffer size.
0	And no, thats not a side effect.
1	If not, strict adherence to the SQL standard is also fine.
1	ASN.1).
0	Remember to not confuse slf4j-xxxx.jar with xxxx-over-slf4j.jar.
1	Its easy to use, completely hides the network stuff from you, and works over good ol HTTP.
1	 2:** org.hibernate.jdbc.util.BasicFormatterImpl got moved in release 4.0.
0	However, I believe this is a very rare use case.
0	Now I saw there is a dedicated javax.crypto package inside the SDK.
1	@cletus: - Enterprise environment - three dev teams on 3 continent and no one ready to take responsibility.
1	But how can I easily print them in a readable format?
0	It does however support searching with highlighting.
1	Related: URL_http://stackoverflow.com/questions/2377467/if-swing-has-more - features-to-design-a-form-then-what-is-the-use-of-awt-in-java.
1	Swing, SWT, AWT, SwingX, JGoodies, JavaFX, Apache Pivot?
0	(why not?
1	I.e.
1	CODETERM5 .
1	You should always indicate the mode and padding algorithm.
0	I know we can use the CODETERM1 method in Java get an individual character in a string by specifying its position.
0	There are methods for start/end of a document, element and so on.
0	So when the application needs to be run only in a single thread then it is better to use CODETERM7 .
1	Ive implemented the ericksons answer in a really simple class: URL_http://pastebin.com/YiwbCAW8 [Java-AES-256-bit-Encryption/Decryption- class] If you get the CODETERM1 you have to install the Java Cryptography Extension (JCE) unlimited strength jurisdiction policy files: URL_http://www.oracle.com/technetwork/java/javase/downloads/jce-6-download-429243.html [Java-6-link] URL_http://www.oracle.com/technetwork/java/javase/downloads/jce-7-download-432124.html [Java-7-link] Just place the jars in your CODETERM2 .
1	Since that is not always intended (http requests with a keep-alive connection wont be closed), these method calls block (not giving you the contents).
0	If you need advanced components (more than NetBeans offers) you can easily integrate SwingX without problems (or JGoodies) as the NetBeans platform is completely based on Swing.
0	I can use the following code to navigate through the JSON document and then map the object I want: CODESNIPPET_JAVA3 .
1	Swing requires javax.swing package .
0	Only the version that takes a byte[] parameter is.
1	+1 To counter commons logging argument, Some enterprise apps use custom logger.
0	@nvrs: Thanks, updated my answer.
1	[enter image description here]( URL_http://i.stack.imgur.com/OwRhP.png) .
0	In fact, its used as glorified RPC server, no more.
0	If so, serve your site over https and it wont be a problem.
0	If you can, give it a try.
1	You dont need an external library for parsing XML in Java.
0	Sun provides some, and BouncyCastle is another good one.
0	My personal opinion: Go for Swing together with the NetBeans platform.
0	Once you have done this, and using the sample code supplied with the Bountycastle package you should be able to encrypt your data.
1	I have used Jackson a lot, and it blows the competition away.
0	_toJSONString()_);.
1	This solution uses multibyte characters.
0	In many (thou not all) cases you can use CharSequence instead of a String.
0	Its based on a grammar and JavaCC, so probably a better option than reinventing this wheel with antlr in any event.
1	It sounds like you could use a solid understanding of the fundamentals of REST, and for that I _highly_ recommend URL_http://rads.stackoverflow.com/amzn/click/0596529260 [RESTful-Web-Services] by Leonard Richardson and Sam Ruby.
1	) Have a very nice set of components, like for example TreeTable.
1	URL_http://www.opencalais.com/ [OpenCalais] is a free service, for example; many commercial ones exist.
0	The example uses the UTF-8 encoding that allows expression of the full unicode range (Including Chinese).
0	URL_http://www.eclipse.org/swt/ [The-Standard-Widget-Toolkit] .
1	I usually use a bunch of high-level classes built from more basic widgets and wire my UI from that.
1	3.
1	Of course, since we cant turn off the debugger, well only use it to gather data before killing off a sick application.
1	For example, 2 wednesdays from now cant be parsed by any other solution Ive found.
0	Example: In Java, you would say str.charAt(8);In C#, you would say str[8]; .
0	Maybe Im not following correctly.
1	An exception instead of returning a value isnt.
0	maybe im wrong, but i think marshall/unmarshall pursuit a different goal, what you are trying to do is conceptually incorrect.
1	This feeling roots in the lack of complex UI components like tree tables.
0	Yes, just pipe it from the FileInputStream to the FilOutputStream using only a suitably sized byte buffer array.
1	+1 for Web Harvest -- if you are trying to do page scraping it is the way to go.
1	Assuming some single-byte encoding, it will (temporarily) require 5 bytes of memory for each character in the file.
1	For high volume data communications it may be better to use a more efficient wire protocol.
1	It will generate the query and execute it for you too.
0	I cant speak for Spring, but it is straightforward to move your business logic in to the EJB tier using Session Beans.
0	Youve already identified one sub optimal condition of your software.
0	You can try URL_http://openjpa.apache.org/jest.html [JEST] , it works over URL_http://openjpa.apache.org/ [OpenJPA] .
0	Also, depending on database platform, details needed and authorization levels used the results yielded might differ.
0	much better.
0	I cant speak to the legal ramifications of doing so (your software might be illegal to import into certain regions).
0	When I use swing, I usually use the NetBeans.
1	 AWT: Speed: use of native peers speeds component performance.
0	Are you sure that it does what i want better than others?
1	It should be able to show the growth of memory.
1	Suggest a simple NoSQL database for java project.
0	I found XSteam useful when converting Objects back and forth between Java & XML or JSON with the Jettison driver.
0	You need to download and install the unlimited strength JCE policy file for your JDK.
1	I investigated into javax.crypto package and found that there are certain Cipher names, like PBEWithMD5AndDES or PBEWithSHA1AndDESede which provides encryption upto 56 bit and 80 bit ( URL_http://en.wikipedia.org/wiki/DESede [ URL_http://en.wikipedia.org/wiki/DESede ] ).
1	@ericflo - Can you elaborate a bit more please?
1	Modern compilers dont do this anymore, but still it is a good practice to use CODETERM7 instead just in case you use an old compiler.
1	The above code reads from a file, but you can easily read from a URL as in the following example that reads stock info from google.
0	What sets Jgoodies apart from the rest?
0	(disclaimer: I work at Sun and I am in the GF team) I agree that Seam works fine on GlassFish; see URL_https://blogs.oracle.com/theaquarium/tags/seam [ URL_https://blogs.oracle.com/theaquarium/tags/seam ] GFv3 is quite different than JBoss 5; in particular: GFv3 is based on OSGi while JBoss 5s kernel is based on JMX.
0	In order for the JCE to allow your provider, you will have to apply to Sun for a certificate, basically faxing them a signed statement that you are aware of the US export restrictions on crypto libraries.
0	this above code create Json like this CODESNIPPET_JAVA3 .
1	If so, would you mind posting the complete solution including the code from AES_v1.html?
0	:) With Spring Security 3.x, it has tremendously improved upon.
1	You should throw an IllegalArgumentException if (length < 0).
0	rather than using native APIs like DirectX on Windows: false, Swing uses Java2D, which may use DirectX when supported.
1	Now I would like to use that code in Android.
