label	data
0	If you dont like RMI, Spring offers a few other remoting options - Hessian, Burlap, and HttpInvoker (Springs custom remoting solution - Java serialization over HTTP).
1	Goto - Menu Help Install New Software... 2.
0	This can be done automatically using a filter, for example.
0	Crashed in Android with OutOfMemory error on the .write line, every time, for short strings.
0	The Swing classes are part of the JRE, not the browser.
0	what do you want exactly, then ?
0	The frustration of dealing with screen builders and filling out all those property sheets is too much for me.
0	It is concise and Ive yet to encounter a problem with it.
0	Whether its better is a matter of personal taste.
0	I am not sure if there will be any encoding issues.
1	Has extra spaces and where do you close the inputstream?
0	CODESNIPPET_JAVA1 .
1	BTW I hope that future version of JAX-RS add a nice client side API along the lines of the one in Jersey .
0	Second, enabling jasypt is a non-goal.
1	URL_http://www.restlet.org/documentation/1.1/screencast/ [ URL_http://www.restlet.org/documentation/1.1/screencast/ ] Otherwise, there is a Restlet tutorial in the OReilly book that we wrote in their Chapter 12.
1	In our company project we use LOG4j and it is very easy to use like Stephen showed in his example.We also have written our own pattern classes for LOG4j so you can create your own output file schemas.
1	@Will - If this question is closed, what happens to the bounty?
0	Swing is still the preferred way to build heavy-weight, e.g.
0	Basically, if null is a valid response, you have to check for it.
0	I dont understand why its done the way its done in Jackson.
0	So, in a CBC implementation, order is important.
0	Will find out.
1	JAX-RS is a very well designed API that makes mapping HTTP requests to methods, extracting parameters from various parts of a HTTP request, handling content negotiating, and many other low level tasks very easy.
0	AWT is outdated.
0	Of course, there are a few working solutions, e.g.
1	Stability?
0	Ivebeen able to use it for basic web pages though.
0	Swing requires javax.swing package .
1	So I gave it a try.
0	Ive used URL_http://json-lib.sourceforge.net/ [JSONLib] , URL_http://flexjson.sourceforge.net/ [FlexJSON] and URL_http://code.google.com/p/google-gson/ [Gson] all with great success.
0	HttpURLConnection instances are significantly cheaper to create than due to the fact that they share one static JRE wide pool of connections.
0	Great pithy title for a legitimate documentation failure.
1	This code may give unpredictable results.
1	What does that matter?
0	Here, large depends on the computer specs.
0	My old code: AsyncAppender appender (AsyncAppender) LogManager.getRootLogger().getAppender(async);AppenderSkeleton mailAppender (AppenderSkeleton) appender.getAppender(mail);.
1	Its just creating your column families thats a schlep.
1	To save memory, do not unnecessarily store/duplicate the data in memory (i.e.
1	Donal I do not follow... What handles the GET request then?
0	SLF4J has a URL_http://www.slf4j.org/legacy.html [commons-logging-bridge] that you can use to replace the commons logging library.
0	@jmort253 We noticed performance regression after updating some library in our product for several times.
1	There is a lot of tuning in Swing that cannot be attributed to Moores law.
0	+1.
0	Shiro annotations seem to suffer some issues in spring.Information on how to solve it are very har and there are various posts in stackoverflow (1 or 2 posted by myself) which most of the time found no answers.
0	[Theres a mini tutorial here at SO]( URL_http://stackoverflow.com/questions/2793150/how-to-use-java-net - urlconnection-to-fire-and-handle-http-requests).
0	@rblasch: I really like that answer, as it points me to the original problem: There are methods which may return null, and others that may not.
1	SAX Parser: Solely to read a XML document.
0	When I wanted to use JSONLib; I found out that the jar file that is available in URL_http://json-lib.sourceforge.net has some class dependencies and it needs to be used by some other jar files, that contain that classes.
1	I would not generalize from that (certainly isnt representative), but it does factor into my decision of what to use in my scenario.
0	The ID is the primary key, and enforcing unique triplets after that is going to be on _your_ end more than the NoSQL engines end; this is one area where NoSQL suffers compared to SQL, but its also where you find the greatest speed and storage improvements.
1	 swing component provide much flexible user interface because itfollow model view controller(mvc).
1	In the end I Found a ORM framework called Canyon which mapping Files to Objects.
1	 Logback because its newer than log4j and again, supports parameterized logging, as it implements SLF4j directly SLF4j/Logback because its written by the same guy who did log4j, so hes made it better (according to URL_http://stackoverflow.com/questions/354837/whats-up-with-logging-in-java#356038 [Ken-G] - thanks.
0	Its not that difficult, just annoying.
0	I would assume, that you can do something similar in netbeans or eclipse.
0	I would look into URL_http://opencv.willowgarage.com/wiki/ [OpenCV-which- is-a-C++-library-for-computer-vision] .
1	If you are just reading straight through a file, this will most likely not get you much of anything.
1	You could, setup a third business logic server that has a remote api which your two web apps could call.
0	This is a very good article URL_http://kaioa.com/node/59 [ URL_http://kaioa.com/node/59 ] .
0	URL_http://www.antlr3.org/grammar/list.html .
0	Well it depends - not all APIs have the same capabilities as you see, but if you have control over the classes you use to map the XML document JAXB is my personal favorite, really elegant and simple solution (though I havent used it for really large documents, it could get a bit complex).
1	I hope IOUtils takes an optional Charset (or at least the name of the encodding to use).
0	My biggest complaint with the offerings out there is the size of them - we target a download-constrained applet market.
1	But it is a state of preference.
0	Disadvantages: Client JVM management.
1	Please tell me how can I get access to HttpServletRequest Object.
0	Which one do you use?
0	However, it does not allow you to edit (fine tune) the generated code.
1	I just think its important to have a good reason to avoid libraries and that the reason is a valid one, which there very well could be :).
0	A nice way to do this is using URL_http://commons.apache.org/ [Apache-commons] URL_http://commons.apache.org/proper/commons- io/apidocs/org/apache/commons/io/IOUtils.html [IOUtils] to copy the CODETERM1 into a CODETERM2 ... something like CODESNIPPET_JAVA1 .
0	Thanks.
0	It should help you.
1	Or maybe this link is easier to read: URL_http://www.xyzws.com/Javafaq/how-to-use-httpurlconnection-post-data-to- web-server/139 [ URL_http://www.xyzws.com/Javafaq/how-to-use-httpurlconnection - post-data-to-web-server/139] If Java Almanac is down, try URL_http://www.xyzws.com/Javafaq/how-to-use- httpurlconnection-post-data-to-web-server/139 [this-one] .
1	I could give you an example for many NoSQL engines (and certainly can for GigaSpaces) but I dont know which one youre targeting or why.
0	We can hear you loud and clear.
0	Haha - of course it does!
1	This can be incredibly useful if you put stuff like the username and the URL of the request (in case of a webapp) into it.
1	I have switched between several IDEs and the one that I believe has the best GUI builder in terms of use and performance would have to be Netbeans.
0	If you have a deep bean structure, everything else will be implemented with dyna beans.
0	2) contains an error, it adds always null at the end of the string as you are always makeing one more step then necessary.
1	- Means you could extend the tool to create a Iris Search database - I could take another iris image and try to match with existing image Image acquisition is not available.
0	CODESNIPPET_JAVA2 .
0	So as a conclusion, on the ease of use and learning curve aspects, Shiro is really quite likeable, and I think I will probably go with it in the future, unless I encounter some features lacking or some other problem (which I havent so far).
0	Java GUI frameworks.
0	are good tools for this.
0	Does String x A + B; really compile to be a StringBuilder?
0	Yes it is still in use.
1	) that I can use to wrap my application which can be a bunch of JSPs or HTMLs with JS?
0	swing+javafx+wpf+qml [1-out-of-120-questions] on StackOverflow is about Swing!
0	I recommend the URL_http://commons.apache.org/proper/commons-lang/javadocs /api-release/org/apache/commons/lang3/builder/ToStringBuilder.html [Apache- Commons-ToStringBuilder] to make this easier.
0	Its clunky and hard to read, and overly verbose.
1	If you do, gist it and Ill append your results to the answer.
1	Not sure if this just wasnt true at the time of writing, but the JavaFX site states that it supports Linux.
1	Welcome to Stack Overflow.
0	 awt occupies more memory space.
1	If you are not trying to do this effectively, you are like dude from Jackass 3d who was CODETERM1 .
1	google, github, etc.
1	I say new, but its really been around for years, just not as open source.
0	Swing apps no loger feel jerky and unrepsonsive and an accumulation of minor improvements result in a more professional looking GUI.
0	The answer of whether the reward is greater than the cost is a decision not to be taken lightly.
1	V6.5 is excellent and realy improved over v5.
1	I have looked on few NLPs like URL_http://alias-i.com/lingpipe/index.html [LingPipe] , OpenPL, URL_http://nlp.stanford.edu/index.shtml [Stanford-NLP] .
0	@Pelegi, can you mention just one thing that JBoss does better than Glassfish?
1	any ideas about performance of Scanner vs reading the stream in a more verbose way?
1	Can you make some examples, please?
1	As for using SLF4J in your application, it is not strictly necessary.
1	My idea was to have write a sever app on each machine that acts as a gateway from the control center to the radio hardware, with one socket for each unit.
0	@abhinav-sarkar Querydsl supports that, just not as directly as JOOQ.
1	Cassandra, Neo4j, MongoDB, etc.
1	For example, the table views do support filtering and sorting but you still have to configure this.
1	Go through it and you can always ask question and problems.
0	I would ask yourself how many connections you expect to be handling.
1	CODESNIPPET_JAVA1 .
0	Configure the debugger on the command line with the onthrow=com.whatever.TurnOnDebuggerException part added 4.
0	 If your string can change, and will be accessed from multiple threads, use a CODETERM12 because CODETERM13 is synchronous so you have thread-safety.
1	And which would benefit the program more?
0	Fluent facade API exposes only the most fundamental functions of HttpClient and is indended for simple use cases that do not require the full flexibility of HttpClient.
0	HTMLUnit will work, but for me it has seemed to have limited support for Javascript.
0	Especially, CODESNIPPET_JAVA1 .
1	URL_http://activemq.apache.org/how-does-activemq-compare-to-jbossmq.html [ URL_http://activemq.apache.org/how-does-activemq-compare-to-jbossmq.html ] .
0	Its based on a grammar and JavaCC, so probably a better option than reinventing this wheel with antlr in any event.
0	I am not sure if you are upset with the question, but since I did not find the same question already answered and the community here is friendly enough with such questions, I figured I would go ahead and ask for opinions.
0	See URL_http://commons.apache.org/proper/commons-io///apidocs/org/apache/commo ns/io/FileUtils.html#deleteDirectory%28java.io.File%29 [FileUtils.deleteDirectory()] <s>Also with URL_http://code.google.com/p/guava-libraries [Guava] :</s> <s> CODETERM1 </s> This has been removed from Guava several releases ago.
0	I wasnt aware that SWT was based on a combination of AWT and Swing.
0	Sorry this was more than two years ago and I havent done any Java since.
0	(Not that Id claim its perfect some surprising things are still very awkward but it definitely makes things a lot easier.
0	For Eclipse, I am not sure.
1	Yes, I guess the reader should be closed at the end.
0	I had to add if (is null) return ; right at the beginning of the method; I believe this answer needs to be updated to better handle null inputStreams.
0	And the supported formats are: CODESNIPPET_JAVA1 .
1	It allows you to easily share/replicate maps of data between mulitple JVM instances (same box or different).
1	I can use the following code to navigate through the JSON document and then map the object I want: CODESNIPPET_JAVA3 .
0	:).
0	URL_http://download.oracle.com/javase/6/docs/api/java/io/Serializable.html .
1	When I was sending data back and forth between js and c# I had zero problems whatsoever.
0	It only works for a limited set of platforms and of course requires some third party shared libraries.
1	Furthermore, your example of a + b would be compiled into a single literal ab but if you used StringBuilder it would result in two needless calls to append().
0	@Alex B: HttpComponents are being used in all sorts of different applications randing from simple URL fetchers to complex transports and web crawlers with different, often conflicting requirements.
0	SimMetrics is probably what you need: URL_http://sourceforge.net/projects/simmetrics/ [ URL_http://sourceforge.net/projects/simmetrics/ ] It has several algorithms for calculating various flavours of edit-distance.
0	CODESNIPPET_JAVA1 .
1	Could it be related to the fact that the code is executing in Eclipse?
1	Any links to how one can use Antlr SQL Grammar to parse these queries?
0	thanks,ray.
0	This takes 10-60 minutes on a mobilephone/hand held computer.
1	Apparently there are certain concern when it comes to persistent storage in ActiveMQ.
0	Very powerful, widely used and accepted.
0	3.
0	Using a JAX-RS compliant interface gives you a little bit better portability if you decide to switch to a different implementation down the road.
0	 URL_http://edn.embarcadero.com/article/26970 [More-Reading.
0	While Matisse (now known as  URL_http://netbeans.org/features/java/swing.html [Swing-GUI-Builder] ) makes it pleasant to layout components, it is similar to all other code generation tools because when you use Matisse you must live in constant fear that someone else edited the you cannot edit this in NetBeans GUI sections outside of NetBeans.
0	Both are wrappers of the SAX and DOM parsers built into the JDK.
0	This function is corrupting my input stream.
0	 I was under the impression that the concepts of REST were supposed to be much simpler than SOAP - but it seems just as bad if not more complicated - dont get it at all!
0	People posting answers shouldnt assume you took any steps you didnt mention.
1	Note that Twofish can be considered as an advanced version of Blowfish.
1	Performant?
1	This is just my point, why use a sledgehammer to hammer in a nail.
0	I thought it was easy to follow and simple.
1	Like I said, its by no means a comprehensive benchmark.
0	Much practical advice from decades of doing actual infosec.
1	Even loading the whole document and using XPath is marginally slower than SAX and nothing compared to getting the XML (network speed).
0	This technique is only useful if your tests identify the source of every possible NPE.
0	What other nosql databases are compatible (more or less) with the Google Appe Engine datastore.
0	If you add support for specific databases, and sent a pull request, I can guarantee it will get into the mainline code base.
1	 Possible Duplicate:** URL_http://stackoverflow.com/questions/870460/java-is-there-a-good-natural- language-processing-library [Java-:-Is-there-a-good-natural-language- processing-library] I need a simple Natural Language Processing library written in java which can be used to process a search query/question.
0	Unfortunately this solution seems to go and lose the exceptions thrown in my underlying stream implementation.
1	Can anyone offer some form of guidance as to how I can generate Java from this JSON string?
0	For folks interested in using JDOM, but afraid that hasnt been updated in a while (especially not leveraging Java generics), there is a fork called CoffeeDOM which exactly addresses these aspects and modernizes the JDOM API, read more here: URL_http://cdmckay.org/blog/2011/05/20/introducing-coffeedom-a-jdom-fork-for- java-5/ [ URL_http://cdmckay.org/blog/2011/05/20/introducing-coffeedom-a-jdom-fork - for-java-5/] and download it from the project page at: URL_http://coffeedom.googlecode.com/ [ URL_http://coffeedom.googlecode.com/ ] .
0	AWT components are platform-dependent.
0	I had been using Spring Security (version 3.1) for a few months and was quite happy with it.
1	Sun puts much more energy into making Swing robust.
0	There are other options like URL_http://en.wikipedia.org/wiki/Twofish [Twofish] , URL_http://en.wikipedia.org/wiki/Blowfish_(cipher) [Blowfish] etc also.
0	Which, if using the jsondriver and setting the proper settings, will encode ugly types into the actual json, so that you dont loose anything.
0	Restlet provides several implementations of client connectors based on existing open-source projects.
1	One user reported this didnt work for him.
1	Are you sure that it does what i want better than others?
0	I think this should be public String convertStreamToString .
0	(I am willing to map them to objects coz it will be much more comfortable for me to manipulate the fields inside each file via object) I wonder if any of you deal with such things before?
1	Commons Lang has an implementation of URL_http://commons.apache.org/lang/apido cs/org/apache/commons/lang3/StringUtils.html#getLevenshteinDistance%28java.lan g.CharSequence,%20java.lang.CharSequence%29 [Levenshtein-distance] .
0	JDK 7/8 answer that closes the stream and still throws an IOException: CODESNIPPET_JAVA1 .
0	The typical solution is to use EJB, but I think spring has remoting options built into its stack.
0	The alternate is to lock down the debug ports via a firewall (software or hardware.
1	@Pacerier Your router should handle the address translation for you.
1	In all other cases I can think of HttpClient should be comfortably faster.
1	The drag and drop features and auto-code generation are quite mature.
1	The project still seems active nowadays.
1	As soon as either happens the client opens a new connection.
0	There are numerous algorithms to find similar strings, Levenshtein distance, Daitch-Mokotoff Soundex, n-grams etc.
1	Instead, Gson uses reflection to directly reference the fields.
0	OAuth2 is a great approach to ensure that each logged in user receives their own access token that you can track and manage.
0	Doesnt it allow to parse nasty HTML?
1	See URL_http://stackoverflow.com/questions/354837/whats-up-with-logging-in- java [here] for more info.
0	Simpler and better then other solutions.
0	Etc.
0	I am looking through the code and implementing my simple service in parallel.
0	Why are my log messages not printing out to the console, etc.?
1	Using AWT, you have toimplement a lot of things yourself, while Swing has them built in.
1	Code above has a bug of adding extra new line char at the last line.It should be something like followingif(line reader.readLine() ) != null){ stringBuilder.append( line );}while (line reader.readLine() ) != null) { stringBuilder.append( ls ); stringBuilder.append( line );}.
0	That is the netbeans one which has been ported.
1	Should I be using an AWT or Swing button?
0	What is the easiest way to take the CODETERM5 and convert it to a CODETERM6 ?
0	Pivot.
1	+1 I thought the selimeter should be Z.
1	In IntelliJ IDEA you can set _exceptionbreakpoints_.
1	Its certainly not easier to write youve got to do all the path extraction yourself and all the method handling and all the content type negotiation (in _both_ directions) and all the cookie handling and the object deserialization/serialization thunks and well, lots of low-level stuff that would all need testing and debugging or easier to maintain either, since the JAX-RS interface lets you operate at the level of resources (the natural characterization of RESTful webapps) instead of requests; with much experience, maintenance is easiest when the gap between conceptual model and implementation is smallest.
1	And how is this comment helping?
0	What on earth do you copy...???
0	@Kevin - Yes, the strings are snippets of HTML.
1	I had the impression that netbrain was asking about desktop apps.
1	I didnt test this personally, but the URL_http://community.jboss.org/message/565026 [following-thread] mentions two approaches that you could try (yeah, I know, its about JBoss 5 but it looks like the problem is identical).
1	I wrote a method for this sometime back.
1	Also, readLine does not distinguish between n and r, so you cannot reproduce the exact stream again.
1	In order to exclude commons-logging from your final build in maven use scope provided instead of the 99.0-does-not-exist from Eric.
1	I want it to remine text.
0	Check also URL_http://ttp://en.wikipedia.org/wiki/Latent_semantic_analysis [LSA] , after wikipedia: Latent semantic analysis (LSA) is a technique in natural language processing, in particular in vectorial semantics, of analyzing relationships between a set of documents and the terms they contain by producing a set of concepts related to the documents and terms.
0	From JPA to NOSQL.
0	when, where, ...
1	Luckily we are building and selling our own product so we dont really have the so called deadlines.
1	I hope one day we will have a tool that rivals Visual Studio on this aspect.
1	Did you check the screencasts?
0	Close as not constructive is subjective at best.
0	Youll find its performance compared to ActiveMQ is _extremely_ good.
0	Are there other ideas or frameworks which offer lets say JMS over HTTP.
1	As a result there are implementors of not only LoginModules, but the entire authentication and authorization api, that creates abstraction layer above, like Authentication & Authorization managers.
0	Having recently worked on a project which required some more IO interaction than Im used to, I felt like I wanted to look past the regular libraries (Commons IO, in particular) and tackle some more in depth IO issues.
0	It is not related to Swing and AWT at all.
1	It might be that the XPath term in your Binding is not finding the required element.
0	You could try: CODESNIPPET_JAVA1 .
0	I changed to JCL in the OP.
1	Thx.
1	 Third Party Development: the majority of component makers, including Borland and Sun, base new component development on Swing components.
1	Here is the benchmark and some results that we use internally: URL_http://wiki.apache.org/HttpComponents/HttpClient3vsHttpClient4vsHttpCore .
0	Simply hiding them would make the GUI look bad; they rather should not be added instead.
0	Youre definitely going to need code over and above the JRE.
0	You can know the file size in bytes beforehand.
0	What should I now be using instead?
1	Or maybe a link to a more developed example?
1	eg.
0	Especially if you want to use it in WebServices you have to set timeouts, otherwise the above code will wait indefinitely or for a very long time at least and its something presumably you dont want.
1	First ,you have to know the encoding of string that you want to convert.Because the java.io.InputStream operates an underlying array of bytes,however,a string is composed by a array of character that needs an encoding, e,g.
1	 See also: URL_http://json.org/ [Json.org] - Introduction to JSON URL_https://sites.google.com/site/gson/gson-user-guide [Gson-User-Guide] - Introduction to Gson .
1	Now I see that this could have been two seperate questions: 1.
1	 Difference:** The difference between CODETERM4 and CODETERM5 is that CODETERM6 is thread-safe.
0	still has one flaw.
0	Thank you for your explanation.
1	CODESNIPPET_JAVA1 .
1	Overview of a REST architecture** Lets step back a little and consider typical web architectures from a REST point of view.
0	@jjinguy what IP address should we put for CONNECTION_ADDRESS if the computers are not in a LAN?
0	Damn, people around here are getting used to newbie questions and dont expect any better.
0	Swing button vs AWT button?
0	I fully understand why this happens, but it is not ideal for what were trying to achieve.
0	@erickson so the lack of support is the only criteria not to use PBEWithMD5AndDES?
1	Use XStream..
0	Log4j and logback are regular logging libs.
0	_**Swing is still in use.... but there is AWT!!
1	My personal opinion: Go for Swing together with the NetBeans platform.
0	The problem is that you were probably blocking the main Swing event thread (the thread that handles things like button clicks).
0	DOM also allows you to write to the document with Xslt transformations.Example: CODESNIPPET_JAVA1 .
1	line.getBytes(encoding).
0	Check out URL_http://www.rgagnon.com/javadetails/java-0542.html [this] tutorial, its a really basic example.
0	But this is fairly close to what we have in higher level languages: byte[] bytes Files.readAllBytes(someFile.toPath());.
1	He doesnt mention if he wants text or binary, actually but from what I understand he wants the library to help him with parsing/reading as well.
1	How can we enable secure debugging?
1	Luckily I am already using this jar, so i could use this straight away.
0	Each client node works with its copy of that clustered cache, and Terracotta keeps it in synch.
1	Actually JAX-RS is an API while CXF, Jersey, RESTEasy are implementations.
1	This solution would definitely work for me but I prefer the simplicity of the Hibernate solution.
1	JavaFX isnt based on Swing either.
0	@james: the filter wont yield the correct result when theres a BufferedWriter above it, though the difference may not be large enough to matter.
