label	data
1	2) Once the security issues were resolved, JBoss threw IllegalArgumentException: object is not an instance of declaring class.
1	Java Cryptography Extensions (The Practical Guide Series) by Jason Weiss.
1	Changing these line CODESNIPPET_JAVA1 .
1	 Option 2 Disable CODETERM3 (your second jboss-web.xml), bundle your Hibernate JARs into your app and override the hibernate-validator JARs CODETERM4 
0	Without salts, a dictionary attack could be used, enabling a pre-computed list of the most likely symmetric encryption keys.
0	Youve found your NPE.
0	Yes, you did : ).
1	You really, should be using IOUtils.copy(inputStream, writer, encoding); unless you really, know what youre doing, which people never do with character encoding related programming.
0	 Look and Feel: AWT components more closely reflect the look and feel of the OS they run on.
1	If you have a method or constructor that takes an object parameter and the object/method in question cannot sensibly deal with that parameter being null, then just check and throw a NullPointerException there and then.
1	Thanks!
0	Once you have done this, and using the sample code supplied with the Bountycastle package you should be able to encrypt your data.
0	This essentially means that FileChannel#map is, in general, unusable.
0	 Vendor Support: Swing development is more active.
1	Does anyone have a better/different way to read a file into a string in Java?
0	At the time, circa early 2000s the sweet spot seemed to be about 10 K; it might be a little larger now, but probably not by much.
0	(shown below) I left out try/catch blocks for the sake readability.
1	I know its Java, and were not into the whole brevity thing, but thats a little much.
1	Frameworks like Qt and SWT need native DLLs.
0	If you do, gist it and Ill append your results to the answer.
0	I know many developers would like to have this.
1	@Per Wiklander I disagree with you.
0	 by Oscar Reyes** This is the (simplified) underlying code on the cited library: CODESNIPPET_JAVA2 .
0	How else ?
0	When implemented correctly, applets like any client-side security scheme will increase the security posture of an application.
1	For example, if youre getting the body of an HTTP request via its just request.getReader() )**.
1	Is this an answer?
0	 What?
0	Promising.
0	You dont need an external library for parsing XML in Java.
1	Is that not an option?
0	I can specify a 16bit one which works for 128bit encryption which works.
0	I know that Wicket and Hibernate uses Simple Logging Facade for Java ( URL_http://www.slf4j.org/ [SL4J] ) and that Spring is using the URL_http://commons.apache.org/logging/ [logging-component-from-Apache-Commons] .
1	 URL_http://en.wikipedia.org/wiki/Java_AWT [AWT] Is the very foundation of swing, it performs well but is lacking in advanced components.
0	Related: URL_http://stackoverflow.com/questions/2377467/if-swing-has-more - features-to-design-a-form-then-what-is-the-use-of-awt-in-java.
1	This API is backed by the Restlet Engine and both are now shipped in a single JAR (_org.restlet.jar_).
1	If you want to actually do something with the resulting parsed grammar, I might suggest looking at URL_http://db.apache.org/derby/ [Derby] , an open source SQL database written in Java.
0	So far, I had a great experience with the community wiki and documentation of Jboss, and it pretty much covers everything.
0	You are welcome to use whatever library that suits your needs best.
0	To get a progress bar to show up on a form only involves dropping it onto a CODETERM2 and perhaps setting CODETERM3 so hat it shows that your program is working.
1	Part of the eclipse URL_http://www.eclipse.org/datatools/ [Data-Tools- Platform] is the URL_http://www.eclipse.org/datatools/project_sqldevtools/ [SQL-Development-Tools-Project] .
0	I can see from the task manager that the javaw process is still doing small IO writes, but I dont really know why this happens (Im guessing race conditions?).
1	JAAS is a security framework build for securing things at a much lower level then web-application.
1	Any suggestions would be helpful.
0	JAXB 2.0 also has support for JSON serialization using Jettison.
1	Also a bit of a clunker to start with but really handy when youre comfortable .
1	Yeah, it really shouldnt require so much boilerplate to do something as simple as read strings from a stream.
1	This method requires Java 6.
1	Doesnt it offer DOM manipulation?
1	First, that would be DES encryption, not AES.
0	However, it doesnt work very well.
0	Sometimes speed is of the utmost importance and is a hard requirement.
0	@mP.
0	@Thimmayya: Then dont use NoSQL -- its too vague to have any meaning.
0	I dont envision any external apps using the API for data.
1	After a couple of screens and a little research I am just as productive.
1	 awt componentsare heavy weight.
1	Things that seem like they should be simple are taking hundreds of lines of code (and Im _still_ not sure resources get cleaned up correctly).
1	@Troelsen yes correct!.
1	The only time HttpComponents code turned out significantly more complicated was for parsing dates from a header.
1	Be aware when using CODETERM1 the returned integer does not have to represent the actual file size, but rather the guessed amount of bytes the system should be able to read from the stream without blocking IO.
1	Whilst this may theoretically answer the question, [it would be preferable]( URL_http://meta.stackoverflow.com/q/8259 ) to include the essential parts of the answer here, and provide the link for reference.
1	The requests consist of the incoming rather small request (proper SOAP) and the returning result packet that is essentially one long SOAP string (and the contents of the string are XML).
0	First, we tried to look at how the business layer alone could be exposed to other web apps, and Spring offers JMX wrapping at the price of a tiny amount of XML.
1	The default size of the buffer is 1024, but Scanner will increase the size as necessary (see Scanner#makeSpace()).
1	Rhino print function.
0	If I were in your shoes, Id go with this option just because I know that it would show great performance, there are mature tools for working with MySql, many people have experience with it and at any time you can easily use all its relational potential if you eventually decide to go back to RDBMS solutions.
0	Did help.
1	AWT might however look somewhat ugly on some operating systems.
1	The example uses the UTF-8 encoding that allows expression of the full unicode range (Including Chinese).
0	Setting this up is easy -- one need only add this to his command line: -Xdebug -Xrunjdwp:transport=dt_socket,server=y,suspend=n,address=PORT There seems to be no available security mechanism, so turning on debugging in production would effectively allow arbitrary code execution (via hotswap).
0	Downvoting as doesnt close inputstream.
1	Stop the madness.
0	Systems can easily have multiple Java runtimes; double- check to make sure that the correct location is being used.
1	And as a personal comment, Looks very interesting!
0	If you need a native, pure Java solution, that leaves you with the rest.
0	Async request like AJAX: URL_http://hc.apache.org/httpcomponents-asyncclient- dev/ [ URL_http://hc.apache.org/httpcomponents-asyncclient-dev/ ] Sync request: URL_http://hc.apache.org/httpcomponents-client-4.0.1/index.html [ URL_http://hc.apache.org/httpcomponents-client-4.0.1/index.html ] Cookies is A kind of Header.
1	Therefore I dont need any private-public key pairs.
0	Why?
0	thanks, updated the link.
0	For example, 2 wednesdays from now cant be parsed by any other solution Ive found.
1	Thanks.
1	Printing Java collections nicely (toString doesnt return pretty output).
1	You can refactor, for example, into CODETERM1 which calls CODETERM2 which calls CODETERM3 which calls CODETERM4 .
0	Any serious Java UI work is done in Swing not AWT, which was primarily used for applets.
1	This bug has made me sad: URL_http://sourceforge.net/tracker/?func=detail&aid=2062 744&group_id=171425&atid=857928.
0	How to send HTTP request in java?
1	I copy 5 - 10 mb files easy...
0	I would suggest using URL_http://uima.apache.org/ [UIMA] with URL_http://opennlp.sourceforge.net/projects.html [OpenNLP] connectors and same hand made regexp rules.
1	Its a ground-up redesign, and is probably a better option for you.
1	3.
0	+1, concise answer.
1	To save anyone the hassle of Googling - org.apache.commons commons-io 1.3.2 .
1	I can only give you my (biased) perspective.
0	There may be a much better/easier solution, but I would do the following: 1.
0	In many ways, a ReadableByteChannel is like an InputStream, and WritableByteChannel is like an OutputStream.
1	We used it in one of our project to replace the plain old java-serialization and it worked almost out of the box.
1	That at least reduces your exposure to someone who can get a process into the server, or someone who can crack your SSL.
0	And are you willing to use any libraries at all, such as machine learning?
1	JBoss Messaging is now in bug fix mode only, since JBoss / Red Hat has a new Java messaging project called HornetQ.
0	Its very cool, very great, but the second you want to do anything other than simple objects, you could easily need to start building your own serializers (which isnt _that_ hard).
0	Way to jump on the people trying to help you, dude.
1	@jmort253 Many libraries are large, slow but powerful.
1	So as a rule of thumb you are not supposed to use DES or its variants because it is being phased out.
1	Thank you for indicating that there are times when this is necessary.
1	If this would be the only use of the library, it would be overkill to use the library.
0	I have tried several other solutions, and this is the one I am sticking with.
1	What better way to open my account on the site.
1	It will be good if you go for latest version release.
1	This also allows me to easily test my UI with automated JUnit tests (because I can control what the source looks like).
0	I find jackson or simple json much easier to use then gson.
1	You can describe how your log file should look like.
0	There might be some simple task like re- ordering a variable initialization and its use or re-naming a variable (this was especially a problem when using Matisses database feature).
1	You should use PBKDF 2 specified in PKCS#5.
0	Microsoft?
1	Configure the backend to log all categories to one file, and youre done.
1	The Log4J2 website reports that there is an adapter for SLF4J, so if you write your code to SLF4J you can switch to Log4J, Log4J2, and Logback whenever you want.
0	This one fails for empty files with a java.util.NoSuchElementException.
1	Youll have to write a lot of boiler plate code just to get a decent UI that feels modern.
0	AWTis a thin layer of code on top of the OS, whereas Swing is much larger.Swing also has very much richer functionality.
1	I use ACL + log4j.
1	I mean does it save time?
1	One Line Solution CODESNIPPET_JAVA1 .
0	The current state of the MDC is attached to every event.
1	Heres an alternative which doesnt do that, and which is (IMO) simpler to understand than the NIO code (although it still uses java.nio.charset.Charset): CODESNIPPET_JAVA1 .
0	 <strike>** URL_https://github.com/sonatype/async-http-client [Async-http-client] by Sonatype</strike>.
1	Swing + SwingX + URL_http://www.miglayout.com/ [Miglayout] is my combination of choice.
1	I recommend URL_http://code.alibabatech.com/jira/browse/FASTJSON [fastjson] ,just as its name,really fast .
1	@erickson: in case you store iv, salt, etc.
0	@harschware: Given the question was: If you have java.io.InputStream object how should you process that object and produce a String?
1	But this question doesnt make any sense.
1	 Cross-datastore persistence Its hosted here: URL_https://github.com/impetus-opensource/Kundera [ URL_https://github.com/impetus-opensource/Kundera ] .
0	The page describing how to use the URL_http://www.eclipse.org/datatools/projec t_sqldevtools/sqltools_doc/SQL%20Query%20Parser%20User%20documentation.htm [SQL-Query-Parser] has an extremely brief use of URL_http://help.eclipse.org/h elp33/index.jsp?topic=/org.eclipse.datatools.doc.isv/html/reference/api/org/ec lipse/datatools/modelbase/sql/query/util/SQLQuerySourceFormat.html [SQLQuerySourceFormat] which provides these options: preserveSourceFormat the option to preserve the input source formating when SQL source text is generated statementTerminator the character separating multiple SQL statements hostVariablePrefix the character that preceedes a host language variable parameterMarker the character that identifies a host language parameter delimitedIdentifierQuote* the character that encloses delimited identifiers whose writing in case will be preserved omitSchema the current schema (omitted in SQL source, implicit to unqualified table references) qualifyIdentifiers the flag describing how identifiers in the SQL source will be qualified preserveComments the option to preserve comments in the parsed SQL source or/and the generated SQL source generateCommentsForStatementOnly the option to generate comments for the SQL source only in the context of the complete statement, or if set to false, for single SQL Query objects outside the context of a statement as well .
1	After exploring and actually using most of the major libraries listed here, I ended up writing a simplified API that is much easier to use and more fun to work with: URL_http://sharegov.blogspot.com/2011/06/json-library.html [ URL_http://sharegov.blogspot.com/2011/06/json-library.html ] .
1	JAXB Bindings File Sets @XmlElement type to String instead of XMLGregorianCalendar.
0	Your first criteria might be a little bit subjective.
1	Why use ANTLR when you can implement your own parser generator?
0	 Iris Image database: Text file db to store Iris Images.
0	Works well on Android in comparison with other answers which work only in enterprise java.
1	:).
1	@S.Lott - There is nothing wrong with flat files for a simple app.
1	I found configuring and using JBoss to be about as pleasing as trying to shave with a jagged spoon while riding a unicycle with no seat.
0	In that case, Id store the ciphertext in one field, the IV in another, and the salt and iterations together in a third.
0	Meanwhile we can dream of URL_http://groovy.codehaus.org/Operators#Operators- SafeNavigationOperator(%3F.
1	I have no affiliation to either product other than being a user of the free editions of yEd and DBVisualizer, and include them in this answer because using the combination of these programs can give a good preview on the library features needed for such a project, and can be used as comparison check for its results).
0	Perhaps you should be more specific next time.
1	Ill find more info on how to implement OAuth2 with drop wizard.
0	The GUI builder automatically takes care of the correct spacing and alignment.
0	I believe AES-128 doesnt require the unlimited strength JCE policy files.
0	Frankly, Ive never seen an editor which comes even close to what I can do manually in a text editor.
0	Real world example: _You want to create a new string out of many others_.
1	@jmort253 Many libraries are large, slow but powerful.
0	On the other hand, determining your own buffer size(s) you can tune your memory/processor usage balance.
1	To allow sending files between both computers, each computer will need to run the server (receiving code) to listen for incoming files, and they will both need to run the sending code when they want to send a file.
1	Heres a way using only standard Java library (note that the stream is not closed, YMMV).
1	I think that will be good.
0	I cant believe they can fix it, and I still cant believe mixing lightweight and heavyweight components would ever be desirable.
0	I think I vaguely remember seeing that in the logback project but I need one for the XML format.
1	 - then you just call lc.login(); and authenticate the credentials.
0	but for the 98% case, I think its pretty solid.
0	It can greatly help in migrating log4j.properties to logback.xml.
1	@Ronald: Erm... never mind that.
1	The second you start using Shiro though, you just get it.
0	If you want the file read by 3rd party as well, how about using some popular existing exchange format such as CSV or XML?
0	Both are quite good but I prefer the latter.
1	This can then be read and added to a CODETERM2 (we dont need CODETERM3 if we are not accessing it in multiple threads, and CODETERM4 is faster).
1	ill update the text.
1	Apache commons is meant to bridge different logging frameworks, but really just adds more complexity.
0	One should always strive to slot a level of interdirection and hide an implementation even if it is clogging with your own logging.
1	If you know what technology you are going to use, having a startup app that is customized for your needs can be a huge timesaver.
1	Thanks!
0	URL_http://github.com/rantav/hector [Hector] and URL_http://code.google.com/p/pelops/ [Pelops] are, as far as I know, the two that are most widely used (4).
0	A brief introduction from Apache Tika web site: The Apache Tika toolkit detects and extracts metadata and structured text content from various documents using existing parser libraries.
1	Great, stylish.
0	Do you mean, for concatenation?
0	This enables you to access spring beans from EJBs.
0	Sun also provides patch releases of GlassFish (akin to RedHats support for JBoss); see URL_https://blogs.oracle.com/glassfishforbusiness [ URL_https://blogs.oracle.com/glassfishforbusiness ] and sun.com/glassfish.
1	See full description here: URL_http://stackoverflow.com/q/5221524/828757 [Idiomatic-way-to-convert-an-InputStream-to-a-String-in-Scala] .
0	How do you create Java RESTful clients?
1	My api will just be used by my apps mobile and web interface.
1	As a best practice, an applet should only augment the servers capabilities in the context of authentication.
0	It can parse JSON to Maps and Lists faster than any other lib can parse to a JSON DOM and that is without Index Overlay mode.
1	Yeah, it really shouldnt require so much boilerplate to do something as simple as read strings from a stream.
1	Can you please clarify what null checks you would use in this case before the changed getters of someObject?
1	But if you want to make use of some auto generated clients, You can make use of WADL to describe and generate code.
0	This is the solution I went with in the end, and months later Im very happy with my decision.
1	+1 - thats exactly what he was looking for (aka cool).
0	Yes, it still is in use.
1	You can use the same scope that the rhino shell uses quite easily.
1	If you do not know this ahead of time, it is utterly bewildering.
1	Im not terribly familiar with the Guava library but I wouldnt be surprised if there was.
0	Can you package the native DLLs with your app?
1	A good alternative to RestSharp in the .NET world.
0	IDE for Swing.
0	I have a project which I need to manipulate files.
1	I wouldnt choose it for any new project -- most alternatives from the page are much better.
1	The big annoyance in switching is actually the configuration and supported appenders.
0	PlayOrm is another solution which is JPA-like but with noSQL specific features like you can do @NoSqlEmbedded on a List of Strings and it is embedded in that row leading to a table where each row is a different length than the other rows...this is a noSql common pattern which is why NoSql ORMs need a slight break from JPA.
1	The whole point of using InputStream is, that a) you dont know the length of the _complete_ stream (which bails out anything depending on available) and b) the stream can be anything - a file, a socket, something internal (which bails out anything based on File.size()).
1	You dont just want to extract parameters.
1	For most NoSQL engines youll probably want an id there, too, just for efficiencys sake.
0	From my understanding, NIO is meant for one server, many clients, but what Im thinking of is one client, many servers.
1	Thanks @trnl.
1	Will they co-exist happily?I thought I would use URL_http://logging.apache.org/log4j/1.2/index.html [log4j] together with both SL4J and the logging component from Apache commons, do you think thats a good idea?
1	3.
0	This involves creating your own URL_http://java.sun.com/javase/6/docs/api/java/security/Provider.html [CODETERM2] subclass and using it with URL_http://java.sun.com/javase/6/docs/a pi/javax/crypto/Cipher.html#getInstance%28java.lang.String,%20java.security.Pr ovider%29 [CODETERM3] .
1	It generates clean code and there is a good change that you have to tweak it a bit after code generation, you can find good documentation and underlying thoughts behind the tool URL_https://do cs.google.com/document/edit?id=1uydmzsDFIiw8OsoMdk5v_s1VW7wrujUmGdUU2zge0fs [here] .
0	It has took me hours to untangle their First Steps tutorial (with the help of another Java programmer!
1	It does not work for me to count the lines.The thing is: I have a file and I need to split it in 200 (this can change, it will come from the database) files for example.How do I do that?
0	If your code is running in a web browser, you will likely use other things.
1	BTW - I am the project lead for JBoss Messaging and HornetQ.
1	Im curious.
1	So best keep max one nullable item per line.
0	However, isnt there a security risk here of sending password in plain text?
1	The problem with this approach I find is it does not handle CR/LF translations too well.
1	Like another commentator mentioned, it does have its scalability issues.
0	I am omiting repetitions, but the 3 CODETERM1 s are part of the primary key, of the @Id.
0	@BalusC : Actually I need to convert mysql data to json (xml) and vice-versa.
1	Swing is built on top of AWT and includes light-weight components that look and behave the same on all platforms, so you never should use AWT components directly.
0	Here are Messaging performance data: URL_http://www.jboss.org/community/docs/DOC-10640 [ URL_http://www.jboss.org/community/docs/DOC-10640 ] JBoss MQ is not scalable at all: URL_http://www.jboss.org/community/docs/DOC-12452 [ URL_http://www.jboss.org/community/docs/DOC-12452 ] .
0	an SocketAppender since the event is serialized using the unchanged message pattern + the arguments as Strings.I guess it just depends how you define effectively though.
0	For instance, fluent facade API relieves the users from having to deal with connection management and resource deallocation CODESNIPPET_JAVA1 .
1	It is free and you can use larger key sizes than the default JDK.
1	 is no more part of preview SDK and it is available for Production use.
1	Id suggest using slf4j, since it can use log4j as a backend if thats what you need.
0	Oh, how do I feel your pain!
0	 if you need to be specific about the input streams encoding, you can provide the second argument to CODETERM1 constructor that indicates what charset to use (e.g.
0	Its a new area for me which Im eager to improve myself in.
0	Overall but a few types from JAAS are directly used in Java EE, basically CODETERM1 , CODETERM2 , and CODETERM3 .
0	Could you confirm that this fixes your issue?
1	Actually, I think youll have to do this part on your own using Rhino ( URL_http://www.mozilla.org/rhino/) .
1	Sending code: CODESNIPPET_JAVA2 .
0	) URL_http://en.wikipedia.org/wiki/SwingX [SwingX] Based on Swing and its mission is to create rich components for swing.
0	+1 anyway :).
1	Anyway, there are hundreds of alternatives in Java.
1	) ;-).
1	You could fairly easily use this to serve your file, using URLConnection to obtain it.
0	If Swing is deprecated, what is the alternative?
0	Samiksha, make that another question instead of trying to have a discussion thread in these comments.
1	The provided GUI is very useful to quickly test the scripts.
0	This is what I meant by an IDE-like interface, maybe not the best choice of words.
0	There are 2 that you can use (Ive used them both, and they are both very powerful, and easy to use): URL_http://netbeans.org/ [Netbeans] which has a built in URL_http://netbeans.org/features/java/swing.html [Gui-Builder] .
1	 You use URL_http://java.sun.com/javase/6/docs/api/java/lang/StringBuilder.html [CODETERM3] when you need to create a mutable character sequence, usually to concatenate several character sequences together.
0	See more focussed question here: URL_http://stackoverflow.com/questions/7782720/when-to-move-from - container-managed-security-to-alternatives-like-apache-shiro.
1	URL_http://www.sqlparser.com/sql-parser-java.php [General-SQL-Parser-for-Java] is not open source, but is exactly what you are looking after.
0	Log4j 2.0 is not a facade and does not advertise to be one.
1	I dont want my highly concurrent software to be slowed down by log commands that write everything to disk as some as the command is called.
0	Sometimes this is more important, then technical superiority ofone solution over another.
1	HornetQ looks good.
1	Im sorry.
0	CODESNIPPET_JAVA1 .
1	I would rather prefer a solution without adding additional libraries as mentioned in the post below: URL_http://stackoverflow.com/a/6938341/411951 .
1	Please help me if i am missing something in the code??..
0	I recently needed an encryption algorithm that worked across multiple platforms (Java & C#).
1	Ive a situation with a client that makes use of gson that converts, 300 objects at a time, from json to objects with gson and there are about 9-50k objects to convert.
1	@Gorky: Make a new question.
1	Thats just enormously easier.
1	I find the pull metaphor much more usable than the event metaphor, and creating a document tree using pull is trivial.
0	I can recommend URL_http://www.jooq.org [jOOQ] .
0	The re-sizing can get very degenerate.
0	Thanks for reply; but it gives error The method toJSONString() is undefined for the type JSONObject at jsonArray.push(jsonObj.
1	However with Java 5 (or 6?
0	Or stay and learn to like all the open source stuff that Java gives you.
0	:-/.
