label	data
0	Connect SLF4J to your favorite backend (Log4J, Logback...) by putting CODETERM3 in the classpath.
0	I use it in an android app.
1	CODESNIPPET_JAVA1 .
1	Technically, its a thread-local Map<string,string>.
0	I think this has the inconvenience os using the platform default encoding.
1	You will see 61 people follow AWT questions and 1.3k follow Swing).
0	With respect to JavaFXs webview, its based on webkit URL_http://docs.oracle.com/javafx/2/webview/jfxpub-webview.htm and from a few short tests that i have done it seems to work fine with js in general (including jquery and jqueryui).
1	To Lucene I would add SOLR URL_http://wiki.apache.org/solr/AnalyzersTokenizersTokenFilters [ URL_http://wiki.apache.org/solr/AnalyzersTokenizersTokenFilters ] .
0	As mentioned above, available() is not the way to go.
1	 A CODETERM9 with the message Illegal key size or default parameters means that the cryptography strength _is_ limited; the unlimited strength jurisdiction policy files are not in the correct location.
0	As Im using eclipse, I use the Visual Editor plugin.
1	Taking into account file one should first get a CODETERM1 instance.
1	Anyway, what is the content of the objects in the SAX2EventRecorder?
0	I like the URL_http://www.netbeans.org/features/java/swing.html [Swing-GUI- Builder] from the URL_http://www.netbeans.org/ [NetBeans-IDE] .
1	If you want to learn something, then any NoSQL database is fine - youd learn a lot about distributing data and scalability in the process.
0	Why is this?
1	Secure Debugging for Production JVMs.
1	This will change the newlines to the default newline choise.
1	If you need the authorization part for managing repository access, in terms of ACL for resources, this is what you are looking for sure.
1	You didnt explain your answer very well, and had extraneous variables; user359996 said the same thing as you, but much more clearly.
0	The problem I have (which I found out after my initial post) is that the 1.4.x Sun JVM can only bind to the default(?
1	Finally, Shiro offers extreme pluggability as well.
