	thread	tid	sent	ManualLabel	codes	stakeholder	signal	intent	action	LEN	LEN.1
1920	408820	408820:46	URL_http://dn.codegear.com/article/26970 [Swing-vs-AWT] .	p	['Others']					59	91
3417	267306	267306:21	Coding it will be significantly easier.	p	['Usability']					41	47
267	410890	410890:56	MetroidFan2002, note that I'm not proposing any side effects, which we all agree would be bad.	n	['Compatibility', 'Usability']					96	218
2134	8938752	8938752:32	).	p	['Others']					4	85
2593	26458	26458:29	But that was 2+ years ago and I haven't really used Netbeans heavily since so I do not know how things have changed with the latest releases.	o	['Performance', 'Usability', 'Others']					143	71
1217	992019	992019:65	Although MD5 is broken in some applications, I don't think that it is a problem here.	n	['Others']					89	120
948	326390	326390:96	For the current source, see the classes URL_http://code.google.com/p/guava-libraries/source/browse/guava/src/com/google/common/io/Files.java [Files] , URL_http://code.google.com/p/guava-libraries/source/browse/guava/src/com/google/common/io/CharStreams.java [CharStreams] , URL_http://code.google.com/p/guava-libraries/source/browse/guava/src/com/google/common/io/ByteSource.java [ByteSource] and URL_http://code.google.com/p/guava-libraries/source/browse/guava/src/com/google/common/io/CharSource.java [CharSource] in URL_http://code.google.com/p/guava-libraries/source/browse/guava/src/com/google/common/io [com.google.common.io] package.	o	['OnlySentiment']					642	137
96	5059224	5059224:12	Actually Java supports 4 methods to parse XML out of the box: DOM Parser/Builder: The whole XML structure is loaded into memory and you can use the well known DOM methods to work with it.	p	['Bug']					189	292
1923	408820	408820:49	are there any cases where awt is more useful/ advised to use then swing?	n	['Others']					74	91
3366	5536458	5536458:19	but Serialization will make it binary.	n	['Usability']					40	49
3528	309424	309424:23	@Ronald: Erm... never mind that.	o	['Usability']					34	44
3805	5620985	5620985:21	I have no personal experience of jooq but I have heard that it is quite ok.	o	['Usability']					77	36
3531	309424	309424:26	CODESNIPPET_JAVA1 .	o	['Usability']					21	44
3474	3409608	3409608:24	I can see from the task manager that the javaw process is still doing small IO writes, but I don't really know why this happens (I'm guessing race conditions?).	o	['Usability']		unhappy with suggestions			162	46
2326	7358775	7358775:15	Swing has a lot of rich components but are still lacking in some areas.	p	['Others']		suggestion			73	78
1890	408820	408820:16	Because AWT uses native GUI widgets, your OS knows about them and handles putting them in front of each other, etc., whereas Swing widgets are meaningless pixels within a window from your OS's point of view.	n	['Others']					209	92
557	5415111	5415111:43	I think Alex B is right when he says that objectively the API is bad and could have been better.	n	['Documentation']					98	169
2142	8938752	8938752:40	And the maintenance programmers will have to understand just what those regular expressions you've sprayed through the code do (Good Luck With That!	o	['Others']					150	84
791	2356137	2356137:29	Else it will mess up.	n	['OnlySentiment']					23	147
1981	6457003	6457003:11	As a best practice, an applet should only augment the server's capabilities in the context of authentication.	o	['Others']					111	90
2379	7358775	7358775:68	Is that really the case?	o	['Others']		explain			26	77
880	326390	326390:28	I know that is to avoid block the thread?	n	['OnlySentiment']					44	141
2987	1229273	1229273:28	GFv3 is significantly smaller than JBoss 5 and will start much faster.	o	['Security']					72	59
4145	1802915	1802915:30	Yes Arrays.fill does a for loop itself.	p	['Usability']		explain			41	22
2928	507391	507391:12	Note for those who don't know: JBoss Messaging is a rewrite of JBoss MQ that advertises much improved performance.	o	['Portability']					116	61
285	410890	410890:74	An exception that the property is null is a side-effect of invoking the getter, because it is something that occurred within the getter method invocation that forces the caller to adapt to its effects directly, instead of indirectly via a null check.	p	['Compatibility']					252	213
2252	221442	221442:6	Or specialized clients for e.g.	n	['Others']					33	80
1075	1522143	1522143:32	The sun java security stuff was just too buggy to work in a compatible manner.	n	['Others']		clarification			80	128
56	2129375	2129375:30	It doesn't matter what its main job is, as long as it does what you want it to do.	o	['Bug']					86	332
2974	1229273	1229273:15	Sometimes this is more important, then technical superiority ofone solution over another.	p	['Security', 'Usability']					91	59
4431	309424	309424:139	Charsets.UTF_8) for the CODETERM1 isn't necessary, but it is generally a good idea to specify the encoding if you know it (which you should!	p	[u'Others']					142	6
1564	268129	268129:46	Terracotta transparently clusters Java objects at the JVM level, and integrates with both Spring and Hibernate.	p	['Others']					113	104
3676	309424	309424:171	Note this method is particularly convenient if, instead of an you have a 	o	['Usability']					75	40
4062	354837	354837:50	 package, it can't be replaced by swapping a JAR - which is the way SLF4J bridges the other frameworks.	o	['Usability']					105	26
3446	267306	267306:50	For high volume data communications it may be better to use a more efficient wire protocol.	o	['Usability']					93	46
2786	2994304	2994304:48	Aggree that the docs are lacking somewhat, but, IDE support is pretty good, and, googling usually gets you some decent usage examples.	o	['Performance']					136	65
2940	507391	507391:24	JBossMessaging is relatively feature-light, compared to ActiveMQ, but it's rock-solid, well-documented and reliable.	p	['Portability']					118	60
1715	3451935	3451935:101	Cassandra, Neo4j, MongoDB, etc.	n	['Others']		support suggestion			33	99
3052	338586	338586:41	GSon uses the same design protocol JSON.org went with when developing JSONObject and JSONArray.	o	['Security']					97	57
194	12399462	12399462:2	I'm using Rhino 1.7R4 and env.js 1.2 to run Javascript code inside Java I want to print from my Javascript code a string to the Java console.	o	['Community']					143	241
3578	309424	309424:73	Only the version that takes a byte[] parameter is.	o	['Usability']					52	42
2738	26458	26458:174	URL_https://developers.google.com/java-dev-tools/download [window-builder-pro] is good option and it is free also.	p	['Performance']					116	66
2223	333690	333690:56	Note that if you test your server from a different machine, you need to replace localhost by either the IP address of your server or its domain name if it has one defined.	o	['Others']					175	81
2118	8938752	8938752:16	After all, with just GET you shouldn't be changing any state anywhere (well, not state worth the name; server logs don't count).	o	['Others']					130	85
2656	26458	26458:92	At the end of the day, I have worked with different similar UI tools, Flash Builder, Delphi etc., but unless you do some relatively trivial UI design, not including much business logic and communication with other layers, you'll have to accept that what you are capable of creating in code once you learn to do it properly is much more powerful than what any editor is capable of providing you with.	p	['Performance']					401	69
477	1728020	1728020:21	Having trouble understanding.	o	['Documentation']					31	179
3294	9503477	9503477:7	YES!	o	['Usability']					6	51
605	1359689	1359689:10	You can use URL_http://download.oracle.com/javase/7/docs/api/java/net/HttpURLC onnection.html [java.net.HttpUrlConnection] .	o	['Legal']					126	164
823	2356137	2356137:61	YMMV.	o	['OnlySentiment']					7	145
1128	49226	49226:36	plz update it...	n	['Others']					18	125
1714	3451935	3451935:100	If you want to learn something, then any NoSQL database is fine - you'd learn a lot about distributing data and scalability in the process.	n	['Others']					141	99
3494	3409608	3409608:44	Set a very large socket receive buffer.	p	['Usability']					41	45
650	1359689	1359689:55	Especially if you want to use it in WebServices you have to set timeouts, otherwise the above code will wait indefinitely or for a very long time at least and it's something presumably you don't want.	o	['OnlySentiment']					202	159
3914	6089399	6089399:14	However, if you're free to choose, then you should consider URL_http://logback.qos.ch/ [Logback] instead, the spiritual successor to Log4j.	p	['Usability']					141	32
1215	992019	992019:63	@erickson so the lack of support is the only criteria not to use 'PBEWithMD5AndDES'?	o	['Others']					86	121
4024	354837	354837:12	In chronological order of api apperance (as far as I know): Log4j because most everybody uses it (in my experience) Commons Logging because open source projects use it (so they can integrate with whatever logging framework is used in the integrated solution); especially valid if you're an API/Framework/OSS and you rely on other packages that use Commons Logging.	p	['Usability']					366	28
811	2356137	2356137:49	Implement this filter to just keep track of the number of bytes going through it (apache commons io may have such a utility in it already).	o	['OnlySentiment']					141	146
2531	7358775	7358775:220	@a_horse_with_no_name that right with same progress in SWT, SwingX, new owner, new maniers.	o	['Others']					93	72
3179	338586	338586:168	FWIW I didn't much care for the www.json.org parser either.	n	['Usability']					61	54
4152	1802915	1802915:37	CODESNIPPET_JAVA1 .	n	['Usability']					21	22
3834	5620985	5620985:50	And two thousand reasons, why it Take a simple select 1, which also comes in at least these flavours: select 1 from dual, select 1 from sysibm.dual, select 1 from sysibm.sysdummy1, select 1 from information_schema.system_users... Oh don't get me started :-).	p	['Usability']					260	35
1845	5828625	5828625:6	I'm sure Swing has still a long life to live (at least 2 or 3 more years).	p	['Others']					76	94
3441	267306	267306:45	This is a good choice if the volumes of data being shipped are small, however I have had bad experiences with XML- based protocols when writing inter-process communications that ship large amounts of data (e.g.	o	['Usability']					212	46
827	2356137	2356137:65	Avoid accessing the disk.	n	['OnlySentiment']					27	144
3794	5620985	5620985:10	If you have queries as a text, they will leave broken.	n	['Usability']					56	36
3539	309424	309424:34	Thanks, for my version of this I added a finally block that closes the input stream, so the user doesn't have to since you've finished reading the input.	o	['Usability']					155	43
3064	338586	338586:53	Gson is very slow.	o	['Security']					20	57
728	3775694	3775694:8	See URL_http://commons.apache.org/proper/commons-io///apidocs/org/apache/commo ns/io/FileUtils.html#deleteDirectory%28java.io.File%29 [FileUtils.deleteDirectory()] <s>Also with URL_http://code.google.com/p/guava-libraries [Guava] :</s> <s> CODETERM1 </s> This has been removed from Guava several releases ago.	o	['OnlySentiment']					311	153
4033	354837	354837:21	I now know that I'm not going to be using log4j as my default framework any more.	n	['Usability']		suggestion			83	28
1958	408820	408820:84	A peer is awidget provided by the operating system, such as a button object or an entryfield object.	p	['Others']					104	91
1822	9887454	9887454:14	Thanks for your help.Please suggest good link to know more difference b/w DVM and JVM.	p	['Others']					88	95
3015	338586	338586:4	I have added a hyperlink to my parser in my answer ( URL_http://www.softwaremonkey.org/Code/JsonParser) .	o	['Security']					107	58
757	3775694	3775694:37	It deletes the specified directory and returns true if the directory deletion was successful.	p	['OnlySentiment']					95	151
4009	12094564	12094564:36	Yes I think slf4j is what I'll go with.	p	['Usability']					41	29
42	2129375	2129375:16	+1 for Web Harvest -- if you are trying to do page scraping it is the way to go.	p	['Bug']					82	355
435	395401	395401:30	Anything similar in Guava?	n	['Documentation']					28	186
3505	3409608	3409608:55	Each writer only needs to seek once; after that it is just sequential I/O.	n	['Usability']					76	45
4325	309424	309424:33	 more edit:** nixed try/catch, Patrick's way is more laconic.	o	['Usability']					63	16
361	922779	922779:34	You could easily build a little war file that achieved the same purpose via a socket connection.	o	['Documentation', 'Usability']					98	199
326	410890	410890:115	Place each getter on its own line and debug.	o	['Compatibility']					46	205
4422	309424	309424:130	This shows how to iterate over the lines in a stream, not how to read the entire stream into a string.	o	[u'Others']					104	7
2042	20639844	20639844:45	The general principles involved with Dropwizard authentication URL_http ://gary-rowe.com/agilestack/2012/10/23/multibit-merchant-implementing-hmac- authentication-in-dropwizard [are-discussed-in-this-blog-article] .	n	['Others']					217	88
1565	268129	268129:47	It is free and open source.	p	['Others']					29	104
4154	1802915	1802915:39	The above is fine.	o	['Usability']					20	22
3504	3409608	3409608:54	Well you're doing N-1 redundant seeks, and last time I looked at it, which is decades ago, seek was a surprisingly expensive operation.	p	['Usability']					137	45
1525	268129	268129:7	Edit: I have received comments requesting me to elaborate a bit, so here goes: The main problem we want to solve is that we want to have only one instance of Hibernate.	o	['Others']					170	106
3658	309424	309424:153	Works well on Android in comparison with other answers which work only in enterprise java.	o	['Usability']					92	40
1975	6457003	6457003:5	Security theatre?	o	['Others']					19	90
241	410890	410890:30	 When your method creates local objects, that method can call methods on the local objects.	o	['Community']					93	225
3231	1688099	1688099:34	@Fahim: scroll down in the code example.	o	['Usability']					42	52
4156	1802915	1802915:41	It seams to me you are optimizing before you know if you need to.	n	['Usability']					67	22
455	3125927	3125927:7	Async request like AJAX: URL_http://hc.apache.org/httpcomponents-asyncclient- dev/ [ URL_http://hc.apache.org/httpcomponents-asyncclient-dev/ ] Sync request: URL_http://hc.apache.org/httpcomponents-client-4.0.1/index.html [ URL_http://hc.apache.org/httpcomponents-client-4.0.1/index.html ] Cookies is A kind of Header.	o	['Documentation']		clarification			320	183
3101	338586	338586:90	See URL_http://www.cowtowncoder.com/blog/archives/2009/08/entry_305.html [this- blog-entry] for more details.	p	['Security']					111	56
3946	462566	462566:22	I think the schema there explain the situation very well.	n	['Usability']					59	31
665	1109307	1109307:9	Recieving code: CODESNIPPET_JAVA1 .	o	['OnlySentiment']					37	158
1090	1522143	1522143:47	( if you have a masters in math ) This book gets to the point, I had a cipher working in 5-6 hours.	p	['Others']					101	127
1132	49226	49226:40	The example is at : URL_http://forums.sun.com/thread.jspa?messageID=4164916 [ URL_http://forums.sun.com/thread.jspa?messageID=4164916 ] .	o	['Others']					139	125
2036	20639844	20639844:39	 Implementing this does not involve using any third party social authentication services such as Google or Facebook.	p	['Others']					120	88
2746	2994304	2994304:8	 AWT: Speed: use of native peers speeds component performance.	o	['Performance']					64	66
4231	2971315	2971315:45	 Alternatives:** Just as a note, if you are doing really CODETERM24 building and manipulation, there is a much more performance oriented alternative called URL_http://ahmadsoft.org/ropes/ [Ropes] .	p	['Usability']					199	21
738	3775694	3775694:18	Since you iterrate through the list in the same way it will try to delete the top most folder before deleting its subfolders, this will fail.	n	['OnlySentiment']					143	152
3641	309424	309424:136	I would hazard a guess that any performance loss would be small, or could be handled by every once in a while logging them to a file and destroying the old String obj's.	p	['Usability']					171	41
1223	992019	992019:71	@Astron Sorry, I don't really understand your question.	o	['Others']					57	120
2038	20639844	20639844:41	Glad it was able to get you started.	p	['Others']					38	88
4121	1802915	1802915:6	Because such a constructor does not exist, and you cannot extend from String, you have either to create a wrapper class or a method to do this for you.	o	['Usability']					153	24
686	1109307	1109307:30	You could fairly easily use this to serve your file, using URLConnection to obtain it.	p	['OnlySentiment']					88	156
2378	7358775	7358775:67	I wasn't aware that SWT was based on a combination of AWT and Swing.	o	['Others']					72	77
1957	408820	408820:83	So components like JButton,JTextArea, etc., are lightweight because they do not have an OS peer.	p	['Others']					98	91
3863	660609	660609:9	what's wrong with you, Stackoverflow?	n	['Usability']					39	34
126	5059224	5059224:42	Nikita's point is an excellent one: don't confuse mature with bad.	p	['Bug']					68	274
1414	4991084	4991084:6	It's hard to just 'get it'.	n	['Others']					29	111
4388	309424	309424:96	This solution uses multibyte characters.	o	[u'Documentation']					42	10
1532	268129	268129:14	But this led to several new problems: 1) Security manager denies access to RMI classloader, so the client failed once we tried to invoke methods on the JNDI resource.	n	['Others']					168	106
3783	312552	312552:36	So SQL Formatter is not an option for me.	o	['Usability']					43	37
3023	338586	338586:12	I'm using Jackson Json on an android app, which is incredibly fast, and come a very long way since this question was asked/answered.	p	['Security']					135	58
551	5415111	5415111:37	HttpClient has to deal with several dozen customization parameters and context specific strategies and objects.	o	['Documentation']					113	169
1881	408820	408820:7	Swing is a more-or-less pure-Java GUI.	o	['Others']					40	93
3951	462566	462566:27	The former is for funneling to your desired logging framework (log4j, logback, etc), the latter is to replace the used logging framework.	o	['Usability']					139	31
2418	7358775	7358775:107	[development-has- picked-up-again] .	p	['Others']					38	75
2310	221442	221442:64	There are few interesting and useful URL_http://wintermuteblog.blogspot.com/2010/01/wadl-toolbox.html [WADL-tools] mentioned on wintermute.	o	['Others']					141	79
840	2356137	2356137:78	And it's all.	o	['OnlySentiment']					15	143
480	1728020	1728020:24	You then say Those connections stay open until they time out or you send the client a message.	o	['Documentation']					97	179
4099	354837	354837:87	That is what commons logging does so why reinvent the wheel?	o	['Usability']					62	25
3674	309424	309424:169	How about: CODESNIPPET_JAVA1 .	o	['Usability']					32	40
1462	4991084	4991084:54	It was though, like I read somewhere, sort of something that you set up once near the beginning of the develoepment of the app, and then pray for it to keep working till the end, because if you have to go fix it you'll probably have forgotten most of the stuff you had to parameter.	n	['Others']					284	108
1467	4991084	4991084:59	And while the doc is quite good for the general use cases and even some customization, it did not go deep enough to cover my needs.	n	['Others']					133	108
747	3775694	3775694:27	And so you try to delete the folder before it is empty.	o	['OnlySentiment']					57	152
4026	354837	354837:14	 Java logging because you don't want to add in an extra jar.	o	['Usability']					62	28
2881	483379	483379:58	It would be nice to know what settings and things in the last comment.	p	['Performance']					74	62
1077	1522143	1522143:34	Also: bouncycastle doesn't require you to run inside that security sandbox stuff (which is mostly for applets - remember them?	o	['Others']					128	128
3439	267306	267306:43	Given the small number of connections involved, java.net sounds like the right solution.	o	['Usability']					90	46
3253	1688099	1688099:56	Example: JSONObject#getNames(JSONObject) returns null instead of an empty List or array if no names are available.	n	['Usability']					116	52
780	2356137	2356137:18	Yes, just pipe it from the FileInputStream to the FilOutputStream using only a suitably sized byte buffer array.	o	['OnlySentiment']					114	148
1726	3232842	3232842:4	It is not bloated.	p	['Others']					20	99
3755	312552	312552:8	The replacement is org.hibernate.jdbc.util.BasicFormatterImpl: CODESNIPPET_JAVA1 .	o	['Usability']					84	37
2966	1229273	1229273:7	A number of things from my own experience: 1.	o	['Security', 'Usability']					47	60
2087	4706995	4706995:19	Even if it doesn't do exactly what you need, it might provide some good examples to look at.	n	['Others']					94	86
2854	483379	483379:31	The info needed for them to do anything was: JRA recordings, MissionControl MemLeak screenshots, garbage collection logs and any dump files from the jvm.	o	['Performance']					155	63
1721	3451935	3451935:107	edit to remove the SHOUTY CAPS.	p	['Others']					33	99
1787	5802639	5802639:38	PlayOrm is another solution which is JPA-like but with noSQL specific features like you can do @NoSqlEmbedded on a List of Strings and it is embedded in that row leading to a table where each row is a different length than the other rows...this is a noSql common pattern which is why NoSql ORM's need a slight break from JPA.	o	['Others']					327	96
1897	408820	408820:23	Some will say it took far too long to get to this point, but most will say that it is well worth it.	p	['Others']					102	92
725	3775694	3775694:5	Please help me if i am missing something in the code??..	o	['OnlySentiment']					58	153
397	922779	922779:70	2.	o	['Documentation']		explain suggestion			4	192
80	2129375	2129375:54	@Shayan So what?	o	['Bug']					18	309
1692	3451935	3451935:78	@ericflo - Can you elaborate a bit more please?	p	['Others']					49	100
9	15936368	15936368:12	It might be that the XPath term in your Binding is not finding the required element.	n	['Bug', 'Usability']					86	538
3444	267306	267306:48	ASN.1).	p	['Usability']					9	46
2371	7358775	7358775:60	AWT's major failing is it's lack of components & functionality.	n	['Others']					65	77
3563	309424	309424:58	Why not just use a reader?	o	['Usability']					28	43
438	395401	395401:33	System.out.println(Collection c) already print any type of collection in readable format.	o	['Documentation']					91	186
2812	2994304	2994304:74	Have a look at Webstart for deploying your application.	p	['Performance']	User-helper	clarification			57	64
3665	309424	309424:160	just as a side note, the original readFully method I have in my code does not return String, it returns byte[] for a more general purpose functionality.	o	['Usability']					154	40
347	922779	922779:20	 I ended up writing three classes: (1) TurnOnDebuggerException, a plain 'ol Java exception, (2) DebuggerPoller, a background thread the checks for the existence of a specified file on the filesystem, and (3) DebuggerMainWrapper, a class that kicks off the polling thread and then reflectively calls the main method of another specified class.	o	['Documentation', 'Performance']					344	201
2743	2994304	2994304:5	Related: URL_http://stackoverflow.com/questions/408820/what-is-the-difference - between-swing-and-awt.	o	['Performance']					104	66
1728	3232842	3232842:6	Works with Spring way of doing things, or is at least easy to make it work with Spring 3.	o	['Others']		clarification			91	99
1239	992019	992019:87	But every message you send after that should include the unique IV that was used to encrypt that message (and that message.	n	['Others']					125	119
4250	2971315	2971315:64	Do you mean, for concatenation?	o	['Usability']					33	20
4171	1802915	1802915:56	Try this Using the substring(int start, int end); method CODESNIPPET_JAVA1 .	o	['Usability']					78	21
4405	309424	309424:113	@coolcfan - I do agree with you on that point.	n	[u'Others']					48	9
1526	268129	268129:8	This is due to problems with invalidation of Hibernate's 2nd level cache when running several client applications working with the same datasource.	n	['Others']					149	106
2770	2994304	2994304:32	I wouldn't recommend AWT, it gets very little love these days (other than the bits that are needed for Swing).	p	['Performance']					112	65
1785	5802639	5802639:36	Have a look at Kundera.	o	['Others']					25	96
2763	2994304	2994304:25	 URL_http://edn.embarcadero.com/article/26970 [More-Reading.	o	['Performance']					62	65
3274	1688099	1688099:77	Its very handy.	o	['Usability']					17	51
3351	5536458	5536458:4	and then I need to things like search/validate/create/read.	o	['Usability']					61	49
1301	992019	992019:149	A workaround for lack of AES-256 support is to take some freely available implementation of AES-256, and use it as a custom provider.	o	['Others']					135	116
1437	4991084	4991084:29	For more on Shiro's Spring integration: URL_http://shiro.apache.org/spring.html [ URL_http://shiro.apache.org/spring.html ] .	o	['Others']					127	110
2872	483379	483379:49	That's what the contents is.	o	['Performance']					30	62
86	5059224	5059224:2	I'm searching the java library for parsing XML (complex configuration and data files), I googled a bit but couldn't found other than dom4j (Seems like they are working on V2)..	n	['Bug']					178	302
3600	309424	309424:95	is there a chance to broke multi-bytes character in this solution?	o	['Usability']					68	42
1623	3451935	3451935:9	2.	p	['Others']					4	102
1877	408820	408820:3	Are there any cases where awt is more useful/ advised to use then swing or vice-versa?	o	['Others']					88	93
2112	8938752	8938752:10	So I'd call it the pioneer, not Restlet.	o	['Others']					42	85
