	thread	tid	sent	ManualLabel	codes	stakeholder	signal	intent	action	LEN	LEN.1
2305	221442	221442:59	This is how it works: CODESNIPPET_JAVA1 .	o	['Others']					43	79
2831	483379	483379:8	Don't ask.	n	['Performance']					12	64
2540	7358775	7358775:229	However, I do share your view on Swing not offering advanced components.	p	['Others']					74	72
3484	3409608	3409608:34	Doh!.	n	['Usability']					7	45
1872	5828625	5828625:33	You have to read input-values from widgets and store them in normal variables before a dialog is disposed.	o	['Others']		support suggestion			108	93
2611	26458	26458:47	It includes URL_http://www.instantiations.com/windowbuilder/swingdesigner/index.html [Swing-Designer] , which is a Swing UI builder.	o	['Performance', 'Usability']					134	70
3269	1688099	1688099:72	CODESNIPPET_JAVA1 .	o	['Usability']					21	52
4208	2971315	2971315:22	 Basics:** CODETERM1 is an immutable class, it can't be changed.	o	['Usability']					66	21
1339	5571519	5571519:6	Since there are so many ways to go about it, we could better inform you if you shared your goals and why you're trying to to DIY.	o	['Others']					131	115
3498	3409608	3409608:48	Three connections can be faster than one, briefly at the start of a transfer.	n	['Usability']					79	45
4365	309424	309424:73	Only the version that takes a byte[] parameter is.	o	['Usability']					52	12
2948	507391	507391:32	Apparently there are certain concern when it comes to persistent storage in ActiveMQ.	o	['Security', 'Bug']					87	60
3693	309424	309424:188	or if you want raw speed I'd propose a variation on what Paul de Vrieze suggested (which avoids using a StringWriter (which uses a StringBuffer internally) : CODESNIPPET_JAVA2 .	o	['Usability']		suggestion			179	39
3849	5620985	5620985:65	After all, it's become the standard way of doing this with JPA, even if it's a bit verbose...	o	['Usability']					95	34
3466	3409608	3409608:16	Much appreciated.	p	['Usability']					19	46
714	1109307	1109307:58	This can be a daemon app (or Windows system process), or it can be a Unix-style superserver that's configured to load and run the actual file-copy app when someone contacts the listening port.	o	['OnlySentiment']					196	155
3589	309424	309424:84	In the situation where you want to take something that you know is encoded in the default encoding for the platform, then the default version is correct.	o	['Usability']					155	42
2183	333690	333690:16	Definitely an up vote!.	p	['Others']					25	83
192	35785	35785:42	Castor provides Java-to-XML binding, Java-to-SQL persistence, and more.	p	['Community']					73	243
2101	7873197	7873197:8	You can use the CODETERM2 annotation to flag other types (such as ServletContext or the HttpServletRequest specifically).	o	['Others']					123	86
2857	483379	483379:34	You can then analyze the heap dump with the _jhat_ tool (it comes with your JDK).	o	['Performance']					83	63
2833	483379	483379:10	Now, even the longest response does not carry 4MB of data.	o	['Performance']					60	64
3772	312552	312552:25	Thanks.	p	['Usability']					9	37
3365	5536458	5536458:18	;) .	n	['Usability']					6	49
1819	9887454	9887454:11	3) Please look to increase that (17%) [accept rate]( URL_http://meta.stackoverflow.com/a/65088/155831) .	o	['Others']					106	95
3599	309424	309424:94	I like how this works without adding more libraries to your project.	p	['Usability']					70	42
657	1109307	1109307:1	How to transfer files from one computer to another over the network using Java?	o	['OnlySentiment']					81	159
4160	1802915	1802915:45	CODESNIPPET_JAVA1 .	o	['Usability']					21	21
3540	309424	309424:35	Simplifies the caller code considerably.	p	['Usability']					42	43
214	410890	410890:3	I get a rather useless exception text like: CODESNIPPET_JAVA2 .	n	['Community']					65	232
1528	268129	268129:10	First, we tried to look at how the business layer alone could be exposed to other web apps, and Spring offers JMX wrapping at the price of a tiny amount of XML.	o	['Others']					162	106
2340	7358775	7358775:29	) Have a very nice set of components, like for example TreeTable.	n	['Others']					67	78
2228	333690	333690:61	In the diagram below, ports represent the connector that enables the communication between components which are represented by the larger boxes.	p	['Others']					146	81
2032	20639844	20639844:35	Looks like their docs are pretty good too, and being open source, you should find lots of examples.	p	['Others']					101	88
215	410890	410890:4	I find it rather hard to find out wich call actually returend null, often finding myself refactoring the code to something like this: CODESNIPPET_JAVA3 .	n	['Community']					155	232
2959	507391	507391:43	URL_http://www.spec.org/jms2007/results/jms2007.html [ URL_http://www.spec.org/jms2007/results/jms2007.html ] .	o	['Security', 'Usability']					113	60
349	922779	922779:22	Replace your main class with DebuggerMainWrapper in your start-up scripts 2.	o	['Documentation', 'Security']					80	200
1010	326390	326390:158	One Line Solution CODESNIPPET_JAVA1 .	o	['Others']					39	132
1842	5828625	5828625:3	I like Swing and use it all the time.	p	['Others']					39	94
786	2356137	2356137:24	Using lineStr.getBytes().length ?	o	['OnlySentiment']					35	148
4274	2971315	2971315:88	It's clunky and hard to read, and overly verbose.	n	['Usability']		clarification			51	19
2619	26458	26458:55	It simply drops a little piece of information into your Javadoc marking it as an entry point.	o	['Performance', 'Usability']					95	70
1267	992019	992019:115	I can't speak to the legal ramifications of doing so (your software might be illegal to import into certain regions).	o	['Others']		suggestion			119	118
1255	992019	992019:103	@AndyNuss This example is for reversible encryption, which generally should not be used for passwords.	p	['Others']					104	118
59	2129375	2129375:33	URL_http://tika.apache.org/ [Apache-Tika] is the best choice.	p	['Bug']					63	327
3385	5536458	5536458:38	You are right - reading is not included - thus I only mentioned generation of his files.	o	['Usability']					90	48
4245	2971315	2971315:59	better article URL_http://java.sun.com/developer/technicalArticles/Interviews/comm unity/kabutz_qa.html.	p	['Usability']					106	20
969	326390	326390:117	I was looking for the quickest and simplest way to get a text file into a String.	n	['Others']					83	135
1729	3232842	3232842:7	Has a Maven repository, preferably it's already in the main repositories 4.	o	['Others']		query explain			77	99
3827	5620985	5620985:43	Also no documentation visible...	o	['Usability']					34	35
74	2129375	2129375:48	Well: there aren't so many good HTML parsers in java as you need, but here are some alternatives: URL_http://java-source.net/open-source/html-parsers [http ://java-source.net/open-source/html-parsers] Very few of them support Javascript.	n	['Bug']		suggestion			239	312
1580	268129	268129:62	If you don't like RMI, Spring offers a few other remoting options - Hessian, Burlap, and HttpInvoker (Spring's custom remoting solution - Java serialization over HTTP).	p	['Others']		clarification			170	104
2425	7358775	7358775:114	But some are slow, some are buggy, some are incomplete.	n	['Others']					57	75
1852	5828625	5828625:13	@Dean: The application framework was a JSR planned for Java 7, now deferred.	n	['Others']					78	94
991	326390	326390:139	I seems to me that the finally block does not know variables defined in the try block.	o	['Others']					88	134
2927	507391	507391:11	And an independent report would be nice.....	n	['Portability']					46	61
3632	309424	309424:127	How about this?	o	['Usability']					17	41
2208	333690	333690:41	For example, Restlet can easily work with remote resources using its HTTP client connector.	o	['Others']					93	82
144	5059224	5059224:60	The only possible reason to use DOM is because it's perceived as a standard and is supplied in the JDK: in all other respects, the others are all superior.	n	['Bug']					157	264
1552	268129	268129:34	But they share the common EJB back end, so you have only a single 2nd level cache.	o	['Others']					84	105
3149	338586	338586:138	Gson can also be used to serialize arbitrarily complex objects.	o	['Usability']		suggestion			65	55
2157	8938752	8938752:55	This is just my point, why use a sledgehammer to hammer in a nail.	n	['Others']					68	84
1257	992019	992019:105	That means that in the example above, you'd store the result of tmp.getEncoded() as the hash.	o	['Others']					95	118
2792	2994304	2994304:54	We still use it.	o	['Performance']					18	64
743	3775694	3775694:23	close - he's not using arrays but lists.	o	['OnlySentiment']					42	152
1681	3451935	3451935:67	I'd recommend it.	o	['Others']					19	101
3704	309424	309424:199	Since you're using buffer variable locally with no chance of being shared across multiple threads you should consider changing its type to StringBuilder, to avoid the overhead of (useless) synchronization.	n	['Usability']		explain suggestion			207	39
2283	221442	221442:37	I use Apache HTTPClient to handle all the HTTP side of things.	o	['Others']					64	79
1856	5828625	5828625:17	Thanks for sorting this out for me.	p	['Others']					37	94
1470	4991084	4991084:62	And I am glad I did, because after a day working on it I managed to learn enough about the APIs not only to set up a basic authentication and authorization system in my Spring webapp without trouble, but also to implement the custom SSO behaviour I was looking for.	p	['Others']					267	108
772	2356137	2356137:10	It really doesn't matter whether you're using CODETERM1 or not.	o	['OnlySentiment']					65	149
1234	992019	992019:82	erickson says to Share the password (a char[]) and salt (a byte[]8 with recipient but then send the ciphertext and the iv to the recipient which is it?	o	['Others']					157	119
1932	408820	408820:58	(There are better 3rd party native looking skins than Swing's implementations BTW) Lots of people preferred using AWT's FileDialog over Swing's FileChooser because it gave the platform file dialog most people were used to rather than the 'weird' custom Swing one.	p	['Others']					265	91
4282	2971315	2971315:96	That doesn't sound useful at all, but maybe I have yet to see the light :) .	n	['Usability']					78	19
2105	8938752	8938752:3	I mean, if i was looking to create URL_http://stackoverflow.com/questions/6774904/nested-rest-routing [the-url- structure-described-by-Wim] URL_www.example.com/images URL_www.example.com/images/id/num URL_www.example.com/images/tag/num URL_www.example.com/images/tag/num/num/num Would it not be easier (for future developers) and faster (to implement and learn) to map the url pattern /images to a servlet and have a line or two that parses the url for the parameters instead of learning, implementing and configuring one of these libraries to do it for you.	o	['Others']					560	86
3317	9503477	9503477:30	for converting json to pojos : URL_http://code.google.com/p/google-gson/ [gson] and URL_http://jackson.codehaus.org/ [jackson] .	o	['Usability']					130	50
1878	408820	408820:4	Related: URL_http://stackoverflow.com/questions/2994304/is-java-swing-still-in - use/2994324#2994324.	o	['Others']					103	93
3652	309424	309424:147	eg.	o	['Usability']					5	40
2892	4097567	4097567:4	I've been trying to make this work by putting my own hibernate jars in my WEB- INF/lib folder and creating my own classloader for my WAR in jboss-web.xml CODESNIPPET_JAVA1 .	o	['Performance']					175	62
2566	26458	26458:2	Is there any IDE that simplifies creating Swing applications (ideally something along the lines of Visual Studio) .	p	['Others']					117	71
421	395401	395401:16	usage of reflection ToStringBuilder, HashCodeBuilder and EqualsBuilder is highly inefective.	n	['Documentation']					94	188
833	2356137	2356137:71	Avoid processing bytes and characters individually.	p	['OnlySentiment']		suggestion			53	144
1327	4644625	4644625:8	Thank You!!	p	['Others']					13	115
3571	309424	309424:66	Only works for closes streams, I believe.	n	['Usability']					43	43
2563	5905334	5905334:8	I discovered them recently and this is really it.	o	['Others']					51	71
1912	408820	408820:38	:).	o	['Others']					5	92
1346	5571519	5571519:13	 How hard is to build this tool?	o	['Others']					34	114
2482	7358775	7358775:171	URL_http://www.eclipse.org/swt/ [SWT] by itself is pretty low-level, and it uses the platform's native widgets through JNI.	p	['Others']					125	74
3656	309424	309424:151	@Chris Noldus On the other hand, some people already have guava in their project, like me, and think this solution is more elegant than the sdk-only version.	o	['Usability']					159	40
595	5415111	5415111:81	It is pretty convenient for a lot of cases.	p	['Legal']					45	164
2000	20639844	20639844:3	From previous questions I found great example of authenticating with openID on github: URL_https://github.com/gary-rowe/DropwizardOpenID [ URL_https://github.com/gary-rowe/DropwizardOpenID ] However, I don't want to deal with openID at the moment and simply want users to 1.	p	['Others']					276	89
996	326390	326390:144	CODESNIPPET_JAVA1 .	n	['Others']					21	133
3256	1688099	1688099:59	@Malax Since you have access to the code, couldn't you change JSONObject#getNames to return whatever you'd like in that case?	n	['Usability']					127	52
2681	26458	26458:117	It generates clean source code, with good patterns and easy to patch/modify/extend.Unfortunately, it is not very stable.	n	['Performance']					122	68
2102	7873197	7873197:9	See URL_http://cxf.apache.org/docs/jax-rs-basics.html#JAX-RSBasics- Contextannotations [Context-Annotations] .	o	['Others']					112	86
1032	326390	326390:180	That said, there are probably a hundred better ways to do it (just, this method has less code).	o	['Others']					97	131
3651	309424	309424:146	+1 for guava, -1 for not specifying the encoding of the input stream.	o	['Usability']					71	40
1795	5304919	5304919:6	possible duplicate of [GAE webapp alternative working outside of GAE environment]( URL_http://stackoverflow.com/questions/5278308/gae-webapp - alternative-working-outside-of-gae-environment).	o	['Others']					193	96
2262	221442	221442:16	The nice thing is if you implement your RESTful resources using JAX-RS then the Jersey client can reuse the entity providers such as for JAXB/XML/JSON/Atom and so forth - so you can reuse the same objects on the server side as you use on the client side unit test.	p	['Others']					266	80
4177	3581741	3581741:5	Example: In Java, you would say str.charAt(8);In C#, you would say str[8]; .	o	['Usability']					78	21
3089	338586	338586:78	So I used Gson.	p	['Security']		suggestion			17	56
1809	9887454	9887454:1	Convert Java AWT code to Android.	o	['Others']	User-turned-author	fix code		attempt	35	95
1743	3232842	3232842:21	It's a URL_https://github.com/Netflix/astyanax/wikihttp:// [very-well-documented] Cassandra API with many examples and support very high level features such as locking and all versions of cql.	p	['Others']					194	98
3078	338586	338586:67	If you have a deep bean structure, everything else will be implemented with dyna beans.	n	['Security']					89	56
3582	309424	309424:77	Code that is going to work on a single could be quite sure that default encoding will be fine.	o	['Usability']					96	42
242	410890	410890:31	Therefore, one should not have a chain of messages, e.g.	o	['Community']					58	223
3879	660609	660609:25	 If you need a parser there should be a parser in the code base of URL_http://db.apache.org/derby/ [Apache-Derby] .	o	['Usability']					117	33
3728	309424	309424:223	As mentioned above, available() is not the way to go.	n	['Usability']					55	38
442	395401	395401:37	line 21: ToStringBuilder cannot be resolved.	o	['Documentation']					46	185
3554	309424	309424:49	@Igal I didn't measure it.	o	['Usability']					28	43
864	326390	326390:12	Java 7 introduces byte[] Files.readAllBytes(file); To those, who suggest the 'one-line' Scanner solution: Don't yo need to close it?	o	['OnlySentiment']					134	142
885	326390	326390:33	Some channels (SocketChannel) support non-blocking IO, but this isn't true of all channels.	o	['OnlySentiment']					93	141
3749	312552	312552:2	I am looking for a Java open source beautifier or reformatter for SQL that I can use to clean up DDL statements that I am generating with URL_http://www.openarchitectureware.org [openArchitectureWare] .	o	['Usability']					204	37
2144	8938752	8938752:42	But as the webapp gets larger, the benefit of having a tested library to handle all the low-level stuff really does win out.	p	['Others']					126	84
3335	13498349	13498349:6	Change your code as: CODESNIPPET_JAVA1 .	o	['Usability']					42	49
4333	309424	309424:41	@ArchimedesTrajano does IOUtils.copy(inputStream, writer, encoding) deal with CR/LF translations better?	p	['Usability']					106	15
226	410890	410890:15	In IntelliJ IDEA you can set _exceptionbreakpoints_.	o	['Community']					54	227
81	2129375	2129375:55	Doesn't it allow you to extract data from it?	n	['Bug']					47	308
711	1109307	1109307:55	These are standard on Linux, are generally available on Unix and can be run on Windows under cygwin, although you may be able to find windows-native apps that can do it as well.	p	['OnlySentiment']		explain suggestion			179	155
3924	6089399	6089399:24	It's async but not highly concurrent.	n	['Usability']					39	32
390	922779	922779:63	Users are going to have no idea whats going on when you hit a breakpoint and spend a few moments grepping through memory.I would try to find the spots in your code that are having problems and expose the current state via JMX and keep detailed audit logs of what is happening.	n	['Documentation']		explain suggestion			278	194
3548	309424	309424:43	Not saying it isn't an issue.	n	['Usability']					31	43
4143	1802915	1802915:28	Maybe, but 1) it's likely to be faster and 2) that's code you don't need to write.	o	['Usability']					84	22
3257	1688099	1688099:60	But that JSON library could still stink for other reasons (never used them personally, but I know we're using them at work).	n	['Usability']					126	52
3336	13498349	13498349:7	Thanks for reply; but it gives error The method toJSONString() is undefined for the type JSONObject at jsonArray.push(jsonObj.	n	['Usability']					130	49
1244	992019	992019:92	It's not an ideal place for neophytes (bouncycastle license won't work for me), but with 83k views to the thread a more polished example is really needed.	n	['Others']					156	119
300	410890	410890:89	Here's how to find the bug, using Eclipse.	o	['Compatibility']					44	209
4051	354837	354837:39	Is this an answer?	n	['Usability']					20	27
2529	7358775	7358775:218	It is no longer maintained and the support for it has been removed from NetBeans.	o	['Others']					85	72
936	326390	326390:84	Check out URL_http://java.sun.com/docs/books/tutorial/essential/io/scanning.html .	p	['OnlySentiment']					84	138
2201	333690	333690:34	The Restlet framework is composed of four main parts.	o	['Others']					55	82
893	326390	326390:41	Possible typo?	n	['OnlySentiment']					16	141
1006	326390	326390:154	In that case you might end up with an incomplete file.	p	['Others']					56	133
508	1728020	1728020:52	If a certain amount of delay (at minimum in the order of a few seconds) is acceptable, polling is less of an abuse of the HTTP protocol.	p	['Documentation']					138	175
284	410890	410890:73	A getter's purpose is to return a property.	o	['Compatibility']					45	213
1212	992019	992019:60	Most providers don't have good support for the PBEwithand algorithms; for example, the SunJCE doesn't provide and PBE for AES.	n	['Others']					128	121
3564	309424	309424:59	Or read all bytes and use new String(bytes, charset)?	o	['Usability']					55	43
3625	309424	309424:120	Luckily we are building and selling our own product so we don't really have the so called deadlines.	p	['Usability']					102	41
3428	267306	267306:32	The number of connections you're talking about tells me you should use java.net.	p	['Usability']					82	47
1660	3451935	3451935:46	If you just want to use something because of the hype, pick anything.	p	['Others']					71	101
371	922779	922779:44	@Shabby - yep - looks like this would work 1.5+, and is a great solution.	o	['Documentation', 'Usability']					75	197
1408	327513	327513:21	I was playing with bitap written in ANSI C and it was pretty fast there is java implementation in URL_http://www.crosswire.org [ URL_http://www.crosswire.org ] .	p	['Others']					163	111
3406	267306	267306:10	Instead of putting each server on different ports, is it possible to use channel selectors on the client side, or is it better to go multi-threaded io on the client side of things and configure the servers differently?	p	['Usability']					220	47
717	1109307	1109307:61	Since the concept of a Windows remote login isn't as well- established as it is under Linux, this may be preferable.	n	['OnlySentiment']					120	154
1015	326390	326390:163	One of best answers here ( URL_http://stackoverflow.com/a/326448/1521167 [ URL_http://stackoverflow.com/a/326448/1521167 ] ): CODESNIPPET_JAVA1 .	n	['Others']		explain suggestion			147	132
1712	3451935	3451935:98	The SQL database you have most experience with.	p	['Others']					49	99
2950	507391	507391:34	JBoss Messaging replaces JBoss MQ.	o	['Security', 'Bug']		explain			36	60
658	1109307	1109307:2	I need a simple application, preferably a cross-platform one, that enables sending of files between two computers.	o	['OnlySentiment']					116	159
488	1728020	1728020:32	Once the server uses the connection to send a message, a new connection needs to be opened up for the next message.	o	['Documentation']					117	179
651	1359689	1359689:56	Timeouts are set like this CODETERM2 the input parameter is in milliseconds .	o	['OnlySentiment']					79	159
2731	26458	26458:167	I have always coded my UIs by hand.	o	['Performance']					37	66
2362	7358775	7358775:51	_Why doesn't java (which is the most widely used programming language in the world) have the same set of GUI components?_ Is it just that java has based their gui components at a much lower level, and it is possible to write all these advanced components that im looking for, but you have to do much if not all of the work yourself?	o	['Others']					334	77
655	1359689	1359689:60	shouldn't it be \r\n instead of \n?	o	['OnlySentiment']					37	159
494	1728020	1728020:38	Right now, I've got real-time measurements updating in my browser, and just one connection (I think).	p	['Documentation']					103	177
4168	1802915	1802915:53	Karl .	o	['Usability']					8	21
1379	1410408	1410408:9	For example, 2 wednesdays from now can't be parsed by any other solution I've found.	n	['Others']					86	113
2325	7358775	7358775:14	) Swing became the framework of choice for building new applications.	p	['Others']		explain suggestion			71	78
2791	2994304	2994304:53	short and to the point.	p	['Performance']					25	64
775	2356137	2356137:13	The same applies on using NIO.	n	['OnlySentiment']					32	149
2407	7358775	7358775:96	If SWT is missing a feature that you need, the framework is somewhat hostile to extending it.	o	['Others']					95	76
2642	26458	26458:78	The most complicated part is using, for example, the layouts (If you can not handle complicated parts), but everything is almost plug & play.	o	['Performance']					143	69
4073	354837	354837:61	] , especially: There are some potentialclassloading issues with CommonsLogging.	o	['Usability']					82	26
858	326390	326390:6	Can anyone explain me in a very simple way what's with the NIO?	o	['OnlySentiment']		clarification			65	142
2130	8938752	8938752:28	Yes, JAX- RS helps with this.	p	['Others']					31	85
4318	309424	309424:26	CODESNIPPET_JAVA1 .	o	['Usability']					21	16
2766	2994304	2994304:28	This is patently false.	n	['Performance']					26	65
127	5059224	5059224:43	XML hasn't changed much.	o	['Bug']					26	273
2644	26458	26458:80	I think that will be good.	o	['Performance']					28	69
2714	26458	26458:150	 Debugger**Debug a Swing GUI application without looking into the source code and control the execution flow in terms of high-level structures.	o	['Performance']					145	67
2945	507391	507391:29	I have done certain research using MOM with Jboss and GlassFish, but one of the most important impact was the permanent storage if you are going to use any.	o	['Portability']					158	60
3000	1229273	1229273:41	It's strictly what you're used to.	p	['Security']					36	59
2787	2994304	2994304:49	Real programmers don't read documentation.	o	['Performance']					44	65
3050	338586	338586:39	Most java json libs do not deal with cyclic deps -- that's more domain of object serialization frameworks.	n	['Security']					108	57
3273	1688099	1688099:76	Then I use GSON upon the generated classes.	p	['Usability']					45	51
2213	333690	333690:46	Note that the example above uses a simplified way to issue calls via the _ClientResource_ class.	o	['Others']					98	82
596	1359689	1359689:1	How to send HTTP request in java?	o	['Legal']					35	164
3005	1229273	1229273:46	I started developing a Seam application on JBoss and after a few months tried to get it working on Glassfish.	n	['Security']					111	59
2776	2994304	2994304:38	For all these negatives, I have edited the question.....	o	['Performance']					58	65
2278	221442	221442:32	You could try URL_https://github.com/harikrishnan83/rapa/wiki/ [Rapa] .	o	['Others']					73	79
1661	3451935	3451935:47	But this question doesn't make any sense.	n	['Others']					43	101
339	922779	922779:12	 This is a hack that will let us limit our risk, even on 1.4.2 JVMs: Command line params: CODESNIPPET_JAVA1 .	o	['Documentation', 'Community']					111	202
2198	333690	333690:31	It doesn't really get into any code (it's a 50,000-foot flyover) but I think it'll give you just what you need at this stage.	p	['Others']		clarification			127	82
1870	5828625	5828625:31	There is nothing wrong with swing.	p	['Others']					36	93
