	thread	tid	sent	ManualLabel	codes	stakeholder	signal	intent	action	LEN	LEN.1
1024	326390	326390:172	Perhaps there is a more suitable java.io.File method (something like getLength()?	n	['Others']					83	131
3706	309424	309424:201	I thing that we both agree that this method isn't thread-safe in many ways.	n	['Usability']					77	39
1978	6457003	6457003:8	Such as hard drive, flash-card, smart-card, eToken, iKey, etc.?	o	['Others']					65	90
1109	49226	49226:17	There are other options like URL_http://en.wikipedia.org/wiki/Twofish [Twofish] , URL_http://en.wikipedia.org/wiki/Blowfish_(cipher) [Blowfish] etc also.	p	['Others']					155	126
2506	7358775	7358775:195	Miglayout reminds of the days where table tags in html were the standard for laying out elements on a page ;) Thanks for your contribution.	o	['Others']					141	73
829	2356137	2356137:67	Avoid accessing the underlying operating system.	n	['OnlySentiment']		suggestion			50	144
269	410890	410890:58	If all accessors must be dumb I see little value over public fields.	n	['Compatibility', 'Usability']		clarification			70	217
1463	4991084	4991084:55	But then a new project came along, with more complex security requirements.	o	['Others']					77	108
2347	7358775	7358775:36	promising to be the facto standard in developing rich desktop or web applications.	o	['Others']					84	78
2886	483379	483379:63	The latest version includes URL_https://visualvm.dev.java.net/ [VisualVM] for profiling.	o	['Performance']					90	62
1858	5828625	5828625:19	Dean isn't the first one here to confuse those two.	o	['Others']					53	93
719	1109307	1109307:63	Can you install FTP servers on (one of) your machines ?	o	['OnlySentiment']					57	154
683	1109307	1109307:27	Unfortunately I'm not a networking expert, so I can't really provide more info.	n	['OnlySentiment']					81	157
2063	2476239	2476239:16	It has the foundation blocks for IRIS Matching SYstem.It has the following features:* Basic QT UI - Needs qt-make and qt-sdk on top of gc++ and make to build* Iris Detection from Image file.	o	['Others']					192	87
1194	992019	992019:42	@Nick: Read PKCS 	o	['Others']					19	121
1816	9887454	9887454:8	1) What error?	o	['Others']					16	95
3974	12094564	12094564:1	Log4j 2.0 and SLF4J and the never ending future of java logging frameworks.	o	['Usability']					77	30
610	1359689	1359689:15	I know I'm late to the party here...but I'm currently frustrated with the Java APIs lack of examples.	n	['Legal']					103	163
1670	3451935	3451935:56	Next releases will support clustering and partitioning Apache 2 license: free for any use Much more .	p	['Others']					103	101
3865	660609	660609:11	You can use that to create your own parser.	o	['Usability']					45	34
3192	338586	338586:181	A nice new library for Java is URL_http://code.google.com/p/serotonin-json/ [Serotonin-JSON] .	p	['Usability']		suggestion			96	54
1844	5828625	5828625:5	Although Oracle has much reduced the work on Swing (apparently, seen from an outsider), the new Swing JavaFX (I don't like this way to call it actually because it has almost no commonalities with Swing) is, from my point of view, not ready yet for primetime.	o	['Others']					262	94
2891	4097567	4097567:3	I would like to use Hibernate 3.5.1-FINAL which supports JPA 2.0.	o	['Performance']					67	62
4058	354837	354837:46	The problems started when Sun actually added java.util.logging to Java 1.4.	n	['Usability']					77	27
3091	338586	338586:80	The main reason I mention it is that the author, Tatu Saloranta, has done some really great stuff (including URL_http://woodstox.codehaus.org/ [Woodstox] , the StAX implementation that I use).	p	['Security']					194	56
2788	2994304	2994304:50	There is a lot of tuning in Swing that cannot be attributed to Moores law.	o	['Performance']					76	65
1583	268129	268129:65	This enables you to access spring beans from EJBs.	o	['Others']					52	104
2423	7358775	7358775:112	As of today, there are a lot of themes around.	o	['Others']					48	75
296	410890	410890:85	Anywhere in your code that a null value can be returned, consider introducing a check for a null return value.	o	['Compatibility']					112	211
1669	3451935	3451935:55	About 50.000 insert/sec on common HW Small: less than 1Mb for all Support for SQL with extension for links, graphs and objects Native support for Security Run as embedded or in client/server configuration.	p	['Others']					207	101
1302	992019	992019:150	This involves creating your own URL_http://java.sun.com/javase/6/docs/api/java/security/Provider.html [CODETERM2] subclass and using it with URL_http://java.sun.com/javase/6/docs/a pi/javax/crypto/Cipher.html#getInstance%28java.lang.String,%20java.security.Pr ovider%29 [CODETERM3] .	o	['Others']					285	116
2289	221442	221442:43	Manually handling serialization in Java is a waste of time when you have so many options like JAXB and Jackson.	n	['Others']	User-author	example app			113	79
1511	628416	628416:38	It's old but should help with the JAAS basics.	p	['Others']		alternative choices			48	107
3163	338586	338586:152	I've been meaning to try URL_http://flexjson.sourceforge.net/ [Flexjson] .	o	['Usability']		support suggestion			76	54
3143	338586	338586:132	That's from their site: CODESNIPPET_JAVA1 .	o	['Usability']					45	55
2637	26458	26458:73	Like most code generation tools, it might get you started, but eventually you will have to maintain the generated code yourself.	o	['Performance', 'Usability']					130	69
1172	992019	992019:20	@Nippysaurus: Any luck?	n	['Others']					25	123
2281	221442	221442:35	A good alternative to RestSharp in the .NET world.	p	['Others']					52	79
2287	221442	221442:41	It doesn't take long to code, and is quite efficient, in my opinion.	p	['Others']					70	79
1775	5802639	5802639:26	I can imagine... :) Thank you very much!.	p	['Others']					43	97
3313	9503477	9503477:26	I would advise against Spring MVC for REST because it is not JAX-RS compliant.	n	['Usability']					80	50
1126	49226	49226:34	You can find that link also from URL_http://www.schneier.com /blowfish-download.html [Bruce-Schneier's-website] (the creator of both algorithms).	o	['Others']					147	125
3828	5620985	5620985:44	SQL99 is a generic implementation that will should work with any database.	p	['Usability']					76	35
2396	7358775	7358775:85	Why should some person that may have a grudge or having a bad day be able to remove content valuable to a community?	n	['Others']					118	76
1249	992019	992019:97	Or maybe a link to a more developed example?	n	['Others']					46	119
2293	221442	221442:47	Back then I had a desire for control of the deserialisation, but nowadays I would use Jackson and decently annotated model classes.	o	['Others']					133	79
316	410890	410890:105	Can you please clarify what null checks you would use in this case before the changed getters of someObject?	o	['Compatibility']					110	207
1589	268129	268129:71	We have also tried the JNDI route, which ends with the need for stubs for all shared interfaces.	o	['Others']					98	104
1935	408820	408820:61	2.	n	['Others']					4	91
299	410890	410890:88	If the result of a computation or database lookup is null, when I expected something different then IllegalStateException is a valid choice.	p	['Compatibility']					142	210
1413	4991084	4991084:5	Sure, they have done things to reduce complexity, like creating custom XML namespaces to reduce the quantity of XML configuration, but for me, these don't address _my_ personal fundamental issue with Spring Security: its names and concepts are often confusing in general to me.	n	['Others']					279	111
3527	309424	309424:22	@Hello71: It is ok in Java, since the instanceof operator is spelled differently.	o	['Usability']		suggestion			83	44
1765	5802639	5802639:16	For most NoSQL engines you'll probably want an id there, too, just for efficiency's sake.	o	['Others']					91	97
1287	992019	992019:135	 Example usage CODESNIPPET_JAVA1 .	o	['Others']					36	117
406	395401	395401:1	Printing Java collections nicely (toString doesn't return pretty output).	n	['Documentation']					75	189
4181	3581741	3581741:9	I really don't know if it helps anything at all but I'll be damned if I don't try.	n	['Usability']					84	21
2475	7358775	7358775:164	Fixed.	o	['Others']					8	74
2973	1229273	1229273:14	JBoss is more much popular, there are a lot of administrators, developers, who know it,so it is easier to find someone, who can develop on JBoss, there are also moreresources in the net.	p	['Security', 'Usability']					188	59
182	35785	35785:32	Now, I can see that URL_http://xstream.codehaus.org/ [XStream] might be very useful as it's nonintrusive and has really simple api.	p	['Community']					133	245
2683	26458	26458:119	I personally will suggest _Netbeans Swing Builder_, yet if you want total control and to gain depth understanding of the Swing framework, I have noticed doing it free hand is the ultimate choice.	o	['Performance']					197	68
670	1109307	1109307:14	 Bar** The CODETERM1 in Swing is easy enough to use.	p	['OnlySentiment']		suggestion			54	158
1091	1522143	1522143:48	I had been working 5-6 years to get one running.	n	['Others']					50	127
3894	660609	660609:40	I can recommend a few Java implementation of Lex/Yacc ( URL_http://byaccj.sourceforge.net/ [BYACC/J] , URL_http://www2.cs.tum.edu/projects/cup/ [Java-Cup] ) that you can use an existing SQL grammar with.	p	['Usability']					205	33
430	395401	395401:25	CODESNIPPET_JAVA2 .	o	['Documentation']					21	187
4174	3581741	3581741:2	I know we can use the CODETERM1 method in Java get an individual character in a string by specifying its position.	o	['Usability']					116	21
2317	7358775	7358775:6	This is a very loosely defined set of questions, but i still think its valuable for anyone thinking of creating rich gui applications.	n	['Others']					136	78
3823	5620985	5620985:39	Development recently moved from code.google.com to github.	o	['Usability']					60	35
2744	2994304	2994304:6	Related: URL_http://stackoverflow.com/questions/2377467/if-swing-has-more - features-to-design-a-form-then-what-is-the-use-of-awt-in-java.	o	['Performance']					140	66
1578	268129	268129:60	I have used this approach to access shared Spring beans from a webapp.	o	['Others']					72	104
1282	992019	992019:130	The salt is used to prevent dictionary attacks against the key in the event your encrypted data is compromised.	o	['Others']					113	117
1343	5571519	5571519:10	Stanford NLP for example uses Conditional Random Field (CRF).	o	['Others']					63	114
4229	2971315	2971315:43	If you by chance do end up with an instance of CODETERM21 that you didn't create and can't control the constructor that is called, there is a way to avoid the degenerate re-allocate and copy behavior.	p	['Usability']					202	21
3775	312552	312552:28	Perhaps URL_http://jsqlparser.sourceforge.net/ [jsqlparser] will work for you.	p	['Usability']					80	37
2133	8938752	8938752:31	(Not that I'd claim it's perfect some surprising things are still very awkward but it definitely makes things a lot easier.	p	['Others']		unhappy with suggestions			125	85
2357	7358775	7358775:46	Which one of these frameworks should be recognized as deprecated and which should be recognized as the frameworks of the distant future?	o	['Others']					138	77
2654	26458	26458:90	I had more luck with which is also based on Eclipse, simply adding a few plugins to it as many other commercial products do.	o	['Performance']					126	69
960	326390	326390:108	@BryanLarson: Either's fine.	o	['Others']					30	136
3012	338586	338586:1	A better Java JSON library?	p	['Security']					29	58
521	5415111	5415111:7	Not to mention the jars are up to 700KB.	n	['Documentation']		explain			42	173
276	410890	410890:65	Why don't fields play nicely with reflection?	n	['Compatibility']					49	216
1081	1522143	1522143:38	URL_http://www.jasypt.org [ URL_http://www.jasypt.org ] is also a good option.	o	['Others']					80	128
3629	309424	309424:124	At the same time, there is a real cost to using libraries (as the dependency proliferation in many apache java libraries shows).	o	['Usability']					130	41
1630	3451935	3451935:16	I am currently considering URL_http://code.google.com/p/redis/ [redis] + URL_http://code.google.com/p/jredis/ [jredis] One of my main motivations for this project is also to look into the programming model and ways of usage of NoSql DBs.	o	['Others']					239	102
1262	992019	992019:110	@ArchimedesTrajano Not with the Java Cryptography Architecture.	p	['Others']					65	118
3875	660609	660609:21	We're up to ANTLR 4 now.	o	['Usability']					26	33
2687	26458	26458:123	Also it does not need to lock down partsof code that you cant edit, you may edit code by hand, and VE is stillable to work with your changes.	o	['Performance']					143	68
578	5415111	5415111:64	Like I said, it's by no means a comprehensive benchmark.	n	['Legal', 'Others']					58	166
3223	1688099	1688099:26	I use it in an android app.	o	['Usability']					29	53
2555	7358775	7358775:244	Here's the link to browse the code: URL_http://swingobj.svn.sourceforge.net/viewvc/swingobj/ [ URL_http://swingobj.svn.sourceforge.net/viewvc/swingobj/ ] The showcase should show you how to do a simple logon actually.. Let me know if you have any questions on it I could help.	p	['Others']					278	71
2271	221442	221442:25	You can use the standard Java SE APIs: CODESNIPPET_JAVA1 .	o	['Others']					60	80
927	326390	326390:75	Also note you can read anything that is Readable , like Files, InputStreams, channels...I sometimes use this code to read from the display window of eclipse, when I'm not sure if I'm reading one file or another...yes, classpath confuses me.	p	['OnlySentiment']					242	138
4187	2971315	2971315:1	String, StringBuffer, and StringBuilder.	o	['Usability']					42	21
4063	354837	354837:51	This was probably the worst Sun idea ever... and it ultimately led to the wrong assumption that a good Java citizen should use jul.	o	['Usability']					135	26
1377	1410408	1410408:7	URL_http://natty.joestelmach.com/ [Natty] is a really good replacement for JChronic.	p	['Others']					86	113
792	2356137	2356137:30	The byte length depends on the character encoding used.	o	['OnlySentiment']					57	147
2158	8938752	8938752:56	If the framework is easy enough to adopt then you should be able to go from vanilla to the framework with more ease than from another framework, when the need arises.	o	['Others']					168	84
2908	4097567	4097567:20	 Option 2 Disable CODETERM3 (your second jboss-web.xml), bundle your Hibernate JARs into your app and override the hibernate-validator JARs CODETERM4 	o	['Portability']					152	61
3499	3409608	3409608:49	It takes TCP a little whiel to find the optimal window size, so if you use parallel connections, this process goes 3x faster!.	o	['Usability']					128	45
968	326390	326390:116	It;s a shame this answer doesn't have more votes.	o	['Others']					51	135
15	15936368	15936368:18	maybe i'm wrong, but i think marshall/unmarshall pursuit a different goal, what you are trying to do is conceptually incorrect.	n	['Bug', 'Usability']		explain			129	481
707	1109307	1109307:51	Thanks that's what I was looking for.	p	['OnlySentiment']		suggestion			39	155
588	5415111	5415111:74	You could use URL_http://www.jboss.org/netty [Netty] or URL_http://mina.apache.org/ [Apache-Mina] albeit they are very low level and I'm not sure you will end up with less verbose code.	o	['Legal']					187	165
4347	309424	309424:55	Haha - of course it does!	o	['Usability']					27	14
4376	309424	309424:84	In the situation where you want to take something that you know is encoded in the default encoding for the platform, then the default version is correct.	o	[u'Community']					155	12
2923	507391	507391:7	I'd love to hear about this as well.	n	['Portability']					38	61
3577	309424	309424:72	No it isn't.	o	['Usability']					14	42
354	922779	922779:27	Now, when you start up your JVM everything is the same except that a background poller thread is started.	o	['Documentation', 'Usability']					107	199
575	5415111	5415111:61	Here is the benchmark and some results that we use internally: URL_http://wiki.apache.org/HttpComponents/HttpClient3vsHttpClient4vsHttpCore .	o	['Documentation']					143	167
2855	483379	483379:32	Run with the JVM arg -XX:-HeapDumpOnOutOfMemoryError.	o	['Performance']					55	63
672	1109307	1109307:16	To get a progress bar to show up on a form only involves dropping it onto a CODETERM2 and perhaps setting CODETERM3 so hat it shows that your program is working.	o	['OnlySentiment']					163	157
3517	309424	309424:12	It's not that difficult, just annoying.	n	['Usability']	user	experience		used and loved provided solution	41	44
2757	2994304	2994304:19	Sun puts much more energy into making Swing robust.	p	['Performance']		suggestion			53	65
3080	338586	338586:69	Gson fully populates all low level values by calling all set methods for all data found in the JSON.	o	['Security']					102	56
1074	1522143	1522143:31	When we tried to do something that was compatible with openssl, only bouncycastle worked.	n	['Others']					91	128
4110	354837	354837:98	One already exists - take a look at slf4j.	o	['Usability']					44	25
479	1728020	1728020:23	Server sends messages up there - right?	o	['Documentation']		explain suggestion			41	179
3375	5536458	5536458:28	A library which helps for basic file manipulation is URL_http://commons.apache.org/io/ [Apache-Commons-IO] .	p	['Usability']					110	48
577	5415111	5415111:63	Of course.	p	['Legal', 'Others']					12	167
2210	333690	333690:43	Restlet provides several implementations of client connectors based on existing open-source projects.	o	['Others']					103	82
3042	338586	338586:31	Gson considers both of these as very important design goals.	o	['Security']					62	57
2081	4706995	4706995:13	If you use Tapestry, you might look at URL_http://tynamo.org/tapestry- security+guide [ URL_http://tynamo.org/tapestry-security+guide ] It makes it very easy to get Shiro up and running in a Tapestry application and gives you some easy to use tags to use in your templates.	p	['Others']					275	87
1708	3451935	3451935:94	several independent not normalized tables).	o	['Others']					45	99
3247	1688099	1688099:50	Here are more good choices: URL_http://wiki.fasterxml.com/JacksonHome [Jackson] -- powerful data binding (JSON to/from POJOs), streaming (ultra fast), tree model (convenient for untyped access) URL_http://flexjson.sourceforge.net/ [Flex-JSON] -- highly configurable serialization EDIT (Aug/2013): One more to consider: URL_http://code.google.com/p/genson/ [Genson] -- functionality similar to Jackson, aimed to be easier to configure by developer .	p	['Usability']					450	52
1925	408820	408820:51	:).	p	['Others']					5	91
1553	268129	268129:35	You also use local references and calling semantic to talk to the EJBs since they're in the same server.	o	['Others']					106	105
975	326390	326390:123	Java attempts to be extremely general and flexible in all it does.	n	['Others']					68	135
820	2356137	2356137:58	Perhaps the OS or hardware cache will alleviate that via prefetching.	o	['OnlySentiment']					71	145
2054	2476239	2476239:7	: URL_http://mac.softpedia.com/get/Math-Scientific/JIRRM.shtml [ URL_http://mac.softpedia.com/get/Math-Scientific/JIRRM.shtml ] (Java based) URL_http://projectiris.co.uk/ [ URL_http://projectiris.co.uk/ ] (QT based -but there are more QT <-> Java bridges) but personally I haven't used in production (just for testing) these 2 libraries since the documentation is not very good/detailed, and since this kind of problem is quite cutting edge so the documentation and an explanation paper is much more important than any source code.	p	['Others']					535	88
2257	221442	221442:11	 <strike>** URL_https://github.com/sonatype/async-http-client [Async-http-client] by Sonatype</strike>.	o	['Others']					105	80
4202	2971315	2971315:16	+1, concise answer.	p	['Usability']		suggestion			21	21
1885	408820	408820:11	A full answer to your question would try to explore all of those.	o	['Others']					67	92
4510	309424	309424:218	:EOF .	o	[u'Usability']					8	4
4447	309424	309424:155	Crashed in Android with OutOfMemory error on the .write line, every time, for short strings.	n	[u'Others']					96	6
458	1728020	1728020:2	We want to push data from a server to clients but can only use HTTP (port 80).	o	['Documentation']					80	183
3396	5536458	5536458:49	so I have implemented my own ORM file to objects and vise versa.	o	['Usability']					66	48
1725	3232842	3232842:3	It's simple to use and is concise.	p	['Others']					36	99
1617	3451935	3451935:3	The application does a lot of reads and very few writes.	o	['Others']					58	103
4413	309424	309424:121	Unfortunately we are building a product that is available on many JVMs, databases and app servers on many operation systems so we have to think for the users using poor machines... And a string operation optimizing can improve the perf by 30~40%.	n	[u'Others']					248	8
736	3775694	3775694:16	So a folder has to be empty or deleting it will fail.	o	['OnlySentiment']					55	153
3911	6089399	6089399:11	Having said that, I have seen Log4j 1.2 deadlock under high load conditions.	n	['Usability']					78	32
660	1109307	1109307:4	What applications could I use or how could I write one?	o	['OnlySentiment']					57	158
325	410890	410890:114	If you are in control of the method that returns null you could also consider the Null Object pattern if null is a valid value to return.	o	['Compatibility']					139	205
3655	309424	309424:150	@plasma147 Instead of downvoting, consider editing the example (I just submitted that, adding Closeables.closeQuietly(stream);).	o	['Usability']					130	40
512	1728020	1728020:56	The longer the delay is the less connections you have to open.	o	['Documentation']					64	174
2098	7873197	7873197:5	I am using Apache CXF for developing restful web service.	o	['Others']					59	86
3627	309424	309424:122	And a fix: In our product, I even replaced should be 'we even replaced'.	o	['Usability']					74	41
4301	309424	309424:9	In this case, I was away from my utility code and couldn't remember exactly how to do it.	o	['Usability']					91	17
1792	5304919	5304919:3	Alternatively, what is a good abstraction layer/solution (free of charge) that abstracts between multiple database implementations including google app engine and my application for db access.	o	['Others']					194	96
1246	992019	992019:94	@wufoo The problem with a more developed example is that doing things the right way would require some encoded structures for transmitting the message and IV, and the PBE parameters.	n	['Others']					186	119
1638	3451935	3451935:24	Use what you think will be fun.	o	['Others']					33	102
387	922779	922779:60	We're actually using a lightweight production profiler (Wily), but it isn't very good at capturing state information, and can only perform well when limited to coarse-grained traces.	o	['Documentation']					184	194
3815	5620985	5620985:31	I went through the javadocs and the code but couldn't find anything.	o	['Usability']					70	36
185	35785	35785:35	@Barak Schiller Thanks for posting link to XStream!	p	['Community']					53	245
1438	4991084	4991084:30	I've read all this before start using shiro.	o	['Others']					46	110
3998	12094564	12094564:25	(I should probably ask this as a separate Q.	o	['Usability']					46	29
2075	4706995	4706995:7	Any help, advise and pointers much appreciated.	o	['Others']					49	87
1490	628416	628416:17	Just focus on using Acegi or plain old Java EE security which solves a lot of common web application security problems.	o	['Others']					121	107
3817	5620985	5620985:33	Querydsl and jOOQ seem to be the most popular and mature choices however there's one thing to be aware of: Both rely on the concept of code generation, where meta classes are generated for database tables and fields.	n	['Usability']					218	35
547	5415111	5415111:33	HTTP is complex, but Apache's HttpComponents library ridiculously over- engineered and contains a lot of complexity not essential to protocol operation.	o	['Documentation']					154	170
4406	309424	309424:114	Sometimes speed is of the utmost importance and is a hard requirement.	o	[u'Others']					72	9
3137	338586	338586:126	FWIW, almost all Java JSON libraries support this conversion mode, including GSON, Jackson and Genson.	p	['Usability']					104	55
1882	408820	408820:8	It uses AWT to create an operating system window and then paints pictures of buttons, labels, text, checkboxes, etc., into that window and responds to all of your mouse-clicks, key entries, etc., deciding for itself what to do instead of letting the operating system handle it.	o	['Others']					279	92
633	1359689	1359689:38	FWIW, our code started with java.net.HttpURLConnection, but when we had to add SSL and work around some of the weird use cases in our screwy internal networks, it became a real headache.	o	['OnlySentiment']					188	161
3056	338586	338586:45	Gson is great, and has high quality documentation too.	p	['Security']					56	57
209	12399462	12399462:17	You can create your own: CODESNIPPET_JAVA1 .	o	['Community']					46	233
451	3125927	3125927:3	Apache HTTP Component (HttpClient 4.0), URL_http://hc.apache.org/httpcomponents-client-4.0.1/index.html [ URL_http://hc.apache.org/httpcomponents-client-4.0.1/index.html ] Normally, I would just use HttpURLConnection but its cookie handling is too weak to simulate browser behavior.	p	['Documentation']					284	184
1793	5304919	5304919:4	I'd like to develop an app for GAE but later deploy it on my own server, but I do not want to have to rewrite the db code.	o	['Others']					124	96
3232	1688099	1688099:35	@BalusC : Actually I need to convert mysql data to json (xml) and vice-versa.	o	['Usability']					79	52
4440	309424	309424:148	new InputStreamReader(stream, UTF-8).	n	[u'Others']					41	6
1696	3451935	3451935:82	It's just creating your column families that's a schlep.	p	['Others']					58	100
