	thread	tid	sent	ManualLabel	codes	stakeholder	signal	intent	action	LEN	LEN.1
1862	5828625	5828625:23	[1] It was originally expected that this implementation would be the means for integrating JSR 296 into the upcoming Java SE 7 (Dolphin) version of the Java programming language, and the project was scheduled to be included in milestone 5 of the JDK7 development.	o	['Others']					265	93
922	326390	326390:70	or CODESNIPPET_JAVA2 .	o	['OnlySentiment']					24	139
1791	5304919	5304919:2	What other nosql databases are compatible (more or less) with the Google Appe Engine datastore.	o	['Others']					99	96
174	35785	35785:24	It creates Java objects for the schema and creates easy to use parse methods.	p	['Bug']					79	249
2515	7358775	7358775:204	The learning curve is a bit steep for the NetBeans platform (although I guess that's true for Eclipse as well) but there are some good books around which I would highly recommend.	o	['Others']					181	73
1949	408820	408820:75	Swing occupies less memory space2 .	p	['Others']					37	91
1278	992019	992019:126	The code is distributed as part of the core module but has no dependencies on any other Spring Security (or Spring) code.	p	['Others']					123	117
3937	462566	462566:13	(I thought I would use log4j directly, but that was before I learned a little bit more about logging and a lot of respectable libraries seem to choose the path of a bridge/facade for their logging needs.	o	['Usability']					205	31
2818	2994304	2994304:80	For desktop programs, yes, Swing is heavily in use.	n	['Performance']					53	64
1585	268129	268129:67	We're still not quite there, but we have tried a few things now and see things more clearly.	p	['Others']	User-asker	worst of the pack			94	104
981	326390	326390:129	Your best bet is probably the 2nd one, as it has the least dependencies.	n	['Others']					74	135
258	410890	410890:47	You could even put the unexpected state your getter found in the exception message.	o	['Compatibility', 'Usability']					85	219
2139	8938752	8938752:37	OK, these benefits might not seem so much when you're only dealing with simple webapps.	n	['Others']					89	84
3404	267306	267306:8	 Each remote server will have up to 8 connections, all from the same client (to control all the hardware, and separate TX/RX sockets).	o	['Usability']					136	47
4467	309424	309424:175	Changed to use StringBuilder.	n	[u'Performance']					31	5
1543	268129	268129:25	Are the web applications deployed on the same server?	o	['Others']					55	105
2996	1229273	1229273:37	(2) JBoss is also modular, you pick which modules you want.	o	['Security']					61	59
3173	338586	338586:162	works I was looking for a very simple way to do Php json encode in (server) and Java json decode (client), all seems too much to do only to achieve this.	p	['Usability']					155	54
3812	5620985	5620985:28	You can't get one without another.	o	['Usability']					36	36
2100	7873197	7873197:7	I'd recommend using CODETERM1 CODESNIPPET_JAVA1 .	p	['Others']					51	86
152	35785	35785:2	Is there a (preferably free) Java analogue of .NET's XML serialization?	o	['Bug']					73	260
1711	3451935	3451935:97	If I were in your shoes, I'd go with this option just because I know that it would show great performance, there are mature tools for working with MySql, many people have experience with it and at any time you can easily use all its relational potential if you eventually decide to go back to RDBMS solutions.	o	['Others']					311	99
297	410890	410890:86	CODESNIPPET_JAVA1 .	o	['Compatibility']					21	210
2841	483379	483379:18	The array is owned by a org.jboss.axis.message.SAX2EventRecorder which is in turn held by these guys: org.jboss.axis.message.SOAPEnvelopeAxisImpl@0x19c31fd8 (141 bytes) : field recorderorg.jboss.axis.message.RPCParamElementImpl@0x19c32260 (123 bytes) : field recorderorg.jboss.axis.message.SOAPBodyAxisImpl@0x19c32160 (121 bytes) : field recorderorg.jboss.axis.message.RPCElement@0x19c321e0 (124 bytes) : field recorderorg.jboss.axis.encoding.DeserializationContextImpl@0x19c332f0 (67 bytes) : field recorderorg.jboss.axis.message.SAX2EventRecorder$objArrayVector@0x19c33398 (24 bytes) : field this$0 The data structures of our own app are quete bloated, but not to this degree.	o	['Performance']					680	63
2292	221442	221442:46	I agree too, and I wrote the original comment.	p	['Others']					48	79
2695	26458	26458:131	Desktop applications usually have to be obfuscated.	o	['Performance']					53	68
1436	4991084	4991084:28	Shiro works great in Spring environments, so I would say choose based on which of the two you enjoy more and makes the most sense to you.	p	['Others']					139	110
2761	2994304	2994304:23	Since Swing components handle their own painting (rather than using native API's like DirectX on Windows) you may run into graphical glitches.	p	['Performance']					144	65
2290	221442	221442:44	Even loading the whole document and using XPath is marginally slower than SAX and nothing compared to getting the XML (network speed).	n	['Others']					136	79
1494	628416	628416:21	javax.security is imho overcomplicated API.	n	['Others']					45	107
1780	5802639	5802639:31	In the graph you could model your nodes being Concepts (URIs) and the type of relationship representing what you want to represent with that Concept.	o	['Others']					151	97
3840	5620985	5620985:56	I use it to generate custom source code from DDL.	p	['Usability']					51	35
4283	2971315	2971315:97	Also, CODETERM1 is thread-safe, which CODETERM2 is not.	o	['Usability']					57	18
3188	338586	338586:177	After exploring and actually using most of the major libraries listed here, I ended up writing a simplified API that is much easier to use and more fun to work with: URL_http://sharegov.blogspot.com/2011/06/json-library.html [ URL_http://sharegov.blogspot.com/2011/06/json-library.html ] .	p	['Usability']					291	54
132	5059224	5059224:48	The W3C Document hierarchy is verbose and hard to use, so both DOM4J and JDOM try to make it easier.	n	['Bug']		clarification			102	270
1736	3232842	3232842:14	Your first criteria might be a little bit subjective.	o	['Others']					55	98
3180	338586	338586:169	My biggest complaint with the offerings out there is the size of them - we target a download-constrained applet market.	o	['Usability']					121	54
2170	333690	333690:3	Why can't people write decent tutorials anymore!	n	['Others']					50	83
3053	338586	338586:42	Design protocol meaning... ?	o	['Security']					30	57
1632	3451935	3451935:18	Since simple flat files require no setup and don't use SQL, what are you asking?	o	['Others']					82	102
1019	326390	326390:167	You could try: CODESNIPPET_JAVA1 .	p	['Others']					36	131
3114	338586	338586:103	JSON does not have a Date type (just strings, numbers, booleans), and each lib therefore has to define its own convention.	n	['Usability', 'Others']					124	56
115	5059224	5059224:31	Well it depends - not all APIs have the same capabilities as you see, but if you have control over the classes you use to map the XML document JAXB is my personal favorite, really elegant and simple solution (though I haven't used it for really large documents, it could get a bit complex).	p	['Bug']					292	279
4192	2971315	2971315:6	CODETERM8 is more efficient than CODETERM9 .	p	['Usability']					46	21
2674	26458	26458:110	I have tried several other solutions, and this is the one I am sticking with.	o	['Performance']					79	68
1716	3451935	3451935:102	Lotus Notes Domino would meet all of your requirements.	n	['Others']					57	99
549	5415111	5415111:35	@Alex B: HttpComponents are being used in all sorts of different applications randing from simple URL fetchers to complex transports and web crawlers with different, often conflicting requirements.	p	['Documentation']					199	169
916	326390	326390:64	I don't find that method in the URL you provide.	n	['OnlySentiment']					50	139
716	1109307	1109307:60	Rsync can also publish resources that it will handle directory.	o	['OnlySentiment']					65	154
3388	5536458	5536458:41	If you want the file read by 3rd party as well, how about using some popular existing exchange format such as CSV or XML?	o	['Usability']					123	48
3700	309424	309424:195	CODESNIPPET_JAVA1 .	o	['Usability']					21	39
1291	992019	992019:139	For others: this isn't a very secure method.	o	['Others']					46	117
3106	338586	338586:95	Just curious - why the downvote?	o	['Usability', 'Community']					34	56
4090	354837	354837:78	Generally I would default to using Log4J.	o	['Usability']					43	25
3190	338586	338586:179	It is easy to use in any project, it is just not placed on the web as a separate project (afaik), however it is in a separate package org.codeviation here: URL_http://hg.netbeans.org/main/file/9609b899e64d/kenai/src/org/codeviation [ URL_http://hg.netbeans.org/main/file/9609b899e64d/kenai/src/org/codeviation ] .	p	['Usability']					317	54
740	3775694	3775694:20	to this CODESNIPPET_JAVA2 .	o	['OnlySentiment']					29	152
4299	309424	309424:7	You are right.	o	['Usability']					16	17
307	410890	410890:96	Etc.	o	['Compatibility']					6	208
3520	309424	309424:15	Same with BufferedReader's readLine().	p	['Usability']					40	44
938	326390	326390:86	I make that mistake all the time.	n	['OnlySentiment']					35	138
3329	9503477	9503477:42	You can try URL_http://openjpa.apache.org/jest.html [JEST] , it works over URL_http://openjpa.apache.org/ [OpenJPA] .	o	['Usability']					119	50
1026	326390	326390:174	Given the doco for read(byte[]) this is very risky code.	o	['Others']					58	131
90	5059224	5059224:6	After the @Voo's answer let me ask another one - Should I use java's in built classes or any third library like dom4j.. What are the advantages?	o	['Bug']		alternative choices			146	300
519	5415111	5415111:5	Which, just... no.	n	['Documentation']					20	173
3129	338586	338586:118	and mixins allow great flexibility!.	o	['Usability']					38	55
1480	628416	628416:7	Great pithy title for a legitimate documentation failure.	n	['Others']					59	108
253	410890	410890:42	The answer depends on how you view (the contract of) your getters.	o	['Compatibility', 'Portability']					68	220
2810	2994304	2994304:72	Yes, it's still in use.	p	['Performance']					25	64
3666	309424	309424:161	Implementing the new String(...) with encoding is the responsibility of the on that uses the API!.	o	['Usability']		support suggestion			100	40
3626	309424	309424:121	Unfortunately we are building a product that is available on many JVMs, databases and app servers on many operation systems so we have to think for the users using poor machines... And a string operation optimizing can improve the perf by 30~40%.	n	['Usability']					248	41
2665	26458	26458:101	Lastly, changes to the UI won't generate unnecessary noise in the version control system.	o	['Performance']					91	69
3744	7250741	7250741:12	Extracting the database structure through the JDBC metadata programmatically might look straightforward, but from experience I can say that there's a fair bit of difference between JDBC drivers/database platforms.	n	['Usability']					215	38
1960	408820	408820:86	 awt is not mvc based.	o	['Others']					24	91
219	410890	410890:8	 conclusion on the answers:** Some answers told me that I should not chain getters one after another, some answers showed my how to debug my code if I disobayed that advice.	o	['Community']					175	229
3559	309424	309424:54	Best not to leave this kind of thing to chance :).	o	['Usability']					52	43
3340	13498349	13498349:11	why you are converting jsonarray to JSONObject?	o	['Usability']					49	49
3695	309424	309424:190	If you were feeling adventurous, you could mix Scala and Java and end up with this: CODESNIPPET_JAVA1 .	p	['Usability']					105	39
2055	2476239	2476239:8	If none of the above approaches work for you, I would suggest to use a MATLAB based iris recognition examples (because there are many MATLAB based implementations, papers, theses) and than convert them to Java or use the directly from Java (since MATLAB has support for this).	p	['Others']					278	88
4247	2971315	2971315:61	If the article you have posted is better doesn't mean that my article is wrong.	n	['Usability']					81	20
4285	2971315	2971315:99	Note that if you are using Java 5 or newer, you should use CODETERM1 instead of CODETERM2 .	o	['Usability']					93	18
1924	408820	408820:50	Samiksha, make that another question instead of trying to have a discussion thread in these comments.	o	['Others']					103	91
2490	7358775	7358775:179	Of course you can integrate your custom controls as well, but that takes some extra effort.	o	['Others']					93	73
3215	1688099	1688099:18	 See also: URL_http://json.org/ [Json.org] - Introduction to JSON URL_https://sites.google.com/site/gson/gson-user-guide [Gson-User-Guide] - Introduction to Gson .	o	['Usability']					165	53
1240	992019	992019:88	@wufoo By the way, Doug's code has a number of security flaws.	n	['Others']					64	119
3169	338586	338586:158	Hi, based on ur experience, is the GSON support JDK1.4 by any chance?	o	['Usability']					71	54
3493	3409608	3409608:43	If portability isn't important to you, though, it may be possible to roll your own wrapper with JNI.	n	['Usability']		suggestion			102	45
530	5415111	5415111:16	Hey, I don't mean to disparage anyone's work here, but I've been making a good-faith effort to use HttpComponents since 4.0 came out and it's just not working for me.	n	['Documentation']					168	171
1875	408820	408820:1	What is the difference between swing and awt?	o	['Others']					47	93
1411	4991084	4991084:3	I am looking for lists of pros and cons between these two frameworks.	o	['Others']					71	111
4331	309424	309424:39	The problem with this approach I find is it does not handle CR/LF translations too well.	n	['Usability']					90	15
449	3125927	3125927:1	which java http client library is easy to use for programmatically doing posts, setting cookies and maybe ajax?	o	['Documentation']					113	184
4140	1802915	1802915:25	No need to do the loop, and using just standard Java library classes: CODESNIPPET_JAVA1 .	o	['Usability']					91	23
2123	8938752	8938752:21	I mean does it save time?	n	['Others']					27	85
2995	1229273	1229273:36	(1) The JBoss5 kernel is not JMX based (JBoss 4 was, not 5).	o	['Security']					62	59
2136	8938752	8938752:34	Easier?	n	['Others']					9	85
2082	4706995	4706995:14	Shiro isn't going to give you OpenID, OAuth or Facebook integration out of the box, but chances are high you will need to customize that part to your application.	o	['Others']					164	87
3681	309424	309424:176	Thanks @trnl.	o	['Usability']					15	40
2992	1229273	1229273:33	The latest release in that family is GFv2.1, with a GFv2.1.1 release scheduled in October (see URL_https://blogs.oracle.com/theaquarium/entry/schedule_for_glassfish_v2_1 [ URL_https://blogs.oracle.com/theaquarium/entry/schedule_for_glassfish_v2_1 ] ).	o	['Security']					253	59
2028	20639844	20639844:31	much better.	o	['Others']					14	88
985	326390	326390:133	Agree that Java is long on high-level abstractions but short on convenience methods.	o	['Others']					86	134
704	1109307	1109307:48	Check out URL_http://www.rgagnon.com/javadetails/java-0542.html [this] tutorial, it's a really basic example.	p	['OnlySentiment']					111	155
3117	338586	338586:106	One thing that might be interesting wrt Jackson is the performance aspect (Jackson is specifically designed as a very high performance JSON package), see [ URL_http://code.google.com/p/thrift-protobuf-compare/wiki/Benchmarking ] and [ URL_http://www.cowtowncoder.com/blog/archives/2009/09/entry_326.html ].	n	['Usability', 'Others']					308	55
4047	354837	354837:35	Adding yet another layer of complexity, the application server may have global logging configurations that may not recognize local configurations for a particular web application.	n	['Usability']					181	27
4212	2971315	2971315:26	The re-sizing can get very degenerate.	n	['Usability']					40	21
539	5415111	5415111:25	Being a low level transport library HC 4.0 API was primarily optimised for performance and flexibility rather than simplicity.	o	['Documentation']					128	171
4315	309424	309424:23	@Ronald: Erm... never mind that.	o	['Usability']					34	16
3130	338586	338586:119	Just went through this exercise.	o	['Usability']					34	55
3473	3409608	3409608:23	The other 2 threads will finish, after which it takes the third thread (which seems to be mostly the first thread with the first chunk) 30 or more seconds to complete.	o	['Usability']		suggestion			169	46
1801	5304919	5304919:12	The problem is, the application is developed in Java not python.	n	['Others']					66	96
3653	309424	309424:148	new InputStreamReader(stream, UTF-8).	n	['Usability']					41	40
3885	660609	660609:31	The best sql parser for Java +1.	p	['Usability']					34	33
624	1359689	1359689:29	BTW the Java Almanac link from above now goes to Adult Friend Finder (surprise!	n	['OnlySentiment']					81	162
1140	49473	49473:8	Thanks in advance.	p	['Others']					20	125
1810	9887454	9887454:2	I developed code in Java using AWT.	o	['Others']					37	95
2888	483379	483379:65	You can attach to a Java 5 VM, but it doesn't show as much.	n	['Performance']		suggestion			61	62
417	395401	395401:12	With it, you just have to write this sort of method: CODESNIPPET_JAVA1 .	o	['Documentation']					74	188
4142	1802915	1802915:27	won't the code in Arrays.fill() contain a loop...	o	['Usability']					51	23
1969	408820	408820:95	 swing require javax.swing package.	p	['Others']					37	90
3131	338586	338586:120	I wanted to represent arbitrary JSON as nearest Java equivalent.	o	['Usability']					66	55
1178	992019	992019:26	@Nippysaurus Were you able to get this to work?	o	['Others']					49	122
3490	3409608	3409608:40	It will need a buffer to read the HTTP header reasonably, and probably handling chunked encoding.	o	['Usability']					99	45
250	410890	410890:39	Wow, didn't ever try that because it seemed too easy.	p	['Compatibility', 'Portability']					55	222
1219	992019	992019:67	The tiny key of DES can be broken in hours or days using a few thousand dollars worth of equipment.	n	['Others']					101	120
3763	312552	312552:16	With Hibernate v3.3.2.GA, _org.hibernate.pretty.Formatter_ doesn't exist anymore.You can use its replacement : _org.hibernate.jdbc.util.BasicFormatterImpl_ CODESNIPPET_JAVA1 .	p	['Usability']					177	37
3753	312552	312552:6	 Technology marches on.	o	['Usability']					25	37
101	5059224	5059224:17	They're defined in org.xml.sax.ContentHandler and there's an empty helper class DefaultHandler.	p	['Bug']	User-author	bounty points	fix code		97	287
4485	309424	309424:193	CODESNIPPET_JAVA1 .	o	[u'Usability']					21	4
3743	7250741	7250741:11	GraphXML files exported from yFiles (and yFiles based windows in DBVisualizer) can be edited / (re)formatted in the (free) yEd Graph editor.	o	['Usability']					142	38
2073	4706995	4706995:5	I know I'm asking a very simple and maybe a naive question.	n	['Others']					61	87
249	410890	410890:38	Not as elegant solution as I'd want it to be, but it works.	p	['Compatibility', 'Performance']		explain suggestion			61	222
427	395401	395401:22	I agree with the above comments about overriding CODETERM1 on your own classes (and about automating that process as much as possible).	o	['Documentation']					137	187
774	2356137	2356137:12	It will at highest only hit a few % from performance.	p	['OnlySentiment']					55	149
2716	26458	26458:152	[enter image description here]( URL_http://i.stack.imgur.com/h8VtN.png ) .	p	['Performance']					76	67
4377	309424	309424:85	However, I believe this is a very rare use case.	o	[u'Compatibility']					50	11
4324	309424	309424:32	 Thanks to a suggestion from URL_http://stackoverflow.com/users/101272/patrick [Patrick] , made the function more robust when handling an empty input stream.	n	['Usability']	author	Respond-to-complain			159	16
1196	992019	992019:44	Without salts, a dictionary attack could be used, enabling a pre-computed list of the most likely symmetric encryption keys.	o	['Others']					126	121
1697	3451935	3451935:83	Apache is an organization.	p	['Others']					28	100
1865	5828625	5828625:26	[3] The last public release of the appframework project is version 1.03.	o	['Others']					74	93
268	410890	410890:57	By the way, the same rationale applies to setters, but I'd use an IllegalArgumentException there.	o	['Compatibility', 'Usability']					99	217
2478	7358775	7358775:167	Seems like I've found the source of problem and it's fixed in later versions: URL_http://apache-pivot-users.399431.n3.nabble.com/Expanders-Cause-Increased-CPU - and-Memory-Use-td4022102.html.	o	['Others']		support suggestion			193	74
142	5059224	5059224:58	Look at vtd-XML, DOM and SAX are somewhat ancient APIs that has not been updated/improved for a while.	n	['Bug']					104	265
1214	992019	992019:62	A package that purports to offer security without requiring an understanding of the underlying principles seems dangerous prima facie.	n	['Others']					136	121
135	5059224	5059224:51	 You can use this parser if you want to parse large XML files and/or don't want to use a lot of memory.	p	['Bug']					105	268
997	326390	326390:145	This will change the newlines to the default newline choise.	o	['Others']					62	133
2524	7358775	7358775:213	you forgot for Java Desktop Aplication based on JSR296 as built-in Swing Framework in NetBeans excluding AWT and JavaFX are all of your desribed frameworks are based on Swing, if you'll start with Swing then you'd be understand (clearly) for all these Swing's (Based Frameworks) ATW, SWT (Eclipse), Java Desktop Aplication(Netbeans), SwingX, JGoodies all there frameworks (I don't know something more about JGoodies) incl.	o	['Others']					424	72
1459	4991084	4991084:51	With shiro it was quite easy.I am not expert of spring security or shiro, its just my personal experience as user of both.	p	['Others']					124	108
4367	309424	309424:75	@Guillaume Cot I guess the message here is that you never should be fine with the default encoding, since you cannot be sure of what it is, depending on the platform the java code is run on.	o	['Usability']					194	12
4242	2971315	2971315:56	Well, usually it's actually A + B + C because people are lazy ;) I tended to always use a StringBuilder, even if it was only two strings being concatenated, because in future, perhaps more strings would be appended.	n	['Usability']					223	20
2762	2994304	2994304:24	 Look and Feel: Even when Swing components are set to use the look and feel of the OS they are run on, they may not look like their native counterparts.	o	['Performance']					154	65
3116	338586	338586:105	since default serializations for different languages are different.	o	['Usability', 'Others']					69	55
1251	992019	992019:99	I've only got a couple other examples: URL_http://www.digizol.org/2009/10/java - encrypt-decrypt-jce-salt.html and URL_http://cs.saddleback.edu/rwatkins/CS4B/Crypto/FileEncryptor.html but they are not complete.	o	['Others']					212	119
3506	309424	309424:1	Read/convert an InputStream to a String.	o	['Usability']					42	44
150	5059224	5059224:66	JAXP is then implemented by different providers such as: Oracle, Apache, etc.	o	['Bug']					79	262
1821	9887454	9887454:13	Android has his own UI library :) so you need to write the code with the android UI standard you cannot use swing or awt in android UI :) For more details about android and java this is a important information you need to know The difference between Dalvik Virtual Machine and Java Virtual Machine and you'll get the all the points .	o	['Others']		suggestion	like		335	95
279	410890	410890:68	Changing a global variable, the state of an object or writing to a log is a side effect.	o	['Compatibility']					90	215
3436	267306	267306:40	It's a plain library and should work in SE and EE.	n	['Usability']					52	46
1637	3451935	3451935:23	@Thimmayya: then this is a rhetorical question.	n	['Others']					49	102
289	410890	410890:78	I generally do not chain getters like this where there is more than one nullable getter.	o	['Compatibility']					90	212
3826	5620985	5620985:42	No mysql, firebird etc.	n	['Usability']		suggestion			25	35
3889	660609	660609:35	Hibernate uses ANTLR for sql and hql parsing.	o	['Usability']					47	33
2666	26458	26458:102	I have tried a few and the closest I have found that comes close to Visual Studio is Netbeans.	p	['Performance']					96	69
3807	5620985	5620985:23	I've used both JOOQ and QueryDSL.	p	['Usability']					35	36
1886	408820	408820:12	:) Here are a couple: AWT is a cross-platform interface, so even though it uses the underlying OS or native GUI toolkit for its functionality, it doesn't provide access to everything that those toolkits can do.	n	['Others']					212	92
385	922779	922779:58	Your situation is what JMX is designed for (the M stands for Management).	p	['Documentation']					75	194
932	326390	326390:80	This one fails for empty files with a java.util.NoSuchElementException.	n	['OnlySentiment']					73	138
4254	2971315	2971315:68	Or CODESNIPPET_JAVA3 .	o	['Usability']					24	20
1115	49226	49226:23	I believe AES-128 doesn't require the unlimited strength JCE policy files.	o	['Others']					76	126
4197	2971315	2971315:11	A lot of overhead is wasted converting from String to StringBuffer and then back to String again.	n	['Usability']					99	21
4297	309424	309424:5	CODESNIPPET_JAVA1 .	o	['Usability']					21	18
2132	8938752	8938752:30	Doing all that stuff directly at the level of a servlet would be a lot of work, but JAXRS lets you focus much more on the resources within your application.	p	['Others']					158	85
741	3775694	3775694:21	should cause your code to delete the sub folders first.	o	['OnlySentiment']					57	152
2817	2994304	2994304:79	But for freestanding desktop apps, it is quite excellent and in wide use.	o	['Performance']					75	64
487	1728020	1728020:31	This allows the server to (in effect) initiate communications.	o	['Documentation']					64	179
